sex	date	hornL	hornR	season	month	day	yr	daynr	age	cohort	mass	density
M	11/09/1977	170	170	1977	9	11	1977	254	4	1973	23.7957	low
F	11/09/1977	150	150	1977	9	11	1977	254	3	1974	25.6394	low
M	18/09/1977	220	225	1977	9	18	1977	261	8	1969	33.9468	low
F	18/09/1977	170	180	1977	9	18	1977	261	1	1976	25.2737	low
M	25/09/1977	160	160	1977	9	25	1977	268	1	1976	21.5689	low
M	10/09/1978	235	240	1978	9	10	1978	253	9	1969	33.9468	low
M	10/09/1978	250	250	1978	9	10	1978	253	9	1969	36.7193	low
M	10/09/1978	200	200	1978	9	10	1978	253	4	1974	19.1909	low
M	10/09/1978	210	210	1978	9	10	1978	253	3	1975	27.4840	low
M	10/09/1978	206	206	1978	9	10	1978	253	3	1975	18.0000	low
M	10/09/1978	185	190	1978	9	10	1978	253	2	1976	25.6394	low
F	10/09/1978	160	160	1978	9	10	1978	253	2	1976	21.0319	low
M	11/09/1978	230	230	1978	9	11	1978	254	9	1969	32.5611	low
M	11/09/1978	225	220	1978	9	11	1978	254	2	1976	27.0000	low
M	11/09/1978	207	211	1978	9	11	1978	254	2	1976	20.0000	low
M	13/09/1978	200	205	1978	9	13	1978	256	4	1974	32.0993	low
F	14/09/1978	190	190	1978	9	14	1978	257	4	1974	26.0000	low
F	14/09/1978	180	180	1978	9	14	1978	257	4	1974	21.9529	low
F	14/09/1978	170	171	1978	9	14	1978	257	3	1975	19.1909	low
F	14/09/1978	171	170	1978	9	14	1978	257	3	1975	21.4924	low
F	14/09/1978	158	158	1978	9	14	1978	257	3	1975	21.0000	low
F	14/09/1978	160	160	1978	9	14	1978	257	3	1975	20.5000	low
M	14/09/1978	206	205	1978	9	14	1978	257	2	1976	22.0000	low
M	14/09/1978	135	135	1978	9	14	1978	257	1	1977	13.0000	low
M	14/09/1978	145	145	1978	9	14	1978	257	1	1977	14.0000	low
M	15/09/1978	210	210	1978	9	15	1978	258	5	1973	32.0993	low
M	15/09/1978	125	125	1978	9	15	1978	258	1	1977	13.5000	low
M	16/09/1978	212	210	1978	9	16	1978	259	3	1975	31.1759	low
M	16/09/1978	218	215	1978	9	16	1978	259	2	1976	25.0000	low
F	17/09/1978	190	190	1978	9	17	1978	260	5	1973	21.0319	low
M	17/09/1978	209	212	1978	9	17	1978	260	4	1974	26.5616	low
M	17/09/1978	222	222	1978	9	17	1978	260	4	1974	24.7174	low
F	17/09/1978	164	163	1978	9	17	1978	260	4	1974	18.2708	low
F	17/09/1978	165	165	1978	9	17	1978	260	3	1975	18.0000	low
M	21/09/1978	244	247	1978	9	21	1978	264	11	1967	29.3296	low
M	21/09/1978	225	225	1978	9	21	1978	264	9	1969	32.0993	low
M	21/09/1978	207	215	1978	9	21	1978	264	4	1974	26.0000	low
M	24/09/1978	230	230	1978	9	24	1978	267	8	1970	33.0000	low
M	24/09/1978	225	226	1978	9	24	1978	267	5	1973	29.3296	low
F	24/09/1978	190	190	1978	9	24	1978	267	5	1973	18.9857	low
M	24/09/1978	190	189	1978	9	24	1978	267	4	1974	32.0993	low
M	24/09/1978	226	225	1978	9	24	1978	267	4	1974	27.4840	low
M	24/09/1978	142	143	1978	9	24	1978	267	1	1977	15.5125	low
F	27/09/1978	172	172	1978	9	27	1978	270	4	1974	21.9529	low
M	28/09/1978	205	208	1978	9	28	1978	271	4	1974	31.1759	low
M	30/09/1978	210	210	1978	9	30	1978	273	4	1974	26.5616	low
F	01/10/1978	172	172	1978	10	1	1978	274	4	1974	21.9529	low
F	01/10/1978	175	172	1978	10	1	1978	274	3	1975	18.2708	low
M	01/11/1978	215	215	1978	11	1	1978	305	4	1974	29.0000	low
F	16/09/1979	170	180	1979	9	16	1979	259	6	1973	26.5616	low
F	16/09/1979	162	160	1979	9	16	1979	259	6	1973	23.7957	low
M	16/09/1979	217	220	1979	9	16	1979	259	4	1975	31.0000	low
M	16/09/1979	195	195	1979	9	16	1979	259	3	1976	24.7174	low
M	16/09/1979	193	195	1979	9	16	1979	259	3	1976	26.5616	low
M	16/09/1979	198	201	1979	9	16	1979	259	3	1976	32.0993	low
M	16/09/1979	210	215	1979	9	16	1979	259	2	1977	28.4067	low
M	16/09/1979	187	188	1979	9	16	1979	259	2	1977	25.0000	low
M	16/09/1979	150	150	1979	9	16	1979	259	1	1978	18.2708	low
M	16/09/1979	163	162	1979	9	16	1979	259	1	1978	24.7174	low
M	17/09/1979	230	233	1979	9	17	1979	260	7	1972	27.4840	low
F	17/09/1979	180	180	1979	9	17	1979	260	2	1977	19.1909	low
M	19/09/1979	200	195	1979	9	19	1979	262	2	1977	21.0319	low
M	20/09/1979	240	245	1979	9	20	1979	263	10	1969	35.0000	low
F	20/09/1979	170	171	1979	9	20	1979	263	3	1976	24.0000	low
M	20/09/1979	218	215	1979	9	20	1979	263	3	1976	33.0230	low
M	20/09/1979	200	198	1979	9	20	1979	263	2	1977	24.7174	low
F	20/09/1979	109	109	1979	9	20	1979	263	1	1978	13.6755	low
F	20/09/1979	148	148	1979	9	20	1979	263	1	1978	20.0917	low
M	20/09/1979	156	158	1979	9	20	1979	263	1	1978	16.4316	low
F	20/09/1979	112	111	1979	9	20	1979	263	1	1978	15.5125	low
M	23/09/1979	165	165	1979	9	23	1979	266	1	1978	17.3510	low
F	26/09/1979	185	186	1979	9	26	1979	269	6	1973	24.7174	low
F	26/09/1979	185	184	1979	9	26	1979	269	6	1973	22.8742	low
F	26/09/1979	200	201	1979	9	26	1979	269	4	1975	21.0319	low
F	26/09/1979	159	163	1979	9	26	1979	269	4	1975	22.8742	low
M	27/09/1979	219	214	1979	9	27	1979	270	6	1973	28.4067	low
F	27/09/1979	110	110	1979	9	27	1979	270	1	1978	14.5938	low
M	27/09/1979	178	178	1979	9	27	1979	270	1	1978	20.1113	low
F	29/09/1979	178	175	1979	9	29	1979	272	4	1975	30.4853	low
M	29/09/1979	176	181	1979	9	29	1979	272	1	1978	19.1909	low
M	30/09/1979	187	184	1979	9	30	1979	273	6	1973	28.0000	low
F	30/09/1979	174	171	1979	9	30	1979	273	3	1976	21.0319	low
F	04/10/1979	190	190	1979	10	4	1979	277	3	1976	26.0000	low
F	04/10/1979	182	177	1979	10	4	1979	277	3	1976	21.0000	low
M	04/10/1979	164	160	1979	10	4	1979	277	2	1977	19.0000	low
F	04/10/1979	127	125	1979	10	4	1979	277	1	1978	24.0000	low
M	07/10/1979	205	207	1979	10	7	1979	280	4	1975	28.4067	low
F	30/10/1979	168	170	1979	10	30	1979	303	4	1975	21.0319	low
M	14/09/1980	210	210	1980	9	14	1980	257	6	1974	33.9468	low
F	14/09/1980	180	170	1980	9	14	1980	257	5	1975	22.0000	low
F	14/09/1980	210	220	1980	9	14	1980	257	5	1975	26.0000	low
M	14/09/1980	221	221	1980	9	14	1980	257	5	1975	27.4840	low
M	14/09/1980	201	201	1980	9	14	1980	257	5	1975	25.6394	low
M	14/09/1980	235	232	1980	9	14	1980	257	4	1976	35.7949	low
M	14/09/1980	175	170	1980	9	14	1980	257	3	1977	21.0319	low
M	14/09/1980	110	110	1980	9	14	1980	257	1	1979	15.0000	low
M	14/09/1980	150	150	1980	9	14	1980	257	1	1979	22.0000	low
M	17/09/1980	240	235	1980	9	17	1980	260	4	1976	40.0000	low
M	18/09/1980	215	210	1980	9	18	1980	261	6	1974	26.5616	low
M	18/09/1980	215	215	1980	9	18	1980	261	4	1976	27.0000	low
M	18/09/1980	206	208	1980	9	18	1980	261	4	1976	25.0000	low
F	18/09/1980	185	184	1980	9	18	1980	261	4	1976	30.2526	low
M	18/09/1980	190	190	1980	9	18	1980	261	3	1977	24.0000	low
F	18/09/1980	200	220	1980	9	18	1980	261	3	1977	28.5000	low
M	21/09/1980	215	210	1980	9	21	1980	264	3	1977	29.0000	low
M	21/09/1980	193	195	1980	9	21	1980	264	2	1978	23.7957	low
M	25/09/1980	245	240	1980	9	25	1980	268	6	1974	33.9468	low
M	25/09/1980	205	205	1980	9	25	1980	268	4	1976	27.4840	low
M	25/09/1980	230	225	1980	9	25	1980	268	4	1976	32.0000	low
M	25/09/1980	175	175	1980	9	25	1980	268	3	1977	22.0000	low
M	25/09/1980	180	180	1980	9	25	1980	268	2	1978	24.0000	low
F	25/09/1980	164	160	1980	9	25	1980	268	2	1978	20.0917	low
F	28/09/1980	183	179	1980	9	28	1980	271	4	1976	16.4316	low
M	02/10/1980	216	216	1980	10	2	1980	275	3	1977	22.8742	low
F	09/10/1980	32	34	1980	10	9	1980	282	0	1980	12.0275	low
M	16/10/1980	205	205	1980	10	16	1980	289	13	1967	32.7267	low
F	16/10/1980	180	180	1980	10	16	1980	289	5	1975	19.1909	low
F	16/10/1980	180	180	1980	10	16	1980	289	5	1975	21.0000	low
F	03/11/1980	190	195	1980	11	3	1980	307	3	1977	21.0319	low
F	03/11/1980	190	195	1980	11	3	1980	307	3	1977	21.0319	low
F	06/11/1980	105	110	1980	11	6	1980	310	1	1979	16.0000	low
F	16/11/1980	178	185	1980	11	16	1980	320	3	1977	17.8816	low
F	16/11/1980	65	60	1980	11	16	1980	320	0	1980	10.2126	low
M	19/11/1980	230	230	1980	11	19	1980	323	6	1974	28.0000	low
M	13/01/1981	80	85	1980	1	13	1981	378	0	1980	9.8507	low
F	08/10/1981	170	165	1981	10	8	1981	281	5	1976	18.0000	low
M	09/10/1981	160	150	1981	10	9	1981	282	1	1980	16.0000	low
F	13/10/1981	143	140	1981	10	13	1981	286	4	1977	15.0000	low
M	12/09/1982	190	190	1982	9	12	1982	255	5	1977	22.8742	low
M	12/09/1982	191	191	1982	9	12	1982	255	3	1979	21.0319	low
M	12/09/1982	207	210	1982	9	12	1982	255	3	1979	28.8681	low
M	12/09/1982	199	193	1982	9	12	1982	255	3	1979	25.0000	low
M	12/09/1982	211	217	1982	9	12	1982	255	3	1979	27.0000	low
M	12/09/1982	191	194	1982	9	12	1982	255	3	1979	21.0319	low
M	12/09/1982	205	210	1982	9	12	1982	255	3	1979	23.7957	low
M	12/09/1982	220	217	1982	9	12	1982	255	3	1979	29.3296	low
M	12/09/1982	164	164	1982	9	12	1982	255	2	1980	23.0000	low
F	12/09/1982	136	137	1982	9	12	1982	255	2	1980	20.1113	low
M	12/09/1982	211	211	1982	9	12	1982	255	2	1980	25.6394	low
M	12/09/1982	153	156	1982	9	12	1982	255	1	1981	19.1909	low
M	12/09/1982	172	172	1982	9	12	1982	255	1	1981	22.8742	low
F	12/09/1982	121	118	1982	9	12	1982	255	1	1981	15.0000	low
F	12/09/1982	136	141	1982	9	12	1982	255	1	1981	21.9529	low
F	13/09/1982	123	124	1982	9	13	1982	256	1	1981	19.0000	low
M	15/09/1982	212	202	1982	9	15	1982	258	2	1980	28.0000	low
M	15/09/1982	150	151	1982	9	15	1982	258	1	1981	21.0000	low
F	16/09/1982	205	207	1982	9	16	1982	259	6	1976	28.0000	low
M	16/09/1982	231	224	1982	9	16	1982	259	2	1980	29.0000	low
M	16/09/1982	176	178	1982	9	16	1982	259	1	1981	20.0000	low
M	18/09/1982	204	210	1982	9	18	1982	261	3	1979	30.2526	low
M	19/09/1982	221	225	1982	9	19	1982	262	6	1976	24.7174	low
M	19/09/1982	190	194	1982	9	19	1982	262	2	1980	20.1113	low
M	19/09/1982	173	173	1982	9	19	1982	262	1	1981	22.8742	low
F	22/09/1982	217	210	1982	9	22	1982	265	7	1975	30.2526	low
M	26/09/1982	162	163	1982	9	26	1982	269	1	1981	17.3510	low
M	29/09/1982	203	201	1982	9	29	1982	272	4	1978	32.0993	low
M	29/09/1982	202	209	1982	9	29	1982	272	2	1980	25.6394	low
F	30/09/1982	212	213	1982	9	30	1982	273	9	1973	28.0000	low
F	02/10/1982	165	170	1982	10	2	1982	275	1	1981	22.8742	low
F	03/10/1982	174	175	1982	10	3	1982	276	3	1979	14.9466	low
F	03/10/1982	140	140	1982	10	3	1982	276	1	1981	18.0000	low
F	03/10/1982	99	100	1982	10	3	1982	276	1	1981	17.0000	low
M	07/10/1982	221	222	1982	10	7	1982	280	6	1976	29.3296	low
M	07/10/1982	188	185	1982	10	7	1982	280	1	1981	18.2708	low
M	09/10/1982	123	121	1982	10	9	1982	282	1	1981	15.0000	low
M	30/10/1982	229	231	1982	10	30	1982	303	6	1976	32.0000	low
F	31/10/1982	160	140	1982	10	31	1982	304	2	1980	19.1909	low
M	31/10/1982	165	160	1982	10	31	1982	304	1	1981	18.2708	low
M	04/11/1982	170	172	1982	11	4	1982	308	1	1981	22.0000	low
M	04/11/1982	145	135	1982	11	4	1982	308	1	1981	17.0000	low
F	06/11/1982	205	220	1982	11	6	1982	310	9	1973	17.0000	low
M	07/11/1982	210	208	1982	11	7	1982	311	3	1979	26.0000	low
F	28/11/1982	195	200	1982	11	28	1982	332	7	1975	20.1113	low
F	03/12/1982	120	122	1982	12	3	1982	337	1	1981	16.0000	low
F	05/12/1982	180	180	1982	12	5	1982	339	6	1976	19.1909	low
M	08/12/1982	185	183	1982	12	8	1982	342	1	1981	20.1113	low
M	09/12/1982	210	215	1982	12	9	1982	343	3	1979	15.6789	low
M	11/09/1983	220	225	1983	9	11	1983	254	9	1974	32.0000	low
F	11/09/1983	175	175	1983	9	11	1983	254	6	1977	24.0000	low
M	11/09/1983	230	230	1983	9	11	1983	254	5	1978	30.0000	low
M	11/09/1983	225	220	1983	9	11	1983	254	4	1979	29.0000	low
F	11/09/1983	186	190	1983	9	11	1983	254	2	1981	21.0319	low
M	11/09/1983	165	165	1983	9	11	1983	254	2	1981	18.5000	low
M	11/09/1983	190	185	1983	9	11	1983	254	2	1981	26.0000	low
M	11/09/1983	235	235	1983	9	11	1983	254	2	1981	27.0000	low
M	11/09/1983	145	145	1983	9	11	1983	254	1	1982	18.0000	low
F	14/09/1983	195	195	1983	9	14	1983	257	12	1971	16.0000	low
M	14/09/1983	210	210	1983	9	14	1983	257	8	1975	29.0000	low
F	14/09/1983	165	165	1983	9	14	1983	257	7	1976	24.0000	low
M	14/09/1983	205	205	1983	9	14	1983	257	6	1977	25.0000	low
M	14/09/1983	205	195	1983	9	14	1983	257	5	1978	24.0000	low
M	14/09/1983	215	225	1983	9	14	1983	257	5	1978	29.0000	low
F	14/09/1983	160	165	1983	9	14	1983	257	2	1981	21.0000	low
M	14/09/1983	135	135	1983	9	14	1983	257	1	1982	18.0000	low
M	14/09/1983	195	205	1983	9	14	1983	257	1	1982	21.0319	low
F	15/09/1983	185	175	1983	9	15	1983	258	7	1976	20.0000	low
M	15/09/1983	165	165	1983	9	15	1983	258	5	1978	22.0000	low
F	15/09/1983	185	185	1983	9	15	1983	258	5	1978	19.0000	low
M	15/09/1983	190	185	1983	9	15	1983	258	2	1981	19.1909	low
F	21/09/1983	225	212	1983	9	21	1983	264	12	1971	32.0000	low
M	21/09/1983	242	246	1983	9	21	1983	264	11	1972	38.5684	low
F	21/09/1983	177	176	1983	9	21	1983	264	11	1972	17.0000	low
F	21/09/1983	213	218	1983	9	21	1983	264	10	1973	18.2708	low
M	21/09/1983	226	217	1983	9	21	1983	264	3	1980	27.4840	low
F	21/09/1983	190	200	1983	9	21	1983	264	3	1980	22.8742	low
F	21/09/1983	160	162	1983	9	21	1983	264	2	1981	23.5000	low
F	21/09/1983	132	138	1983	9	21	1983	264	1	1982	14.5938	low
F	23/09/1983	220	220	1983	9	23	1983	266	12	1971	28.0000	low
F	23/09/1983	181	181	1983	9	23	1983	266	4	1979	24.0000	low
M	24/09/1983	240	235	1983	9	24	1983	267	6	1977	33.0000	low
F	24/09/1983	166	161	1983	9	24	1983	267	2	1981	18.0000	low
M	24/09/1983	142	141	1983	9	24	1983	267	1	1982	15.5125	low
M	25/09/1983	221	214	1983	9	25	1983	268	4	1979	24.0000	low
F	26/09/1983	165	165	1983	9	26	1983	269	6	1977	20.1113	low
M	26/09/1983	228	228	1983	9	26	1983	269	5	1978	31.0000	low
F	26/09/1983	171	176	1983	9	26	1983	269	3	1980	22.0000	low
F	28/09/1983	200	200	1983	9	28	1983	271	5	1978	23.0000	low
M	28/09/1983	171	173	1983	9	28	1983	271	1	1982	21.0319	low
M	29/09/1983	147	144	1983	9	29	1983	272	1	1982	15.5125	low
F	30/09/1983	175	175	1983	9	30	1983	273	2	1981	23.0000	low
F	02/10/1983	189	185	1983	10	2	1983	275	4	1979	22.8742	low
F	03/10/1983	161	166	1983	10	3	1983	276	8	1975	19.1909	low
M	03/10/1983	160	160	1983	10	3	1983	276	1	1982	19.1909	low
F	05/10/1983	190	192	1983	10	5	1983	278	4	1979	21.0319	low
F	07/10/1983	165	170	1983	10	7	1983	280	6	1977	23.7957	low
F	07/10/1983	191	193	1983	10	7	1983	280	5	1978	21.9529	low
M	09/10/1983	238	237	1983	10	9	1983	282	5	1978	33.0230	low
F	10/10/1983	200	205	1983	10	10	1983	283	6	1977	27.0000	low
F	12/10/1983	205	207	1983	10	12	1983	285	10	1973	18.2708	low
F	12/10/1983	165	165	1983	10	12	1983	285	8	1975	22.0000	low
M	12/10/1983	215	215	1983	10	12	1983	285	7	1976	32.0993	low
F	16/10/1983	108	109	1983	10	16	1983	289	1	1982	15.5125	low
F	17/10/1983	175	180	1983	10	17	1983	290	5	1978	21.9529	low
F	17/10/1983	165	167	1983	10	17	1983	290	5	1978	21.9529	low
M	19/10/1983	222	219	1983	10	19	1983	292	10	1973	34.8708	low
M	19/10/1983	225	230	1983	10	19	1983	292	6	1977	27.0000	low
F	22/10/1983	204	208	1983	10	22	1983	295	9	1974	24.0000	low
M	22/10/1983	215	220	1983	10	22	1983	295	3	1980	31.0000	low
M	22/10/1983	172	174	1983	10	22	1983	295	2	1981	23.7957	low
F	23/10/1983	153	154	1983	10	23	1983	296	2	1981	22.0000	low
F	24/10/1983	183	185	1983	10	24	1983	297	8	1975	28.0000	low
M	27/10/1983	196	197	1983	10	27	1983	300	2	1981	28.4067	low
F	27/10/1983	137	139	1983	10	27	1983	300	1	1982	25.6394	low
F	28/10/1983	192	195	1983	10	28	1983	301	2	1981	24.7174	low
F	28/10/1983	169	175	1983	10	28	1983	301	2	1981	20.1113	low
M	29/10/1983	192	192	1983	10	29	1983	302	2	1981	23.0000	low
M	30/10/1983	194	196	1983	10	30	1983	303	1	1982	18.2708	low
M	30/10/1983	170	170	1983	10	30	1983	303	1	1982	19.1909	low
M	01/11/1983	228	226	1983	11	1	1983	305	4	1979	27.0000	low
M	03/11/1983	210	210	1983	11	3	1983	307	4	1979	28.9936	low
M	11/11/1983	188	180	1983	11	11	1983	315	1	1982	20.1113	low
F	14/11/1983	243	249	1983	11	14	1983	318	7	1976	16.4316	low
M	16/11/1983	185	182	1983	11	16	1983	320	1	1982	20.0000	low
F	19/11/1983	191	192	1983	11	19	1983	323	11	1972	21.0319	low
M	20/11/1983	192	192	1983	11	20	1983	324	2	1981	21.0000	low
F	03/12/1983	190	186	1983	12	3	1983	337	6	1977	20.1113	low
M	03/12/1983	190	190	1983	12	3	1983	337	3	1980	20.1113	low
F	03/12/1983	142	142	1983	12	3	1983	337	2	1981	19.1909	low
M	04/12/1983	212	212	1983	12	4	1983	338	3	1980	21.0319	low
F	17/12/1983	134	135	1983	12	17	1983	351	1	1982	16.4316	low
F	27/12/1983	195	195	1983	12	27	1983	361	11	1972	21.0319	low
F	01/01/1984	190	185	1983	1	1	1984	366	4	1979	25.0000	low
F	09/09/1984	165	162	1984	9	9	1984	252	6	1978	23.0000	low
F	09/09/1984	155	155	1984	9	9	1984	252	2	1982	20.1113	low
M	09/09/1984	221	219	1984	9	9	1984	252	2	1982	23.7957	low
M	09/09/1984	156	162	1984	9	9	1984	252	1	1983	17.3510	low
M	09/09/1984	203	203	1984	9	9	1984	252	1	1983	22.0000	low
M	09/09/1984	178	175	1984	9	9	1984	252	1	1983	21.0319	low
F	12/09/1984	179	181	1984	9	12	1984	255	9	1975	16.4316	low
M	12/09/1984	230	225	1984	9	12	1984	255	3	1981	29.3296	low
M	12/09/1984	222	226	1984	9	12	1984	255	2	1982	29.0000	low
M	12/09/1984	213	216	1984	9	12	1984	255	2	1982	30.2526	low
M	12/09/1984	146	147	1984	9	12	1984	255	1	1983	19.0000	low
F	12/09/1984	136	134	1984	9	12	1984	255	1	1983	17.3510	low
F	13/09/1984	170	170	1984	9	13	1984	256	4	1980	21.9529	low
M	13/09/1984	213	220	1984	9	13	1984	256	3	1981	31.1759	low
M	13/09/1984	160	158	1984	9	13	1984	256	1	1983	18.2708	low
F	15/09/1984	158	160	1984	9	15	1984	258	2	1982	17.3510	low
F	16/09/1984	168	159	1984	9	16	1984	259	2	1982	19.1909	low
M	16/09/1984	200	202	1984	9	16	1984	259	2	1982	27.0000	low
F	16/09/1984	178	177	1984	9	16	1984	259	2	1982	20.0000	low
M	19/09/1984	213	215	1984	9	19	1984	262	2	1982	25.0000	low
M	19/09/1984	220	219	1984	9	19	1984	262	2	1982	26.0000	low
M	19/09/1984	170	172	1984	9	19	1984	262	1	1983	21.0319	low
F	19/09/1984	140	145	1984	9	19	1984	262	1	1983	23.0000	low
F	21/09/1984	185	182	1984	9	21	1984	264	10	1974	19.1909	low
F	21/09/1984	193	190	1984	9	21	1984	264	9	1975	22.8742	low
M	22/09/1984	198	187	1984	9	22	1984	265	5	1979	31.1759	low
M	23/09/1984	220	218	1984	9	23	1984	266	3	1981	32.0000	low
F	23/09/1984	135	137	1984	9	23	1984	266	1	1983	17.8108	low
F	24/09/1984	187	193	1984	9	24	1984	267	11	1973	23.7957	low
F	24/09/1984	222	219	1984	9	24	1984	267	10	1974	21.0319	low
F	24/09/1984	184	177	1984	9	24	1984	267	9	1975	22.8742	low
F	24/09/1984	185	189	1984	9	24	1984	267	3	1981	19.1909	low
M	26/09/1984	199	202	1984	9	26	1984	269	3	1981	19.5000	low
M	26/09/1984	230	230	1984	9	26	1984	269	2	1982	27.4840	low
F	26/09/1984	150	145	1984	9	26	1984	269	1	1983	21.9529	low
M	27/09/1984	217	216	1984	9	27	1984	270	7	1977	30.0000	low
M	27/09/1984	182	183	1984	9	27	1984	270	4	1980	22.8742	low
M	27/09/1984	150	147	1984	9	27	1984	270	1	1983	19.0000	low
F	28/09/1984	168	168	1984	9	28	1984	271	5	1979	21.0319	low
F	29/09/1984	193	193	1984	9	29	1984	272	3	1981	25.6394	low
M	29/09/1984	187	193	1984	9	29	1984	272	2	1982	23.7957	low
M	30/09/1984	193	190	1984	9	30	1984	273	2	1982	29.3296	low
F	30/09/1984	126	129	1984	9	30	1984	273	1	1983	20.5000	low
F	01/10/1984	190	170	1984	10	1	1984	274	9	1975	24.0000	low
F	01/10/1984	217	214	1984	10	1	1984	274	9	1975	24.2565	low
F	01/10/1984	177	172	1984	10	1	1984	274	7	1977	20.1113	low
M	01/10/1984	207	209	1984	10	1	1984	274	3	1981	27.0228	low
F	04/10/1984	145	148	1984	10	4	1984	277	1	1983	19.1909	low
F	05/10/1984	201	202	1984	10	5	1984	278	9	1975	21.4924	low
M	07/10/1984	210	210	1984	10	7	1984	280	4	1980	25.6394	low
F	08/10/1984	202	206	1984	10	8	1984	281	8	1976	17.0000	low
F	08/10/1984	185	185	1984	10	8	1984	281	6	1978	20.8299	low
M	11/10/1984	215	210	1984	10	11	1984	284	3	1981	28.0000	low
M	15/10/1984	222	219	1984	10	15	1984	288	4	1980	27.0228	low
F	18/10/1984	163	165	1984	10	18	1984	291	10	1974	20.8299	low
M	22/10/1984	170	170	1984	10	22	1984	295	2	1982	20.8299	low
F	24/10/1984	203	203	1984	10	24	1984	297	7	1977	23.7957	low
F	24/10/1984	215	210	1984	10	24	1984	297	7	1977	25.6394	low
M	24/10/1984	200	204	1984	10	24	1984	297	4	1980	22.8742	low
F	24/10/1984	210	220	1984	10	24	1984	297	2	1982	20.1113	low
F	25/10/1984	200	200	1984	10	25	1984	298	6	1978	27.0228	low
M	28/10/1984	206	207	1984	10	28	1984	301	2	1982	23.7957	low
M	28/10/1984	218	213	1984	10	28	1984	301	2	1982	28.4067	low
M	03/11/1984	203	214	1984	11	3	1984	307	4	1980	25.0000	low
F	04/11/1984	182	185	1984	11	4	1984	308	3	1981	21.0319	low
F	08/11/1984	202	185	1984	11	8	1984	312	7	1977	15.5125	low
M	11/11/1984	130	135	1984	11	11	1984	315	2	1982	18.2708	low
F	11/11/1984	144	145	1984	11	11	1984	315	1	1983	21.0000	low
F	17/11/1984	185	187	1984	11	17	1984	321	6	1978	20.0000	low
F	18/11/1984	195	200	1984	11	18	1984	322	9	1975	23.7957	low
F	24/11/1984	212	212	1984	11	24	1984	328	7	1977	27.4840	low
F	25/11/1984	178	180	1984	11	25	1984	329	11	1973	23.7957	low
F	25/11/1984	160	152	1984	11	25	1984	329	2	1982	21.0319	low
M	25/11/1984	176	178	1984	11	25	1984	329	1	1983	16.4316	low
F	28/11/1984	173	175	1984	11	28	1984	332	10	1974	23.7957	low
F	28/11/1984	172	168	1984	11	28	1984	332	3	1981	20.1113	low
M	28/11/1984	180	180	1984	11	28	1984	332	3	1981	19.1909	low
M	03/12/1984	157	157	1984	12	3	1984	337	1	1983	15.5125	low
M	08/12/1984	183	183	1984	12	8	1984	342	1	1983	23.0000	low
M	12/12/1984	202	208	1984	12	12	1984	346	4	1980	20.1113	low
F	16/12/1984	200	205	1984	12	16	1984	350	7	1977	21.0000	low
M	16/12/1984	235	230	1984	12	16	1984	350	3	1981	22.0000	low
F	20/12/1984	180	190	1984	12	20	1984	354	7	1977	22.8742	low
M	23/12/1984	200	203	1984	12	23	1984	357	1	1983	21.0319	low
M	26/12/1984	222	222	1984	12	26	1984	360	3	1981	15.5125	low
F	27/12/1984	160	160	1984	12	27	1984	361	7	1977	16.0000	low
M	27/12/1984	181	188	1984	12	27	1984	361	2	1982	20.0000	low
M	13/09/1987	240	240	1987	9	13	1987	256	5	1982	31.1759	low
M	13/09/1987	225	223	1987	9	13	1987	256	4	1983	33.9468	low
M	13/09/1987	216	216	1987	9	13	1987	256	4	1983	25.6394	low
M	13/09/1987	213	210	1987	9	13	1987	256	3	1984	26.0000	low
F	13/09/1987	173	170	1987	9	13	1987	256	3	1984	21.9529	low
F	13/09/1987	160	160	1987	9	13	1987	256	2	1985	20.1113	low
M	13/09/1987	193	200	1987	9	13	1987	256	2	1985	23.7957	low
M	13/09/1987	172	173	1987	9	13	1987	256	1	1986	20.0000	low
M	13/09/1987	165	165	1987	9	13	1987	256	1	1986	13.0000	low
F	13/09/1987	143	142	1987	9	13	1987	256	1	1986	20.0000	low
M	13/09/1987	170	168	1987	9	13	1987	256	1	1986	22.0000	low
M	13/09/1987	155	155	1987	9	13	1987	256	1	1986	18.2708	low
M	13/09/1987	173	176	1987	9	13	1987	256	1	1986	21.0319	low
M	15/09/1987	210	208	1987	9	15	1987	258	2	1985	26.5616	low
M	15/09/1987	162	162	1987	9	15	1987	258	1	1986	19.0000	low
M	16/09/1987	236	233	1987	9	16	1987	259	5	1982	30.2526	low
M	16/09/1987	205	208	1987	9	16	1987	259	5	1982	22.8742	low
M	16/09/1987	228	223	1987	9	16	1987	259	3	1984	26.0000	low
M	16/09/1987	140	150	1987	9	16	1987	259	2	1985	26.1005	low
M	16/09/1987	178	174	1987	9	16	1987	259	1	1986	21.0319	low
M	16/09/1987	32	30	1987	9	16	1987	259	0	1987	10.0070	low
M	17/09/1987	208	208	1987	9	17	1987	260	2	1985	23.0000	low
F	17/09/1987	115	120	1987	9	17	1987	260	1	1986	18.2708	low
F	17/09/1987	135	135	1987	9	17	1987	260	1	1986	18.2708	low
M	19/09/1987	208	211	1987	9	19	1987	262	2	1985	21.0319	low
M	19/09/1987	170	170	1987	9	19	1987	262	1	1986	18.2708	low
M	20/09/1987	221	223	1987	9	20	1987	263	5	1982	30.2526	low
F	20/09/1987	198	203	1987	9	20	1987	263	4	1983	20.0000	low
F	20/09/1987	153	163	1987	9	20	1987	263	2	1985	17.0000	low
F	21/09/1987	115	117	1987	9	21	1987	264	1	1986	15.5125	low
M	21/09/1987	154	154	1987	9	21	1987	264	1	1986	15.9720	low
M	21/09/1987	125	120	1987	9	21	1987	264	1	1986	13.6755	low
M	23/09/1987	223	224	1987	9	23	1987	266	3	1984	29.0000	low
M	23/09/1987	218	222	1987	9	23	1987	266	3	1984	31.0000	low
F	23/09/1987	172	174	1987	9	23	1987	266	2	1985	20.0000	low
M	23/09/1987	210	212	1987	9	23	1987	266	2	1985	31.1759	low
F	23/09/1987	120	121	1987	9	23	1987	266	1	1986	18.2708	low
F	24/09/1987	195	195	1987	9	24	1987	267	4	1983	22.8742	low
M	24/09/1987	202	206	1987	9	24	1987	267	3	1984	30.2526	low
F	24/09/1987	120	120	1987	9	24	1987	267	1	1986	19.1909	low
M	24/09/1987	163	163	1987	9	24	1987	267	1	1986	18.2708	low
F	25/09/1987	25	25	1987	9	25	1987	268	0	1987	10.0070	low
M	26/09/1987	225	200	1987	9	26	1987	269	8	1979	27.4840	low
F	26/09/1987	198	192	1987	9	26	1987	269	6	1981	23.0000	low
F	26/09/1987	170	170	1987	9	26	1987	269	3	1984	22.8742	low
F	26/09/1987	180	180	1987	9	26	1987	269	3	1984	23.7957	low
M	27/09/1987	211	213	1987	9	27	1987	270	3	1984	27.0000	low
M	27/09/1987	214	220	1987	9	27	1987	270	3	1984	28.5000	low
M	27/09/1987	142	140	1987	9	27	1987	270	1	1986	18.0000	low
M	27/09/1987	167	165	1987	9	27	1987	270	1	1986	20.1113	low
F	30/09/1987	200	210	1987	9	30	1987	273	14	1973	32.0993	low
F	30/09/1987	168	168	1987	9	30	1987	273	3	1984	24.0000	low
M	01/10/1987	218	218	1987	10	1	1987	274	2	1985	27.0000	low
M	02/10/1987	206	208	1987	10	2	1987	275	3	1984	26.0000	low
F	03/10/1987	210	210	1987	10	3	1987	276	11	1976	30.0000	low
F	03/10/1987	185	188	1987	10	3	1987	276	4	1983	20.5000	low
M	04/10/1987	215	213	1987	10	4	1987	277	3	1984	26.0000	low
M	04/10/1987	165	167	1987	10	4	1987	277	1	1986	25.0000	low
M	05/10/1987	142	144	1987	10	5	1987	278	1	1986	17.3510	low
M	07/10/1987	200	196	1987	10	7	1987	280	2	1985	21.0319	low
M	09/10/1987	210	200	1987	10	9	1987	282	8	1979	28.4067	low
F	09/10/1987	122	123	1987	10	9	1987	282	1	1986	17.3510	low
M	10/10/1987	236	228	1987	10	10	1987	283	14	1973	29.3296	low
M	10/10/1987	170	174	1987	10	10	1987	283	1	1986	22.8742	low
F	11/10/1987	184	186	1987	10	11	1987	284	5	1982	24.5000	low
M	11/10/1987	190	223	1987	10	11	1987	284	3	1984	21.9529	low
M	11/10/1987	165	170	1987	10	11	1987	284	1	1986	14.5938	low
M	12/10/1987	140	140	1987	10	12	1987	285	1	1986	15.5125	low
F	16/10/1987	200	200	1987	10	16	1987	289	5	1982	24.2565	low
M	16/10/1987	188	188	1987	10	16	1987	289	1	1986	19.1909	low
M	18/10/1987	238	240	1987	10	18	1987	291	7	1980	32.0000	low
F	19/10/1987	176	182	1987	10	19	1987	292	2	1985	18.2708	low
M	19/10/1987	157	157	1987	10	19	1987	292	1	1986	18.2708	low
M	24/10/1987	255	253	1987	10	24	1987	297	4	1983	36.5000	low
F	24/10/1987	175	178	1987	10	24	1987	297	3	1984	21.0319	low
F	24/10/1987	145	150	1987	10	24	1987	297	2	1985	21.0319	low
F	28/10/1987	230	230	1987	10	28	1987	301	8	1979	27.4840	low
M	28/10/1987	200	200	1987	10	28	1987	301	3	1984	28.0000	low
M	28/10/1987	190	190	1987	10	28	1987	301	2	1985	21.0000	low
M	28/10/1987	150	150	1987	10	28	1987	301	1	1986	20.0000	low
M	03/11/1987	230	234	1987	11	3	1987	307	4	1983	23.7957	low
M	05/11/1987	220	220	1987	11	5	1987	309	4	1983	32.0993	low
M	05/11/1987	125	130	1987	11	5	1987	309	1	1986	22.8742	low
M	05/11/1987	165	170	1987	11	5	1987	309	1	1986	18.2708	low
M	07/11/1987	220	220	1987	11	7	1987	311	4	1983	27.0000	low
M	08/11/1987	170	174	1987	11	8	1987	312	1	1986	19.6510	low
M	14/11/1987	154	150	1987	11	14	1987	318	1	1986	18.6175	low
M	14/11/1987	162	160	1987	11	14	1987	318	1	1986	17.3510	low
M	22/11/1987	212	210	1987	11	22	1987	326	2	1985	23.0000	low
M	25/11/1987	177	175	1987	11	25	1987	329	1	1986	14.5938	low
M	29/11/1987	220	210	1987	11	29	1987	333	5	1982	23.7957	low
F	02/12/1987	195	197	1987	12	2	1987	336	7	1980	17.3510	low
F	03/12/1987	171	170	1987	12	3	1987	337	1	1986	19.1909	low
F	05/12/1987	139	139	1987	12	5	1987	339	1	1986	20.0000	low
M	13/12/1987	250	240	1987	12	13	1987	347	5	1982	23.7898	low
M	13/12/1987	210	210	1987	12	13	1987	347	3	1984	22.0000	low
M	16/12/1987	60	60	1987	12	16	1987	350	0	1987	12.7576	low
M	19/12/1987	175	180	1987	12	19	1987	353	1	1986	19.1909	low
M	19/12/1987	182	180	1987	12	19	1987	353	1	1986	17.8816	low
F	21/12/1987	191	190	1987	12	21	1987	355	6	1981	19.6510	low
M	23/12/1987	185	195	1987	12	23	1987	357	3	1984	19.1909	low
M	27/12/1987	170	170	1987	12	27	1987	361	1	1986	16.4316	low
F	30/12/1987	183	184	1987	12	30	1987	364	4	1983	23.3349	low
M	30/12/1987	176	175	1987	12	30	1987	364	1	1986	15.5000	low
M	02/01/1988	125	130	1987	1	2	1988	367	1	1986	20.0000	low
F	11/09/1988	183	181	1988	9	11	1988	254	5	1983	24.7174	low
M	11/09/1988	220	220	1988	9	11	1988	254	5	1983	24.7174	low
M	11/09/1988	223	228	1988	9	11	1988	254	4	1984	32.0000	low
F	11/09/1988	195	198	1988	9	11	1988	254	4	1984	22.0000	low
M	11/09/1988	223	219	1988	9	11	1988	254	3	1985	27.4840	low
M	11/09/1988	212	213	1988	9	11	1988	254	3	1985	31.1759	low
F	11/09/1988	160	170	1988	9	11	1988	254	3	1985	22.0000	low
M	11/09/1988	245	250	1988	9	11	1988	254	3	1985	26.0000	low
M	11/09/1988	215	221	1988	9	11	1988	254	3	1985	33.9468	low
F	11/09/1988	155	165	1988	9	11	1988	254	2	1986	21.0319	low
M	11/09/1988	160	160	1988	9	11	1988	254	2	1986	21.9529	low
F	11/09/1988	170	170	1988	9	11	1988	254	2	1986	18.0000	low
F	11/09/1988	175	175	1988	9	11	1988	254	2	1986	20.0000	low
M	11/09/1988	125	125	1988	9	11	1988	254	1	1987	19.0000	low
M	11/09/1988	155	155	1988	9	11	1988	254	1	1987	19.1909	low
M	14/09/1988	215	220	1988	9	14	1988	257	4	1984	31.1759	low
M	14/09/1988	159	152	1988	9	14	1988	257	1	1987	18.2708	low
M	14/09/1988	160	160	1988	9	14	1988	257	1	1987	18.2708	low
M	14/09/1988	133	132	1988	9	14	1988	257	1	1987	17.3510	low
M	14/09/1988	178	178	1988	9	14	1988	257	1	1987	20.1113	low
F	14/09/1988	118	118	1988	9	14	1988	257	1	1987	17.3510	low
F	14/09/1988	122	120	1988	9	14	1988	257	1	1987	14.0000	low
M	17/09/1988	208	209	1988	9	17	1988	260	3	1985	25.6394	low
F	17/09/1988	124	126	1988	9	17	1988	260	1	1987	18.2708	low
F	17/09/1988	120	120	1988	9	17	1988	260	1	1987	23.0000	low
M	18/09/1988	195	203	1988	9	18	1988	261	2	1986	21.0319	low
M	18/09/1988	175	170	1988	9	18	1988	261	1	1987	21.9529	low
M	21/09/1988	183	179	1988	9	21	1988	264	1	1987	21.0319	low
F	25/09/1988	205	205	1988	9	25	1988	268	8	1980	22.8742	low
M	25/09/1988	250	250	1988	9	25	1988	268	6	1982	31.1759	low
M	29/09/1988	220	220	1988	9	29	1988	272	4	1984	29.3296	low
M	29/09/1988	195	195	1988	9	29	1988	272	2	1986	24.7174	low
M	29/09/1988	150	150	1988	9	29	1988	272	1	1987	15.5125	low
M	29/09/1988	160	160	1988	9	29	1988	272	1	1987	18.2708	low
F	02/10/1988	180	180	1988	10	2	1988	275	5	1983	19.0000	low
F	03/10/1988	187	185	1988	10	3	1988	276	5	1983	22.8742	low
M	05/10/1988	151	152	1988	10	5	1988	278	1	1987	18.0000	low
M	09/10/1988	208	208	1988	10	9	1988	282	2	1986	23.9800	low
M	14/10/1988	224	222	1988	10	14	1988	287	3	1985	28.0000	low
M	15/10/1988	154	154	1988	10	15	1988	288	1	1987	19.3542	low
M	16/10/1988	171	172	1988	10	16	1988	289	1	1987	21.5689	low
F	17/10/1988	211	211	1988	10	17	1988	290	6	1982	26.5616	low
F	20/10/1988	133	133	1988	10	20	1988	293	1	1987	18.6175	low
M	23/10/1988	214	213	1988	10	23	1988	296	3	1985	25.6394	low
F	23/10/1988	200	200	1988	10	23	1988	296	3	1985	21.0000	low
F	23/10/1988	150	145	1988	10	23	1988	296	1	1987	20.1113	low
M	23/10/1988	180	180	1988	10	23	1988	296	1	1987	20.0000	low
M	26/10/1988	227	228	1988	10	26	1988	299	10	1978	29.3296	low
F	06/11/1988	170	170	1988	11	6	1988	310	2	1986	17.1465	low
M	06/11/1988	150	150	1988	11	6	1988	310	1	1987	20.0000	low
F	13/11/1988	216	216	1988	11	13	1988	317	3	1985	22.0000	low
M	27/11/1988	185	185	1988	11	27	1988	331	2	1986	18.0000	low
M	04/12/1988	210	210	1988	12	4	1988	338	3	1985	26.0000	low
F	21/12/1988	196	192	1988	12	21	1988	355	5	1983	28.0000	low
M	29/12/1988	205	200	1988	12	29	1988	363	2	1986	24.0000	low
M	09/09/1990	220	220	1990	9	9	1990	252	5	1985	26.5616	low
M	09/09/1990	194	197	1990	9	9	1990	252	3	1987	33.0000	low
M	09/09/1990	239	238	1990	9	9	1990	252	3	1987	29.0000	low
F	09/09/1990	165	165	1990	9	9	1990	252	2	1988	20.1113	low
M	09/09/1990	150	150	1990	9	9	1990	252	1	1989	15.5125	low
M	09/09/1990	174	176	1990	9	9	1990	252	1	1989	23.7957	low
M	12/09/1990	185	185	1990	9	12	1990	255	1	1989	17.3510	low
M	12/09/1990	170	170	1990	9	12	1990	255	1	1989	15.5125	low
M	13/09/1990	205	209	1990	9	13	1990	256	2	1988	21.0000	low
M	13/09/1990	135	135	1990	9	13	1990	256	1	1989	13.4848	low
M	14/09/1990	243	240	1990	9	14	1990	257	4	1986	28.0000	low
M	15/09/1990	200	200	1990	9	15	1990	258	2	1988	18.0000	low
M	15/09/1990	210	210	1990	9	15	1990	258	2	1988	24.0000	low
M	16/09/1990	235	235	1990	9	16	1990	259	9	1981	41.3432	low
M	16/09/1990	220	220	1990	9	16	1990	259	3	1987	29.0000	low
M	19/09/1990	230	230	1990	9	19	1990	262	6	1984	28.4067	low
M	19/09/1990	218	218	1990	9	19	1990	262	4	1986	26.5616	low
F	19/09/1990	165	160	1990	9	19	1990	262	2	1988	24.0000	low
M	20/09/1990	225	235	1990	9	20	1990	263	4	1986	32.5611	low
M	20/09/1990	153	151	1990	9	20	1990	263	1	1989	18.2708	low
F	20/09/1990	155	155	1990	9	20	1990	263	1	1989	21.9529	low
M	22/09/1990	225	230	1990	9	22	1990	265	4	1986	27.0000	low
M	26/09/1990	222	223	1990	9	26	1990	269	9	1981	31.1759	low
F	26/09/1990	182	182	1990	9	26	1990	269	4	1986	19.1909	low
M	26/09/1990	45	45	1990	9	26	1990	269	0	1990	12.7576	low
F	27/09/1990	200	200	1990	9	27	1990	270	8	1982	21.0319	low
F	29/09/1990	170	175	1990	9	29	1990	272	1	1989	19.0000	low
F	30/09/1990	130	130	1990	9	30	1990	273	1	1989	18.2708	low
M	05/10/1990	205	210	1990	10	5	1990	278	2	1988	21.0319	low
M	06/10/1990	228	225	1990	10	6	1990	279	5	1985	30.2526	low
M	06/10/1990	230	230	1990	10	6	1990	279	3	1987	27.0000	low
M	06/10/1990	150	155	1990	10	6	1990	279	1	1989	17.3510	low
F	10/10/1990	180	178	1990	10	10	1990	283	4	1986	23.7957	low
M	10/10/1990	170	170	1990	10	10	1990	283	1	1989	19.5000	low
M	12/10/1990	150	152	1990	10	12	1990	285	1	1989	13.6755	low
M	13/10/1990	180	175	1990	10	13	1990	286	1	1989	21.9529	low
M	14/10/1990	223	222	1990	10	14	1990	287	4	1986	35.7949	low
F	14/10/1990	150	150	1990	10	14	1990	287	1	1989	20.0000	low
F	14/10/1990	135	140	1990	10	14	1990	287	1	1989	25.0000	low
M	17/10/1990	220	220	1990	10	17	1990	290	5	1985	27.4840	low
M	19/10/1990	168	169	1990	10	19	1990	292	1	1989	19.0000	low
M	21/10/1990	230	220	1990	10	21	1990	294	8	1982	27.4840	low
F	21/10/1990	185	188	1990	10	21	1990	294	4	1986	27.0000	low
M	22/10/1990	151	140	1990	10	22	1990	295	1	1989	13.2165	low
F	24/10/1990	141	140	1990	10	24	1990	297	1	1989	16.0000	low
F	27/10/1990	180	182	1990	10	27	1990	300	8	1982	29.0000	low
M	27/10/1990	190	195	1990	10	27	1990	300	2	1988	29.0000	low
M	28/10/1990	220	220	1990	10	28	1990	301	6	1984	37.0000	low
F	28/10/1990	195	190	1990	10	28	1990	301	3	1987	27.0000	low
F	28/10/1990	105	105	1990	10	28	1990	301	1	1989	16.0000	low
M	28/10/1990	160	160	1990	10	28	1990	301	1	1989	17.0000	low
F	01/11/1990	205	205	1990	11	1	1990	305	5	1985	25.6394	low
F	03/11/1990	170	170	1990	11	3	1990	307	3	1987	20.0000	low
M	03/11/1990	160	160	1990	11	3	1990	307	1	1989	21.0319	low
M	04/11/1990	230	230	1990	11	4	1990	308	6	1984	24.7174	low
M	07/11/1990	187	191	1990	11	7	1990	311	1	1989	19.6510	low
M	07/11/1990	165	160	1990	11	7	1990	311	1	1989	21.0000	low
M	08/11/1990	220	220	1990	11	8	1990	312	5	1985	27.5040	low
M	08/11/1990	197	200	1990	11	8	1990	312	3	1987	20.1113	low
M	11/11/1990	210	210	1990	11	11	1990	315	5	1985	21.5689	low
M	11/11/1990	120	125	1990	11	11	1990	315	1	1989	21.0000	low
M	27/12/1990	60	60	1990	12	27	1990	361	0	1990	15.0000	low
M	08/09/1991	220	220	1991	9	8	1991	251	5	1986	29.5000	low
M	08/09/1991	245	245	1991	9	8	1991	251	4	1987	27.4840	low
M	08/09/1991	222	225	1991	9	8	1991	251	3	1988	31.1759	low
M	08/09/1991	221	220	1991	9	8	1991	251	3	1988	33.0230	low
M	08/09/1991	202	204	1991	9	8	1991	251	3	1988	24.7174	low
M	08/09/1991	199	198	1991	9	8	1991	251	2	1989	22.8742	low
M	08/09/1991	155	155	1991	9	8	1991	251	1	1990	17.3510	low
M	08/09/1991	187	190	1991	9	8	1991	251	1	1990	21.0000	low
M	08/09/1991	165	162	1991	9	8	1991	251	1	1990	21.0319	low
M	08/09/1991	180	182	1991	9	8	1991	251	1	1990	21.0319	low
M	08/09/1991	175	175	1991	9	8	1991	251	1	1990	20.1113	low
M	11/09/1991	176	179	1991	9	11	1991	254	2	1989	25.0000	low
M	11/09/1991	187	185	1991	9	11	1991	254	1	1990	26.5616	low
M	11/09/1991	192	192	1991	9	11	1991	254	1	1990	22.8742	low
M	11/09/1991	142	138	1991	9	11	1991	254	1	1990	14.5938	low
M	12/09/1991	187	189	1991	9	12	1991	255	1	1990	19.1909	low
M	14/09/1991	210	215	1991	9	14	1991	257	6	1985	32.0993	low
M	15/09/1991	170	170	1991	9	15	1991	258	1	1990	21.0000	low
M	15/09/1991	165	165	1991	9	15	1991	258	1	1990	24.0000	low
F	16/09/1991	202	202	1991	9	16	1991	259	9	1982	22.8742	low
M	18/09/1991	265	255	1991	9	18	1991	261	6	1985	34.8708	low
M	18/09/1991	243	243	1991	9	18	1991	261	4	1987	30.0000	low
M	18/09/1991	200	208	1991	9	18	1991	261	2	1989	28.4000	low
F	20/09/1991	175	176	1991	9	20	1991	263	5	1986	18.2708	low
M	21/09/1991	10	10	1991	9	21	1991	264	0	1991	12.0000	low
M	22/09/1991	255	255	1991	9	22	1991	265	7	1984	27.9453	low
M	22/09/1991	225	220	1991	9	22	1991	265	5	1986	34.8708	low
F	22/09/1991	150	150	1991	9	22	1991	265	2	1989	16.4316	low
F	22/09/1991	180	180	1991	9	22	1991	265	2	1989	20.0000	low
M	22/09/1991	185	182	1991	9	22	1991	265	1	1990	21.0319	low
F	22/09/1991	160	160	1991	9	22	1991	265	1	1990	18.0000	low
F	22/09/1991	147	146	1991	9	22	1991	265	1	1990	14.9466	low
M	23/09/1991	199	195	1991	9	23	1991	266	4	1987	23.0000	low
M	25/09/1991	180	180	1991	9	25	1991	268	1	1990	18.0000	low
F	28/09/1991	175	170	1991	9	28	1991	271	1	1990	18.2708	low
F	29/09/1991	153	153	1991	9	29	1991	272	3	1988	19.1909	low
M	29/09/1991	190	190	1991	9	29	1991	272	1	1990	24.0000	low
M	02/10/1991	190	190	1991	10	2	1991	275	2	1989	27.4840	low
M	04/10/1991	190	200	1991	10	4	1991	277	2	1989	21.9529	low
M	04/10/1991	132	128	1991	10	4	1991	277	1	1990	17.0000	low
M	05/10/1991	190	190	1991	10	5	1991	278	3	1988	24.7174	low
M	05/10/1991	190	185	1991	10	5	1991	278	1	1990	23.0000	low
F	05/10/1991	150	145	1991	10	5	1991	278	1	1990	22.8742	low
M	06/10/1991	190	190	1991	10	6	1991	279	1	1990	23.0000	low
M	07/10/1991	178	182	1991	10	7	1991	280	1	1990	22.8742	low
F	09/10/1991	220	225	1991	10	9	1991	282	10	1981	22.8742	low
M	09/10/1991	223	228	1991	10	9	1991	282	5	1986	25.6394	low
F	09/10/1991	105	95	1991	10	9	1991	282	1	1990	17.5000	low
M	10/10/1991	225	225	1991	10	10	1991	283	7	1984	30.2526	low
M	11/10/1991	150	150	1991	10	11	1991	284	1	1990	20.5716	low
M	12/10/1991	220	225	1991	10	12	1991	285	4	1987	30.0000	low
F	13/10/1991	130	130	1991	10	13	1991	286	1	1990	17.3510	low
M	16/10/1991	155	155	1991	10	16	1991	289	1	1990	21.0000	low
M	17/10/1991	240	250	1991	10	17	1991	290	5	1986	33.9468	low
M	17/10/1991	140	141	1991	10	17	1991	290	1	1990	18.2708	low
M	17/10/1991	182	183	1991	10	17	1991	290	1	1990	22.8742	low
F	20/10/1991	230	220	1991	10	20	1991	293	8	1983	22.8742	low
M	20/10/1991	220	225	1991	10	20	1991	293	5	1986	23.7957	low
M	21/10/1991	220	220	1991	10	21	1991	294	4	1987	25.1784	low
M	22/10/1991	130	130	1991	10	22	1991	295	1	1990	15.0531	low
M	23/10/1991	225	225	1991	10	23	1991	296	3	1988	32.0000	low
M	23/10/1991	155	155	1991	10	23	1991	296	2	1989	17.0000	low
F	23/10/1991	144	146	1991	10	23	1991	296	1	1990	18.2708	low
F	23/10/1991	35	30	1991	10	23	1991	296	0	1991	12.0000	low
M	24/10/1991	230	220	1991	10	24	1991	297	5	1986	24.0000	low
M	24/10/1991	240	240	1991	10	24	1991	297	3	1988	23.7957	low
M	24/10/1991	145	145	1991	10	24	1991	297	1	1990	13.6755	low
F	25/10/1991	219	219	1991	10	25	1991	298	11	1980	21.9529	low
M	27/10/1991	220	225	1991	10	27	1991	300	4	1987	27.2073	low
M	27/10/1991	180	190	1991	10	27	1991	300	1	1990	22.8742	low
F	28/10/1991	158	156	1991	10	28	1991	301	1	1990	20.1113	low
M	31/10/1991	141	146	1991	10	31	1991	304	1	1990	17.3000	low
M	01/11/1991	230	230	1991	11	1	1991	305	6	1985	23.0000	low
M	03/11/1991	190	185	1991	11	3	1991	307	1	1990	12.0000	low
M	07/11/1991	230	230	1991	11	7	1991	311	4	1987	29.0000	low
M	07/11/1991	141	134	1991	11	7	1991	311	1	1990	16.0000	low
M	07/11/1991	165	155	1991	11	7	1991	311	1	1990	22.0000	low
F	09/11/1991	155	152	1991	11	9	1991	313	2	1989	22.0000	low
M	09/11/1991	130	130	1991	11	9	1991	313	1	1990	14.5938	low
M	10/11/1991	247	246	1991	11	10	1991	314	3	1988	24.7174	low
M	10/11/1991	180	185	1991	11	10	1991	314	3	1988	25.0000	low
F	11/11/1991	145	150	1991	11	11	1991	315	1	1990	19.1909	low
M	02/12/1991	165	165	1991	12	2	1991	336	1	1990	16.8912	low
M	05/12/1991	233	230	1991	12	5	1991	339	12	1979	20.1113	low
F	09/12/1991	210	200	1991	12	9	1991	343	10	1981	28.0000	low
F	13/12/1991	202	200	1991	12	13	1991	347	9	1982	19.6510	low
M	15/12/1991	235	235	1991	12	15	1991	349	4	1987	22.3085	low
M	16/12/1991	230	240	1991	12	16	1991	350	5	1986	27.4840	low
M	16/12/1991	240	245	1991	12	16	1991	350	5	1986	24.0000	low
M	16/12/1991	200	195	1991	12	16	1991	350	1	1990	18.6175	low
M	13/09/1992	235	235	1992	9	13	1992	256	4	1988	24.2565	low
M	13/09/1992	205	203	1992	9	13	1992	256	4	1988	31.0000	low
M	13/09/1992	230	230	1992	9	13	1992	256	4	1988	27.0000	low
F	13/09/1992	160	160	1992	9	13	1992	256	2	1990	18.0000	low
M	13/09/1992	160	158	1992	9	13	1992	256	1	1991	18.0000	low
M	13/09/1992	190	190	1992	9	13	1992	256	1	1991	19.0000	low
M	13/09/1992	170	170	1992	9	13	1992	256	1	1991	20.5000	low
F	13/09/1992	110	110	1992	9	13	1992	256	1	1991	16.4123	low
M	13/09/1992	80	80	1992	9	13	1992	256	1	1991	22.0000	low
M	13/09/1992	60	60	1992	9	13	1992	256	0	1992	12.0000	low
F	15/09/1992	99	100	1992	9	15	1992	258	1	1991	16.4316	low
M	16/09/1992	215	215	1992	9	16	1992	259	4	1988	28.0000	low
F	16/09/1992	144	144	1992	9	16	1992	259	1	1991	19.0000	low
M	17/09/1992	223	223	1992	9	17	1992	260	4	1988	30.0000	low
F	18/09/1992	205	210	1992	9	18	1992	261	8	1984	16.4123	low
M	18/09/1992	230	230	1992	9	18	1992	261	3	1989	23.7957	low
M	19/09/1992	200	200	1992	9	19	1992	262	2	1990	22.8742	low
M	20/09/1992	215	222	1992	9	20	1992	263	6	1986	33.0230	low
M	20/09/1992	170	170	1992	9	20	1992	263	1	1991	16.4316	low
F	22/09/1992	80	80	1992	9	22	1992	265	0	1992	13.6755	low
F	23/09/1992	230	230	1992	9	23	1992	266	9	1983	25.6394	low
M	23/09/1992	190	190	1992	9	23	1992	266	5	1987	24.0000	low
F	26/09/1992	180	180	1992	9	26	1992	269	5	1987	25.0000	low
F	29/09/1992	220	215	1992	9	29	1992	272	14	1978	23.0000	low
F	29/09/1992	203	204	1992	9	29	1992	272	13	1979	22.8742	low
F	30/09/1992	212	215	1992	9	30	1992	273	18	1974	28.0000	low
F	02/10/1992	130	135	1992	10	2	1992	275	1	1991	17.8108	low
F	03/10/1992	200	200	1992	10	3	1992	276	11	1981	26.0000	low
M	03/10/1992	180	178	1992	10	3	1992	276	1	1991	20.0000	low
M	04/10/1992	185	185	1992	10	4	1992	277	2	1990	24.2565	low
F	04/10/1992	132	130	1992	10	4	1992	277	1	1991	19.0000	low
F	06/10/1992	207	210	1992	10	6	1992	279	12	1980	22.0000	low
F	09/10/1992	195	195	1992	10	9	1992	282	10	1982	28.0000	low
M	10/10/1992	210	210	1992	10	10	1992	283	2	1990	30.0000	low
F	10/10/1992	95	100	1993	10	10	1992	283	1	1992	16.0000	low
F	15/10/1992	200	190	1992	10	15	1992	288	4	1988	26.5616	low
F	16/10/1992	217	222	1992	10	16	1992	289	8	1984	29.0000	low
M	18/10/1992	190	190	1992	10	18	1992	291	3	1989	25.0000	low
M	18/10/1992	195	210	1992	10	18	1992	291	2	1990	16.4316	low
M	18/10/1992	165	167	1992	10	18	1992	291	1	1991	20.0000	low
F	20/10/1992	120	120	1992	10	20	1992	293	1	1991	19.0000	low
M	21/10/1992	208	208	1992	10	21	1992	294	2	1990	23.7957	low
F	22/10/1992	195	190	1992	10	22	1992	295	5	1987	21.9529	low
M	25/10/1992	210	210	1992	10	25	1992	298	5	1987	27.0000	low
M	25/10/1992	205	205	1992	10	25	1992	298	2	1990	24.7174	low
M	28/10/1992	145	143	1992	10	28	1992	301	2	1990	21.9529	low
F	28/10/1992	165	175	1992	10	28	1992	301	1	1991	21.0000	low
F	28/10/1992	160	160	1992	10	28	1992	301	1	1991	19.1909	low
M	29/10/1992	190	190	1992	10	29	1992	302	1	1991	20.1113	low
F	30/10/1992	210	210	1992	10	30	1992	303	9	1983	22.0000	low
M	31/10/1992	195	200	1992	10	31	1992	304	1	1991	22.8742	low
F	01/11/1992	186	184	1992	11	1	1992	305	5	1987	29.3296	low
M	01/11/1992	235	235	1992	11	1	1992	305	3	1989	27.5040	low
F	04/11/1992	180	190	1992	11	4	1992	308	4	1988	26.5616	low
M	04/11/1992	215	215	1992	11	4	1992	308	4	1988	35.0000	low
M	05/11/1992	225	225	1992	11	5	1992	309	4	1988	30.9912	low
M	07/11/1992	235	235	1992	11	7	1992	311	7	1985	28.4067	low
F	07/11/1992	200	200	1992	11	7	1992	311	5	1987	20.1113	low
F	07/11/1992	191	184	1992	11	7	1992	311	4	1988	26.0000	low
M	07/11/1992	225	220	1992	11	7	1992	311	3	1989	26.5616	low
F	07/11/1992	140	155	1992	11	7	1992	311	2	1990	14.9466	low
M	07/11/1992	165	165	1992	11	7	1992	311	1	1991	19.1909	low
M	08/11/1992	220	230	1992	11	8	1992	312	5	1987	31.2320	low
M	08/11/1992	175	185	1992	11	8	1992	312	1	1991	20.1113	low
M	11/11/1992	236	244	1992	11	11	1992	315	8	1984	30.0000	low
M	11/11/1992	188	186	1992	11	11	1992	315	1	1991	26.0000	low
M	11/11/1992	102	100	1992	11	11	1992	315	1	1991	17.3510	low
M	14/11/1992	210	210	1992	11	14	1992	318	2	1990	19.1909	low
F	23/11/1992	190	180	1992	11	23	1992	327	7	1985	21.0000	low
F	01/12/1992	185	188	1992	12	1	1992	335	3	1989	21.0000	low
F	02/12/1992	195	190	1992	12	2	1992	336	7	1985	27.0000	low
F	04/12/1992	127	130	1992	12	4	1992	338	1	1991	20.0000	low
F	12/12/1992	125	125	1992	12	12	1992	346	1	1991	18.2708	low
F	15/12/1992	195	195	1992	12	15	1992	349	9	1983	21.5000	low
M	15/12/1992	199	200	1992	12	15	1992	349	2	1990	17.1465	low
M	17/12/1992	245	245	1992	12	17	1992	351	4	1988	26.5616	low
F	23/12/1992	120	115	1992	12	23	1992	357	1	1991	17.0000	low
F	27/12/1992	180	180	1992	12	27	1992	361	10	1982	20.0000	low
M	30/12/1992	160	155	1992	12	30	1992	364	1	1991	19.0000	low
M	31/12/1992	210	197	1992	12	31	1992	365	3	1989	23.0000	low
M	12/09/1993	215	215	1993	9	12	1993	255	3	1990	39.0000	low
M	12/09/1993	215	215	1993	9	12	1993	255	2	1991	24.0000	low
M	12/09/1993	212	212	1993	9	12	1993	255	2	1991	25.1784	low
M	12/09/1993	205	205	1993	9	12	1993	255	2	1991	35.0000	low
F	14/09/1993	192	192	1993	9	14	1993	257	10	1983	22.0000	low
M	14/09/1993	235	235	1993	9	14	1993	257	4	1989	24.0000	low
M	14/09/1993	180	180	1993	9	14	1993	257	3	1990	17.8816	low
M	14/09/1993	135	130	1993	9	14	1993	257	1	1992	14.9466	low
M	15/09/1993	232	232	1993	9	15	1993	258	3	1990	22.3085	low
M	15/09/1993	215	215	1993	9	15	1993	258	2	1991	24.0000	low
M	15/09/1993	192	192	1993	9	15	1993	258	2	1991	16.4316	low
M	15/09/1993	146	152	1993	9	15	1993	258	1	1992	15.5125	low
M	15/09/1993	187	188	1993	9	15	1993	258	1	1992	19.5000	low
M	15/09/1993	30	40	1993	9	15	1993	258	0	1993	8.4067	low
M	16/09/1993	220	222	1993	9	16	1993	259	3	1990	21.5689	low
M	16/09/1993	230	230	1993	9	16	1993	259	3	1990	24.0000	low
M	16/09/1993	125	125	1993	9	16	1993	259	1	1992	15.0000	low
F	17/09/1993	210	215	1993	9	17	1993	260	10	1983	22.8742	low
F	17/09/1993	235	240	1993	9	17	1993	260	10	1983	24.7174	low
F	18/09/1993	248	247	1993	9	18	1993	261	9	1984	22.8742	low
M	18/09/1993	150	145	1993	9	18	1993	261	5	1988	31.0000	low
F	18/09/1993	110	105	1993	9	18	1993	261	1	1992	17.3510	low
F	19/09/1993	166	165	1993	9	19	1993	262	4	1989	24.7174	low
F	19/09/1993	151	149	1993	9	19	1993	262	1	1992	20.1113	low
M	19/09/1993	145	140	1993	9	19	1993	262	1	1992	21.0000	low
M	21/09/1993	218	220	1993	9	21	1993	264	4	1989	27.0000	low
F	21/09/1993	150	148	1993	9	21	1993	264	1	1992	21.0319	low
M	22/09/1993	230	230	1993	9	22	1993	265	6	1987	35.0000	low
M	22/09/1993	225	225	1993	9	22	1993	265	2	1991	25.0000	low
M	22/09/1993	150	150	1993	9	22	1993	265	1	1992	14.2152	low
M	22/09/1993	185	185	1993	9	22	1993	265	1	1992	17.1465	low
M	22/09/1993	160	160	1993	9	22	1993	265	1	1992	23.0000	low
M	22/09/1993	170	171	1993	9	22	1993	265	1	1992	13.8499	low
F	23/09/1993	205	210	1993	9	23	1993	266	7	1986	28.4067	low
M	23/09/1993	230	236	1993	9	23	1993	266	4	1989	28.0000	low
M	23/09/1993	193	195	1993	9	23	1993	266	2	1991	20.0917	low
M	23/09/1993	150	150	1993	9	23	1993	266	1	1992	13.4848	low
M	24/09/1993	140	140	1993	9	24	1993	267	1	1992	12.0275	low
F	25/09/1993	210	210	1993	9	25	1993	268	4	1989	27.0000	low
M	25/09/1993	230	230	1993	9	25	1993	268	4	1989	32.0000	low
M	26/09/1993	158	162	1993	9	26	1993	269	1	1992	20.1113	low
F	28/09/1993	180	180	1993	9	28	1993	271	2	1991	20.1113	low
M	28/09/1993	40	40	1993	9	28	1993	271	0	1993	11.3817	low
F	29/09/1993	180	180	1993	9	29	1993	272	4	1989	22.8742	low
F	29/09/1993	180	185	1993	9	29	1993	272	2	1991	22.8742	low
M	29/09/1993	226	224	1993	9	29	1993	272	2	1991	20.0917	low
F	29/09/1993	136	136	1993	9	29	1993	272	1	1992	17.3510	low
F	29/09/1993	154	155	1993	9	29	1993	272	1	1992	17.3510	low
M	29/09/1993	145	150	1993	9	29	1993	272	1	1992	16.0000	low
M	30/09/1993	230	230	1993	9	30	1993	273	7	1986	29.3296	low
M	30/09/1993	220	215	1993	9	30	1993	273	4	1989	37.0000	low
F	01/10/1993	135	135	1993	10	1	1993	274	3	1990	21.5000	low
M	02/10/1993	222	225	1993	10	2	1993	275	4	1989	32.0000	low
M	02/10/1993	205	210	1993	10	2	1993	275	3	1990	33.0000	low
M	02/10/1993	225	224	1993	10	2	1993	275	2	1991	28.0000	low
M	02/10/1993	120	120	1993	10	2	1993	275	1	1992	11.5000	low
F	03/10/1993	220	220	1993	10	3	1993	276	3	1990	17.8816	low
M	03/10/1993	220	220	1993	10	3	1993	276	2	1991	18.2708	low
M	03/10/1993	185	180	1993	10	3	1993	276	1	1992	16.4123	low
F	04/10/1993	132	132	1993	10	4	1993	277	4	1989	24.0000	low
F	05/10/1993	205	205	1993	10	5	1993	278	13	1980	20.5716	low
F	05/10/1993	235	235	1993	10	5	1993	278	11	1982	26.0000	low
M	06/10/1993	210	220	1993	10	6	1993	279	4	1989	31.0000	low
F	06/10/1993	200	200	1993	10	6	1993	279	3	1990	20.0000	low
M	07/10/1993	225	225	1993	10	7	1993	280	6	1987	34.0000	low
F	07/10/1993	23	25	1993	10	7	1993	280	0	1993	7.6872	low
M	09/10/1993	205	200	1993	10	9	1993	282	3	1990	28.0000	low
F	09/10/1993	165	155	1993	10	9	1993	282	3	1990	23.7957	low
F	09/10/1993	201	200	1993	10	9	1993	282	2	1991	16.0455	low
M	09/10/1993	195	186	1993	10	9	1993	282	1	1992	21.0319	low
M	10/10/1993	241	240	1993	10	10	1993	283	3	1990	28.0000	low
M	10/10/1993	170	170	1993	10	10	1993	283	1	1992	19.1909	low
F	12/10/1993	190	190	1993	10	12	1993	285	1	1992	13.0000	low
F	13/10/1993	190	190	1993	10	13	1993	286	4	1989	25.0000	low
M	13/10/1993	153	154	1993	10	13	1993	286	1	1992	12.0275	low
F	13/10/1993	27	25	1993	10	13	1993	286	0	1993	8.7671	low
F	15/10/1993	212	203	1993	10	15	1993	288	11	1982	24.0000	low
F	15/10/1993	220	215	1993	10	15	1993	288	5	1988	15.6789	low
F	15/10/1993	145	140	1993	10	15	1993	288	1	1992	19.6510	low
M	15/10/1993	160	160	1993	10	15	1993	288	1	1992	20.0000	low
F	16/10/1993	155	162	1993	10	16	1993	289	1	1992	13.0000	low
F	16/10/1993	140	140	1993	10	16	1993	289	1	1992	17.0000	low
F	17/10/1993	215	215	1993	10	17	1993	290	12	1981	26.5616	low
M	17/10/1993	215	215	1993	10	17	1993	290	5	1988	29.0000	low
M	17/10/1993	210	210	1993	10	17	1993	290	4	1989	21.5689	low
M	17/10/1993	240	240	1993	10	17	1993	290	4	1989	30.0000	low
F	17/10/1993	185	180	1993	10	17	1993	290	3	1990	21.0319	low
M	17/10/1993	200	200	1993	10	17	1993	290	1	1992	26.0000	low
F	19/10/1993	140	142	1993	10	19	1993	292	1	1992	23.0000	low
F	20/10/1993	125	120	1993	10	20	1993	293	1	1992	19.0000	low
F	22/10/1993	154	152	1993	10	22	1993	295	1	1992	12.0275	low
M	23/10/1993	220	225	1993	10	23	1993	296	5	1988	39.0000	low
F	23/10/1993	190	190	1993	10	23	1993	296	3	1990	27.0000	low
F	23/10/1993	124	124	1993	10	23	1993	296	1	1992	14.0000	low
M	24/10/1993	220	215	1993	10	24	1993	297	5	1988	26.5616	low
F	24/10/1993	130	130	1993	10	24	1993	297	1	1992	17.0000	low
M	27/10/1993	230	230	1993	10	27	1993	300	5	1988	26.7600	low
M	27/10/1993	210	210	1993	10	27	1993	300	3	1990	27.4840	low
F	27/10/1993	170	170	1993	10	27	1993	300	2	1991	22.0000	low
M	27/10/1993	165	160	1993	10	27	1993	300	1	1992	19.0000	low
M	27/10/1993	200	200	1993	10	27	1993	300	1	1992	22.0000	low
M	28/10/1993	195	200	1993	10	28	1993	301	7	1986	32.0000	low
F	28/10/1993	175	172	1993	10	28	1993	301	6	1987	25.6394	low
F	30/10/1993	190	195	1993	10	30	1993	303	4	1989	22.8742	low
M	31/10/1993	200	200	1993	10	31	1993	304	6	1987	33.0000	low
F	31/10/1993	195	200	1993	10	31	1993	304	5	1988	24.7174	low
M	03/11/1993	210	210	1993	11	3	1993	307	5	1988	20.8299	low
F	03/11/1993	120	115	1993	11	3	1993	307	1	1992	18.5000	low
F	04/11/1993	200	198	1993	11	4	1993	308	11	1982	21.0319	low
M	07/11/1993	215	215	1993	11	7	1993	311	2	1991	26.1005	low
F	10/11/1993	135	130	1993	11	10	1993	314	1	1992	14.5938	low
M	10/11/1993	159	160	1993	11	10	1993	314	1	1992	20.5716	low
F	11/11/1993	210	210	1993	11	11	1993	315	8	1985	24.2565	low
M	11/11/1993	220	225	1993	11	11	1993	315	8	1985	29.3296	low
M	11/11/1993	207	210	1993	11	11	1993	315	4	1989	18.6175	low
F	11/11/1993	160	162	1992	11	11	1993	315	2	1990	21.9529	low
M	11/11/1993	185	190	1993	11	11	1993	315	2	1991	18.6175	low
M	13/11/1993	205	210	1993	11	13	1993	317	4	1989	20.4607	low
M	14/11/1993	212	220	1993	11	14	1993	318	4	1989	29.3296	low
M	14/11/1993	130	130	1993	11	14	1993	318	1	1992	11.3006	low
M	25/11/1993	225	230	1993	11	25	1993	329	3	1990	26.5616	low
F	03/12/1993	115	112	1993	12	3	1993	337	2	1991	15.5125	low
M	04/12/1993	155	155	1993	12	4	1993	338	1	1992	16.0000	low
M	05/12/1993	295	220	1993	12	5	1993	339	5	1988	25.0000	low
M	10/12/1993	75	75	1993	12	10	1993	344	0	1993	12.7576	low
F	12/12/1993	211	210	1993	12	12	1993	346	9	1984	26.0000	low
F	12/12/1993	55	55	1993	12	12	1993	346	0	1993	15.0000	low
F	15/12/1993	190	200	1993	12	15	1993	349	7	1986	25.0000	low
F	18/12/1993	200	197	1993	12	18	1993	352	7	1986	25.0000	low
F	19/12/1993	230	230	1993	12	19	1993	353	10	1983	19.0000	low
M	11/09/1994	140	140	1994	9	11	1994	254	6	1988	31.0000	low
M	11/09/1994	225	220	1994	9	11	1994	254	6	1988	29.3296	low
F	11/09/1994	200	198	1994	9	11	1994	254	4	1990	23.7957	low
M	11/09/1994	215	215	1994	9	11	1994	254	4	1990	31.1759	low
M	11/09/1994	130	135	1994	9	11	1994	254	4	1990	22.0000	low
M	11/09/1994	230	230	1994	9	11	1994	254	3	1991	26.0000	low
M	11/09/1994	200	200	1994	9	11	1994	254	2	1992	21.0319	low
F	11/09/1994	145	150	1994	9	11	1994	254	2	1992	19.1909	low
M	11/09/1994	140	140	1994	9	11	1994	254	1	1993	22.0000	low
M	11/09/1994	70	70	1994	9	11	1994	254	1	1993	10.4651	low
M	11/09/1994	150	150	1994	9	11	1994	254	1	1993	21.0000	low
F	11/09/1994	170	170	1994	9	11	1994	254	1	1993	19.6510	low
M	14/09/1994	235	235	1994	9	14	1994	257	5	1989	29.3296	low
M	14/09/1994	249	252	1994	9	14	1994	257	4	1990	31.1759	low
M	14/09/1994	170	166	1994	9	14	1994	257	1	1993	19.1909	low
M	15/09/1994	240	240	1994	9	15	1994	258	6	1988	34.0000	low
M	15/09/1994	140	140	1994	9	15	1994	258	1	1993	22.0000	low
M	17/09/1994	235	235	1994	9	17	1994	260	6	1988	29.0000	low
M	17/09/1994	230	235	1994	9	17	1994	260	5	1989	24.7174	low
M	17/09/1994	150	160	1994	9	17	1994	260	1	1993	16.4316	low
F	17/09/1994	125	125	1994	9	17	1994	260	1	1993	21.0000	low
M	18/09/1994	217	217	1994	9	18	1994	261	5	1989	29.7911	low
F	18/09/1994	184	190	1994	9	18	1994	261	4	1990	19.1909	low
F	18/09/1994	180	175	1994	9	18	1994	261	4	1990	21.0000	low
M	18/09/1994	192	189	1994	9	18	1994	261	2	1992	23.7957	low
F	18/09/1994	25	25	1994	9	18	1994	261	0	1994	11.0000	low
M	21/09/1994	265	260	1994	9	21	1994	264	5	1989	31.1759	low
M	21/09/1994	225	200	1994	9	21	1994	264	5	1989	22.3085	low
F	21/09/1994	198	202	1994	9	21	1994	264	4	1990	18.2708	low
F	22/09/1994	150	150	1994	9	22	1994	265	1	1993	16.4316	low
M	22/09/1994	170	170	1994	9	22	1994	265	1	1993	21.0319	low
F	24/09/1994	226	224	1994	9	24	1994	267	4	1990	21.9529	low
M	24/09/1994	210	215	1994	9	24	1994	267	4	1990	25.0000	low
M	24/09/1994	212	208	1994	9	24	1994	267	2	1992	24.0000	low
F	24/09/1994	170	170	1994	9	24	1994	267	2	1992	18.2708	low
M	24/09/1994	160	160	1994	9	24	1994	267	1	1993	17.3510	low
M	25/09/1994	225	230	1994	9	25	1994	268	5	1989	31.1759	low
F	25/09/1994	199	197	1994	9	25	1994	268	5	1989	20.0000	low
M	25/09/1994	210	210	1994	9	25	1994	268	4	1990	30.0000	low
M	25/09/1994	220	222	1994	9	25	1994	268	4	1990	29.3296	low
F	25/09/1994	170	170	1994	9	25	1994	268	3	1991	23.0000	low
F	25/09/1994	150	155	1994	9	25	1994	268	3	1991	21.0319	low
M	25/09/1994	234	230	1994	9	25	1994	268	2	1992	23.5000	low
F	25/09/1994	141	145	1994	9	25	1994	268	2	1992	18.2708	low
M	25/09/1994	175	175	1994	9	25	1994	268	1	1993	18.8228	low
F	25/09/1994	115	115	1994	9	25	1994	268	1	1993	17.0000	low
M	28/09/1994	165	163	1994	9	28	1994	271	1	1993	17.3510	low
M	29/09/1994	225	230	1994	9	29	1994	272	9	1985	29.3296	low
M	29/09/1994	222	222	1994	9	29	1994	272	8	1986	29.3296	low
M	01/10/1994	210	210	1994	10	1	1994	274	4	1990	27.1319	low
F	05/10/1994	190	190	1994	10	5	1994	278	9	1985	27.0000	low
M	05/10/1994	202	205	1994	10	5	1994	278	4	1990	31.0000	low
M	06/10/1994	144	142	1994	10	6	1994	279	1	1993	17.3510	low
F	08/10/1994	194	194	1994	10	8	1994	281	4	1990	24.7174	low
F	08/10/1994	115	115	1994	10	8	1994	281	1	1993	13.6755	low
F	08/10/1994	45	50	1994	10	8	1994	281	0	1994	10.5000	low
M	09/10/1994	222	220	1994	10	9	1994	282	4	1990	26.0000	low
M	09/10/1994	235	230	1994	10	9	1994	282	4	1990	24.7174	low
M	12/10/1994	205	205	1994	10	12	1994	285	2	1992	21.9529	low
M	13/10/1994	215	210	1994	10	13	1994	286	3	1991	25.6394	low
F	13/10/1994	155	155	1994	10	13	1994	286	1	1993	15.0000	low
M	15/10/1994	200	200	1994	10	15	1994	288	3	1991	24.7174	low
M	16/10/1994	220	220	1994	10	16	1994	289	2	1992	25.6394	low
M	16/10/1994	215	215	1994	10	16	1994	289	2	1992	28.5000	low
M	16/10/1994	165	167	1994	10	16	1994	289	1	1993	16.4316	low
M	19/10/1994	250	240	1994	10	19	1994	292	4	1990	31.1759	low
M	19/10/1994	173	170	1994	10	19	1994	292	2	1992	23.0000	low
F	19/10/1994	118	118	1994	10	19	1994	292	1	1993	19.0000	low
F	19/10/1994	135	125	1994	10	19	1994	292	1	1993	18.0000	low
F	20/10/1994	180	180	1994	10	20	1994	293	4	1990	18.2708	low
F	20/10/1994	190	190	1994	10	20	1994	293	4	1990	26.0000	low
F	22/10/1994	200	198	1994	10	22	1994	295	8	1986	21.4924	low
M	23/10/1994	210	210	1994	10	23	1994	296	4	1990	32.0993	low
F	23/10/1994	175	170	1994	10	23	1994	296	1	1993	21.9529	low
M	23/10/1994	20	20	1994	10	23	1994	296	0	1994	11.8402	low
M	26/10/1994	235	230	1994	10	26	1994	299	4	1990	30.2526	low
F	27/10/1994	163	162	1994	10	27	1994	300	3	1991	22.0000	low
M	27/10/1994	210	215	1994	10	27	1994	300	2	1992	24.7174	low
M	27/10/1994	135	135	1994	10	27	1994	300	1	1993	15.0000	low
F	29/10/1994	145	150	1994	10	29	1994	302	1	1993	22.0000	low
M	30/10/1994	220	220	1994	10	30	1994	303	4	1990	24.7174	low
F	30/10/1994	160	160	1994	10	30	1994	303	2	1992	22.0000	low
M	02/11/1994	222	225	1994	11	2	1994	306	4	1990	33.0000	low
M	02/11/1994	150	150	1994	11	2	1994	306	1	1993	17.0000	low
M	03/11/1994	220	220	1994	11	3	1994	307	2	1992	22.0000	low
F	03/11/1994	129	127	1994	11	3	1994	307	1	1993	17.0000	low
F	05/11/1994	160	160	1994	11	5	1994	309	1	1993	19.1909	low
M	06/11/1994	148	150	1994	11	6	1994	310	1	1993	29.0000	low
M	06/11/1994	163	160	1994	11	6	1994	310	1	1993	16.0000	low
F	06/11/1994	20	20	1994	11	6	1994	310	0	1994	7.0000	low
M	09/11/1994	160	160	1994	11	9	1994	313	1	1993	16.4316	low
F	10/11/1994	224	222	1994	11	10	1994	314	6	1988	27.0000	low
M	10/11/1994	240	230	1994	11	10	1994	314	3	1991	29.0000	low
M	10/11/1994	170	170	1994	11	10	1994	314	1	1993	18.2708	low
F	11/11/1994	210	210	1994	11	11	1994	315	4	1990	24.7174	low
F	11/11/1994	127	128	1994	11	11	1994	315	1	1993	19.1909	low
F	12/11/1994	128	125	1994	11	12	1994	316	1	1993	15.5125	low
M	12/11/1994	165	160	1994	11	12	1994	316	1	1993	22.0000	low
M	12/11/1994	140	135	1994	11	12	1994	316	1	1993	16.0000	low
M	12/11/1994	153	157	1994	11	12	1994	316	1	1993	20.1113	low
F	12/11/1994	150	155	1994	11	12	1994	316	1	1993	18.0000	low
F	13/11/1994	203	195	1994	11	13	1994	317	9	1985	23.3349	low
F	13/11/1994	210	210	1994	11	13	1994	317	6	1988	23.7957	low
M	13/11/1994	210	210	1994	11	13	1994	317	4	1990	30.0000	low
F	13/11/1994	135	130	1994	11	13	1994	317	1	1993	16.0000	low
M	30/11/1994	250	235	1994	11	30	1994	334	3	1991	34.8708	low
F	04/12/1994	214	214	1994	12	4	1994	338	9	1985	21.0000	low
F	04/12/1994	132	135	1994	12	4	1994	338	1	1993	18.0000	low
M	07/12/1994	153	155	1994	12	7	1994	341	1	1993	18.2708	low
F	10/12/1994	205	203	1994	12	10	1994	344	5	1989	26.0000	low
M	11/12/1994	162	170	1994	12	11	1994	345	2	1992	21.0000	low
M	14/12/1994	170	175	1994	12	14	1994	348	1	1993	17.3510	low
M	15/12/1994	227	225	1994	12	15	1994	349	8	1986	26.0000	low
F	17/12/1994	220	220	1994	12	17	1994	351	12	1982	22.0000	low
F	17/12/1994	180	185	1994	12	17	1994	351	5	1989	21.0319	low
M	18/12/1994	215	210	1994	12	18	1994	352	5	1989	33.0000	low
F	28/12/1994	118	119	1994	12	28	1994	362	3	1991	19.1909	low
M	03/01/1995	240	245	1995	1	3	1995	368	5	1990	21.9529	low
M	10/09/1995	220	220	1995	9	10	1995	253	4	1991	23.7957	low
F	10/09/1995	160	160	1995	9	10	1995	253	2	1993	22.0000	low
M	10/09/1995	135	135	1995	9	10	1995	253	1	1994	13.0000	low
F	12/09/1995	212	212	1995	9	12	1995	255	12	1983	22.5000	low
F	12/09/1995	146	196	1995	9	12	1995	255	9	1986	24.7174	low
F	12/09/1995	210	212	1995	9	12	1995	255	5	1990	21.5000	low
M	12/09/1995	130	210	1995	9	12	1995	255	2	1993	20.1113	low
M	13/09/1995	205	205	1995	9	13	1995	256	5	1990	33.9468	low
M	13/09/1995	220	220	1995	9	13	1995	256	3	1992	28.0000	low
M	13/09/1995	100	100	1995	9	13	1995	256	2	1993	21.0000	low
F	13/09/1995	175	170	1995	9	13	1995	256	1	1994	15.5125	low
M	14/09/1995	235	235	1995	9	14	1995	257	3	1992	25.6394	low
F	14/09/1995	120	120	1995	9	14	1995	257	1	1994	15.5125	low
M	16/09/1995	220	220	1995	9	16	1995	259	6	1989	29.3296	low
M	16/09/1995	228	232	1995	9	16	1995	259	4	1991	38.3000	low
M	16/09/1995	200	200	1995	9	16	1995	259	3	1992	27.0000	low
M	16/09/1995	205	205	1995	9	16	1995	259	2	1993	26.0000	low
M	16/09/1995	260	260	1995	9	16	1995	259	2	1993	21.4924	low
M	16/09/1995	190	190	1995	9	16	1995	259	1	1994	21.0000	low
F	16/09/1995	133	130	1995	9	16	1995	259	1	1994	14.9466	low
M	17/09/1995	240	240	1995	9	17	1995	260	6	1989	34.8708	low
M	17/09/1995	210	210	1995	9	17	1995	260	5	1990	27.4840	low
M	17/09/1995	234	235	1995	9	17	1995	260	4	1991	24.7174	low
F	17/09/1995	190	190	1995	9	17	1995	260	4	1991	23.0000	low
F	17/09/1995	180	175	1995	9	17	1995	260	2	1993	17.3510	low
M	19/09/1995	225	225	1995	9	19	1995	262	4	1991	26.0000	low
M	19/09/1995	197	195	1995	9	19	1995	262	2	1993	22.8742	low
M	20/09/1995	160	150	1995	9	20	1995	263	5	1990	35.0000	low
M	20/09/1995	122	120	1995	9	20	1995	263	1	1994	21.0000	low
M	21/09/1995	192	190	1995	9	21	1995	264	2	1993	23.7957	low
F	23/09/1995	202	195	1995	9	23	1995	266	12	1983	19.6510	low
M	23/09/1995	238	231	1995	9	23	1995	266	5	1990	33.0000	low
M	23/09/1995	225	225	1995	9	23	1995	266	5	1990	32.0993	low
F	23/09/1995	174	178	1995	9	23	1995	266	3	1992	21.0319	low
M	23/09/1995	170	170	1995	9	23	1995	266	1	1994	15.5125	low
M	23/09/1995	155	155	1995	9	23	1995	266	1	1994	20.0000	low
M	24/09/1995	225	225	1995	9	24	1995	267	8	1987	26.0000	low
F	24/09/1995	135	135	1995	9	24	1995	267	1	1994	18.0000	low
F	24/09/1995	112	133	1995	9	24	1995	267	1	1994	15.5125	low
M	25/09/1995	210	210	1995	9	25	1995	268	3	1992	24.0000	low
F	26/09/1995	190	180	1995	9	26	1995	269	9	1986	23.0000	low
F	26/09/1995	220	217	1995	9	26	1995	269	8	1987	22.5000	low
F	26/09/1995	110	110	1995	9	26	1995	269	1	1994	12.0000	low
M	27/09/1995	240	240	1995	9	27	1995	270	7	1988	34.0000	low
M	27/09/1995	174	175	1995	9	27	1995	270	2	1993	20.1113	low
F	27/09/1995	160	165	1995	9	27	1995	270	1	1994	19.1909	low
M	28/09/1995	225	225	1995	9	28	1995	271	3	1992	31.1759	low
F	29/09/1995	122	123	1995	9	29	1995	272	1	1994	11.8402	low
M	29/09/1995	140	150	1995	9	29	1995	272	1	1994	15.5125	low
M	29/09/1995	135	135	1995	9	29	1995	272	1	1994	11.5000	low
M	30/09/1995	227	226	1995	9	30	1995	273	7	1988	30.0000	low
F	30/09/1995	186	190	1995	9	30	1995	273	4	1991	23.7957	low
M	30/09/1995	213	213	1995	9	30	1995	273	3	1992	34.8708	low
F	30/09/1995	160	160	1995	9	30	1995	273	1	1994	14.5938	low
F	01/10/1995	220	224	1995	10	1	1995	274	9	1986	21.9529	low
F	01/10/1995	171	173	1995	10	1	1995	274	4	1991	18.0000	low
F	01/10/1995	192	190	1995	10	1	1995	274	2	1993	21.0000	low
M	01/10/1995	160	160	1995	10	1	1995	274	1	1994	19.1909	low
M	04/10/1995	220	220	1995	10	4	1995	277	7	1988	32.0000	low
M	04/10/1995	230	220	1995	10	4	1995	277	4	1991	27.0000	low
M	04/10/1995	140	140	1995	10	4	1995	277	4	1991	28.0000	low
M	04/10/1995	225	224	1995	10	4	1995	277	4	1991	29.0000	low
F	04/10/1995	106	105	1995	10	4	1995	277	2	1993	25.0000	low
M	05/10/1995	174	175	1995	10	5	1995	278	2	1993	23.0000	low
M	05/10/1995	40	40	1995	10	5	1995	278	0	1995	13.8591	low
F	07/10/1995	130	130	1995	10	7	1995	280	1	1994	17.8108	low
F	07/10/1995	158	162	1995	10	7	1995	280	1	1994	21.0319	low
F	07/10/1995	130	130	1995	10	7	1995	280	1	1994	19.0000	low
M	08/10/1995	218	220	1995	10	8	1995	281	10	1985	26.0000	low
M	08/10/1995	230	230	1995	10	8	1995	281	5	1990	32.0993	low
M	08/10/1995	180	172	1995	10	8	1995	281	1	1994	20.1113	low
F	08/10/1995	130	130	1995	10	8	1995	281	1	1994	18.0000	low
F	10/10/1995	214	214	1995	10	10	1995	283	14	1981	24.0000	low
M	10/10/1995	167	163	1995	10	10	1995	283	1	1994	20.0000	low
M	10/10/1995	152	150	1995	10	10	1995	283	1	1994	20.0000	low
M	11/10/1995	200	200	1995	10	11	1995	284	2	1993	22.8742	low
M	11/10/1995	185	185	1995	10	11	1995	284	1	1994	20.1113	low
F	14/10/1995	220	220	1995	10	14	1995	287	7	1988	25.0000	low
M	14/10/1995	240	240	1995	10	14	1995	287	4	1991	27.4840	low
F	14/10/1995	215	215	1995	10	14	1995	287	4	1991	24.7174	low
F	14/10/1995	110	110	1995	10	14	1995	287	1	1994	16.4316	low
F	15/10/1995	185	180	1995	10	15	1995	288	8	1987	24.0000	low
F	15/10/1995	195	195	1995	10	15	1995	288	5	1990	23.0000	low
M	15/10/1995	236	280	1995	10	15	1995	288	5	1990	31.1759	low
M	18/10/1995	245	250	1995	10	18	1995	291	6	1989	33.0000	low
M	18/10/1995	220	220	1995	10	18	1995	291	3	1992	30.0000	low
F	18/10/1995	170	175	1995	10	18	1995	291	3	1992	20.0000	low
M	19/10/1995	230	225	1995	10	19	1995	292	6	1989	27.0000	low
M	19/10/1995	225	225	1995	10	19	1995	292	4	1991	32.5000	low
F	21/10/1995	124	126	1995	10	21	1995	294	1	1994	20.1113	low
F	22/10/1995	200	200	1995	10	22	1995	295	5	1990	30.0000	low
M	22/10/1995	175	175	1995	10	22	1995	295	1	1994	17.3510	low
F	22/10/1995	135	135	1995	10	22	1995	295	1	1994	20.0000	low
F	23/10/1995	170	170	1995	10	23	1995	296	5	1990	21.9529	low
M	23/10/1995	230	230	1995	10	23	1995	296	4	1991	22.8742	low
F	23/10/1995	190	190	1995	10	23	1995	296	4	1991	24.7174	low
F	23/10/1995	130	130	1995	10	23	1995	296	1	1994	14.1346	low
F	25/10/1995	110	110	1995	10	25	1995	298	1	1994	15.5125	low
M	26/10/1995	160	160	1995	10	26	1995	299	1	1994	18.2708	low
M	28/10/1995	235	235	1995	10	28	1995	301	8	1987	33.0000	low
F	28/10/1995	210	200	1995	10	28	1995	301	6	1989	23.0489	low
F	28/10/1995	150	145	1995	10	28	1995	301	1	1994	16.4123	low
M	28/10/1995	170	170	1995	10	28	1995	301	1	1994	20.1113	low
M	29/10/1995	192	190	1995	10	29	1995	302	3	1992	19.3542	low
F	31/10/1995	190	192	1995	10	31	1995	304	10	1985	35.0000	low
F	31/10/1995	209	200	1995	10	31	1995	304	9	1986	23.5000	low
F	31/10/1995	122	122	1995	10	31	1995	304	1	1994	16.0000	low
M	01/11/1995	220	220	1995	11	1	1995	305	4	1991	28.4067	low
F	01/11/1995	185	185	1995	11	1	1995	305	4	1991	29.0000	low
M	01/11/1995	220	220	1995	11	1	1995	305	3	1992	29.3296	low
M	04/11/1995	224	224	1995	11	4	1995	308	5	1990	26.5616	low
M	04/11/1995	220	225	1995	11	4	1995	308	4	1991	30.2526	low
F	05/11/1995	209	200	1995	11	5	1995	309	7	1988	24.7174	low
M	05/11/1995	225	220	1995	11	5	1995	309	4	1991	28.4067	low
M	05/11/1995	224	224	1995	11	5	1995	309	3	1992	22.8742	low
M	05/11/1995	130	130	1995	11	5	1995	309	1	1994	14.0000	low
M	05/11/1995	163	165	1995	11	5	1995	309	1	1994	22.5000	low
M	05/11/1995	170	175	1995	11	5	1995	309	1	1994	23.7957	low
F	05/11/1995	160	155	1995	11	5	1995	309	1	1994	22.8742	low
M	08/11/1995	225	220	1995	11	8	1995	312	8	1987	29.0000	low
M	09/11/1995	145	140	1995	11	9	1995	313	1	1994	17.8816	low
F	11/11/1995	205	205	1995	11	11	1995	315	6	1989	23.7957	low
F	11/11/1995	188	193	1995	11	11	1995	315	4	1991	23.7957	low
M	11/11/1995	145	145	1995	11	11	1995	315	1	1994	16.8912	low
M	11/11/1995	110	120	1995	11	11	1995	315	1	1994	15.6789	low
M	12/11/1995	250	240	1995	11	12	1995	316	6	1989	29.3296	low
M	12/11/1995	210	210	1995	11	12	1995	316	5	1990	26.5616	low
M	12/11/1995	188	200	1995	11	12	1995	316	4	1991	28.4067	low
F	12/11/1995	140	150	1995	11	12	1995	316	2	1993	17.1465	low
M	12/11/1995	185	190	1995	11	12	1995	316	2	1993	24.7174	low
F	12/11/1995	160	160	1995	11	12	1995	316	1	1994	19.1909	low
F	12/11/1995	160	155	1995	11	12	1995	316	1	1994	20.1113	low
M	12/11/1995	178	180	1995	11	12	1995	316	1	1994	21.0000	low
M	03/12/1995	270	260	1995	12	3	1995	337	6	1989	24.0000	low
F	08/12/1995	123	125	1995	12	8	1995	342	1	1994	14.5938	low
F	09/12/1995	215	215	1995	12	9	1995	343	2	1993	20.1113	low
M	09/12/1995	205	205	1995	12	9	1995	343	2	1993	21.0319	low
M	11/12/1995	225	225	1995	12	11	1995	345	3	1992	22.8742	low
F	12/12/1995	210	210	1995	12	12	1995	346	5	1990	26.1005	low
F	12/12/1995	225	225	1995	12	12	1995	346	5	1990	23.3349	low
F	14/12/1995	202	205	1995	12	14	1995	348	4	1991	20.0000	low
F	15/12/1995	135	163	1995	12	15	1995	349	17	1978	18.6175	low
M	17/12/1995	210	215	1995	12	17	1995	351	5	1990	26.0000	low
F	09/01/1996	150	153	1995	1	9	1996	374	1	1994	16.5000	low
M	30/01/1996	222	225	1995	1	30	1996	395	10	1985	13.0000	low
F	30/01/1996	196	196	1995	1	30	1996	395	4	1991	18.2708	low
F	02/02/1996	165	165	1995	2	2	1996	398	3	1992	23.0000	low
F	02/02/1996	180	185	1995	2	2	1996	398	3	1992	24.2565	low
F	09/02/1996	185	180	1995	2	9	1996	405	7	1988	24.5000	low
F	09/02/1996	160	160	1995	2	9	1996	405	2	1993	22.5000	low
F	15/02/1996	190	185	1995	2	15	1996	411	6	1989	21.0319	low
F	16/02/1996	205	205	1995	2	16	1996	412	18	1977	20.0000	low
M	22/02/1996	261	261	1995	2	22	1996	418	13	1982	23.0489	low
M	23/02/1996	241	240	1995	2	23	1996	419	10	1985	25.5000	low
F	26/02/1996	210	210	1995	2	26	1996	422	5	1990	22.0000	low
F	27/02/1996	152	152	1995	2	27	1996	423	1	1994	15.6789	low
M	08/09/1996	220	215	1996	9	8	1996	251	6	1990	29.3296	low
M	08/09/1996	240	240	1996	9	8	1996	251	5	1991	32.0000	low
M	08/09/1996	230	230	1996	9	8	1996	251	5	1991	34.9723	low
M	08/09/1996	172	170	1996	9	8	1996	251	4	1992	22.8742	low
F	08/09/1996	190	190	1996	9	8	1996	251	4	1992	24.7174	low
F	08/09/1996	145	145	1996	9	8	1996	251	2	1994	19.0000	low
M	08/09/1996	186	186	1996	9	8	1996	251	2	1994	23.0000	low
M	08/09/1996	155	155	1996	9	8	1996	251	1	1995	18.0000	low
M	08/09/1996	155	155	1996	9	8	1996	251	1	1995	16.0000	low
F	08/09/1996	125	120	1996	9	8	1996	251	1	1995	22.8742	low
M	08/09/1996	160	165	1996	9	8	1996	251	1	1995	18.2708	low
M	11/09/1996	211	208	1996	9	11	1996	254	5	1991	27.4840	low
M	11/09/1996	210	205	1996	9	11	1996	254	4	1992	26.5616	low
M	11/09/1996	242	251	1996	9	11	1996	254	4	1992	31.5000	low
M	11/09/1996	225	220	1996	9	11	1996	254	2	1994	26.0000	low
F	11/09/1996	140	140	1996	9	11	1996	254	1	1995	13.4848	low
M	12/09/1996	230	230	1996	9	12	1996	255	8	1988	31.1759	low
M	12/09/1996	208	210	1996	9	12	1996	255	5	1991	33.0000	low
M	12/09/1996	200	195	1996	9	12	1996	255	2	1994	22.4135	low
F	14/09/1996	210	210	1996	9	14	1996	257	6	1990	26.5616	low
M	14/09/1996	220	191	1996	9	14	1996	257	6	1990	30.0000	low
F	14/09/1996	220	220	1996	9	14	1996	257	4	1992	24.0000	low
M	14/09/1996	203	198	1996	9	14	1996	257	3	1993	26.0000	low
M	14/09/1996	190	190	1996	9	14	1996	257	2	1994	28.7758	low
M	14/09/1996	150	150	1996	9	14	1996	257	1	1995	18.0000	low
M	14/09/1996	165	165	1996	9	14	1996	257	1	1995	21.0319	low
F	15/09/1996	178	175	1996	9	15	1996	258	5	1991	20.1113	low
M	15/09/1996	180	180	1996	9	15	1996	258	1	1995	24.0000	low
M	15/09/1996	176	170	1996	9	15	1996	258	1	1995	17.8108	low
M	17/09/1996	150	150	1996	9	17	1996	260	1	1995	16.0000	low
M	18/09/1996	215	215	1996	9	18	1996	261	7	1989	33.0230	low
M	18/09/1996	220	220	1996	9	18	1996	261	5	1991	41.3432	low
M	18/09/1996	140	130	1996	9	18	1996	261	1	1995	12.7576	low
M	19/09/1996	265	265	1996	9	19	1996	262	7	1989	26.5616	low
F	19/09/1996	109	107	1996	9	19	1996	262	1	1995	15.5125	low
F	20/09/1996	195	195	1996	9	20	1996	263	11	1985	23.0000	low
F	20/09/1996	190	185	1996	9	20	1996	263	10	1986	17.0000	low
M	21/09/1996	200	200	1996	9	21	1996	264	4	1992	30.2526	low
M	21/09/1996	215	215	1996	9	21	1996	264	2	1994	22.8742	low
M	21/09/1996	147	150	1996	9	21	1996	264	1	1995	19.1909	low
F	21/09/1996	164	166	1996	9	21	1996	264	1	1995	22.0000	low
M	22/09/1996	180	180	1996	9	22	1996	265	1	1995	16.4316	low
F	24/09/1996	130	130	1996	9	24	1996	267	1	1995	18.0000	low
M	25/09/1996	206	205	1996	9	25	1996	268	2	1994	23.7957	low
M	25/09/1996	180	180	1996	9	25	1996	268	1	1995	23.0000	low
M	26/09/1996	185	180	1996	9	26	1996	269	2	1994	21.0319	low
F	27/09/1996	60	130	1996	9	27	1996	270	1	1995	20.0000	low
M	28/09/1996	105	100	1996	9	28	1996	271	14	1982	11.0000	low
M	28/09/1996	220	224	1996	9	28	1996	271	10	1986	35.0000	low
M	28/09/1996	230	230	1996	9	28	1996	271	5	1991	26.0000	low
M	28/09/1996	205	210	1996	9	28	1996	271	5	1991	29.3296	low
M	29/09/1996	210	210	1996	9	29	1996	272	10	1986	24.0000	low
F	29/09/1996	194	195	1996	9	29	1996	272	9	1987	25.0000	low
F	29/09/1996	205	200	1996	9	29	1996	272	6	1990	24.7174	low
M	29/09/1996	165	165	1996	9	29	1996	272	1	1995	16.0000	low
F	01/10/1996	214	205	1996	10	1	1996	274	12	1984	19.1909	low
F	01/10/1996	190	190	1996	10	1	1996	274	6	1990	23.7957	low
M	01/10/1996	188	190	1996	10	1	1996	274	1	1995	18.0000	low
M	02/10/1996	224	222	1996	10	2	1996	275	10	1986	27.4840	low
F	02/10/1996	189	189	1996	10	2	1996	275	3	1993	23.7957	low
M	06/10/1996	238	238	1996	10	6	1996	279	4	1992	32.0000	low
M	09/10/1996	210	205	1996	10	9	1996	282	4	1992	30.0000	low
M	09/10/1996	210	200	1996	10	9	1996	282	3	1993	26.0000	low
M	10/10/1996	215	215	1996	10	10	1996	283	4	1992	32.0993	low
M	10/10/1996	210	205	1996	10	10	1996	283	2	1994	26.5616	low
F	10/10/1996	130	130	1996	10	10	1996	283	1	1995	17.0000	low
M	10/10/1996	73	75	1996	10	10	1996	283	1	1995	22.0000	low
F	11/10/1996	42	42	1996	10	11	1996	284	0	1996	13.6755	low
F	12/10/1996	230	225	1996	10	12	1996	285	7	1989	25.0000	low
M	12/10/1996	160	160	1996	10	12	1996	285	1	1995	20.0000	low
M	12/10/1996	180	175	1996	10	12	1996	285	1	1995	17.0000	low
F	13/10/1996	200	210	1996	10	13	1996	286	4	1992	20.1113	low
M	13/10/1996	217	212	1996	10	13	1996	286	3	1993	24.5315	low
M	13/10/1996	190	190	1996	10	13	1996	286	1	1995	21.0000	low
F	15/10/1996	210	210	1996	10	15	1996	288	14	1982	22.8742	low
F	15/10/1996	226	226	1996	10	15	1996	288	14	1982	24.0000	low
F	15/10/1996	185	185	1996	10	15	1996	288	13	1983	23.0000	low
M	15/10/1996	162	160	1996	10	15	1996	288	1	1995	17.0000	low
M	16/10/1996	142	142	1996	10	16	1996	289	1	1995	14.2152	low
M	17/10/1996	210	215	1996	10	17	1996	290	8	1988	30.7142	low
M	17/10/1996	207	211	1996	10	17	1996	290	6	1990	24.0000	low
F	17/10/1996	180	170	1996	10	17	1996	290	5	1991	21.0319	low
M	17/10/1996	215	215	1996	10	17	1996	290	5	1991	24.7174	low
F	17/10/1996	215	215	1996	10	17	1996	290	5	1991	24.7174	low
M	20/10/1996	242	244	1996	10	20	1996	293	6	1990	25.6394	low
M	20/10/1996	225	230	1996	10	20	1996	293	4	1992	34.0000	low
M	20/10/1996	170	165	1996	10	20	1996	293	2	1994	19.1909	low
F	20/10/1996	30	30	1996	10	20	1996	293	0	1996	14.1346	low
F	22/10/1996	235	224	1996	10	22	1996	295	13	1983	23.7957	low
F	22/10/1996	188	187	1996	10	22	1996	295	8	1988	16.8912	low
F	22/10/1996	120	115	1996	10	22	1996	295	1	1995	17.0000	low
F	23/10/1996	124	126	1996	10	23	1996	296	1	1995	22.0000	low
M	24/10/1996	190	195	1996	10	24	1996	297	1	1995	19.5000	low
F	25/10/1996	203	206	1996	10	25	1996	298	11	1985	23.0000	low
F	26/10/1996	195	190	1996	10	26	1996	299	4	1992	23.0000	low
M	26/10/1996	190	190	1996	10	26	1996	299	1	1995	18.2708	low
F	26/10/1996	140	140	1996	10	26	1996	299	1	1995	23.0000	low
M	26/10/1996	170	170	1996	10	26	1996	299	1	1995	19.0000	low
M	27/10/1996	205	200	1996	10	27	1996	300	2	1994	23.7957	low
M	27/10/1996	180	180	1996	10	27	1996	300	1	1995	19.0000	low
F	27/10/1996	135	135	1996	10	27	1996	300	1	1995	16.5000	low
M	27/10/1996	115	110	1996	10	27	1996	300	1	1995	12.7576	low
M	27/10/1996	60	60	1996	10	27	1996	300	0	1996	11.8402	low
M	27/10/1996	64	66	1996	10	27	1996	300	0	1996	13.0000	low
F	29/10/1996	220	222	1996	10	29	1996	302	10	1986	20.8299	low
M	30/10/1996	205	195	1996	10	30	1996	303	4	1992	27.0000	low
F	30/10/1996	160	160	1996	10	30	1996	303	1	1995	20.1113	low
M	01/11/1996	240	248	1996	11	1	1996	305	2	1994	30.7142	low
M	02/11/1996	215	215	1996	11	2	1996	306	8	1988	24.7174	low
M	02/11/1996	165	170	1996	11	2	1996	306	2	1994	25.6394	low
F	03/11/1996	208	205	1996	11	3	1996	307	6	1990	24.2565	low
M	03/11/1996	240	240	1996	11	3	1996	307	6	1990	33.0000	low
F	03/11/1996	180	180	1996	11	3	1996	307	4	1992	20.1113	low
M	03/11/1996	210	210	1996	11	3	1996	307	4	1992	25.0000	low
M	07/11/1996	220	220	1996	11	7	1996	311	5	1991	21.0319	low
F	07/11/1996	195	195	1996	11	7	1996	311	3	1993	24.0000	low
F	09/11/1996	217	217	1996	11	9	1996	313	9	1987	24.0000	low
F	09/11/1996	190	185	1996	11	9	1996	313	6	1990	22.0000	low
F	09/11/1996	202	200	1996	11	9	1996	313	5	1991	23.0000	low
M	09/11/1996	219	226	1996	11	9	1996	313	4	1992	24.0000	low
M	09/11/1996	165	165	1996	11	9	1996	313	2	1994	23.0000	low
F	09/11/1996	140	150	1996	11	9	1996	313	1	1995	21.0319	low
M	09/11/1996	180	180	1996	11	9	1996	313	1	1995	20.0000	low
M	10/11/1996	255	255	1996	11	10	1996	314	6	1990	29.0000	low
F	10/11/1996	195	200	1996	11	10	1996	314	5	1991	21.5000	low
F	10/11/1996	125	130	1996	11	10	1996	314	1	1995	21.0319	low
M	11/11/1996	230	230	1996	11	11	1996	315	5	1991	32.0000	low
M	11/11/1996	165	165	1996	11	11	1996	315	1	1995	26.0000	low
F	11/11/1996	160	160	1996	11	11	1996	315	1	1995	24.0000	low
M	11/11/1996	160	160	1996	11	11	1996	315	1	1995	19.1909	low
F	11/11/1996	89	90	1996	11	11	1996	315	1	1995	23.0489	low
M	19/11/1996	210	210	1996	11	19	1996	323	4	1992	31.0000	low
F	24/11/1996	190	190	1996	11	24	1996	328	4	1992	21.0319	low
F	08/12/1996	210	200	1996	12	8	1996	342	10	1986	26.0000	low
M	30/12/1996	215	215	1996	12	30	1996	364	7	1989	27.0000	low
M	14/09/1997	190	190	1997	9	14	1997	257	6	1991	17.8816	low
M	14/09/1997	212	210	1997	9	14	1997	257	5	1992	29.5000	low
M	14/09/1997	220	220	1997	9	14	1997	257	4	1993	25.0000	low
M	14/09/1997	160	160	1997	9	14	1997	257	2	1995	18.2708	low
M	14/09/1997	252	251	1997	9	14	1997	257	2	1995	26.0000	low
M	14/09/1997	144	144	1997	9	14	1997	257	1	1996	25.0000	low
M	16/09/1997	164	167	1997	9	16	1997	259	1	1996	18.7308	low
F	16/09/1997	112	113	1997	9	16	1997	259	1	1996	14.5938	low
F	17/09/1997	215	210	1997	9	17	1997	260	15	1982	21.0000	low
F	17/09/1997	220	220	1997	9	17	1997	260	8	1989	24.7174	low
M	17/09/1997	240	240	1997	9	17	1997	260	5	1992	27.0000	low
M	17/09/1997	245	250	1997	9	17	1997	260	3	1994	27.4840	low
M	17/09/1997	245	240	1997	9	17	1997	260	3	1994	30.5000	low
F	17/09/1997	150	150	1997	9	17	1997	260	1	1996	22.0000	low
M	17/09/1997	170	170	1997	9	17	1997	260	1	1996	17.0000	low
M	17/09/1997	170	170	1997	9	17	1997	260	1	1996	19.1909	low
F	17/09/1997	125	125	1997	9	17	1997	260	1	1996	17.0000	low
M	17/09/1997	177	180	1997	9	17	1997	260	1	1996	20.0000	low
M	18/09/1997	220	220	1997	9	18	1997	261	10	1987	32.0993	low
M	18/09/1997	235	235	1997	9	18	1997	261	9	1988	39.0000	low
M	18/09/1997	220	220	1997	9	18	1997	261	6	1991	29.3296	low
M	18/09/1997	240	235	1997	9	18	1997	261	5	1992	36.7193	low
M	18/09/1997	221	220	1997	9	18	1997	261	4	1993	35.3328	low
M	18/09/1997	190	197	1997	9	18	1997	261	4	1993	25.1784	low
M	18/09/1997	170	175	1997	9	18	1997	261	1	1996	19.0000	low
F	18/09/1997	88	90	1997	9	18	1997	261	1	1996	12.5000	low
M	20/09/1997	220	220	1997	9	20	1997	263	4	1993	27.4840	low
M	20/09/1997	145	145	1997	9	20	1997	263	4	1993	32.5000	low
M	20/09/1997	190	185	1997	9	20	1997	263	3	1994	27.4840	low
M	20/09/1997	145	147	1997	9	20	1997	263	1	1996	21.9529	low
M	21/09/1997	220	220	1997	9	21	1997	264	7	1990	32.0000	low
M	21/09/1997	210	215	1997	9	21	1997	264	5	1992	29.3296	low
M	21/09/1997	240	240	1997	9	21	1997	264	4	1993	32.0000	low
M	21/09/1997	130	130	1997	9	21	1997	264	2	1995	21.5000	low
F	22/09/1997	225	220	1997	9	22	1997	265	10	1987	24.0000	low
F	22/09/1997	170	170	1997	9	22	1997	265	6	1991	25.0000	low
M	22/09/1997	200	200	1997	9	22	1997	265	6	1991	32.0993	low
F	22/09/1997	201	197	1997	9	22	1997	265	6	1991	23.0000	low
M	24/09/1997	220	220	1997	9	24	1997	267	2	1995	29.0000	low
F	24/09/1997	180	180	1997	9	24	1997	267	1	1996	19.0000	low
F	24/09/1997	130	130	1997	9	24	1997	267	1	1996	17.8108	low
F	24/09/1997	122	120	1997	9	24	1997	267	1	1996	16.5000	low
M	25/09/1997	220	220	1997	9	25	1997	268	6	1991	28.4067	low
F	25/09/1997	220	215	1997	9	25	1997	268	6	1991	24.5000	low
M	25/09/1997	240	240	1997	9	25	1997	268	3	1994	32.0000	low
M	26/09/1997	216	218	1997	9	26	1997	269	4	1993	31.1759	low
M	26/09/1997	160	160	1997	9	26	1997	269	1	1996	16.4316	low
F	27/09/1997	200	200	1997	9	27	1997	270	4	1993	23.0000	low
M	27/09/1997	230	230	1997	9	27	1997	270	4	1993	30.0000	low
M	27/09/1997	168	165	1997	9	27	1997	270	1	1996	20.0000	low
M	27/09/1997	34	35	1997	9	27	1997	270	0	1997	9.5000	low
M	28/09/1997	240	240	1997	9	28	1997	271	10	1987	33.0000	low
M	28/09/1997	220	220	1997	9	28	1997	271	6	1991	29.0000	low
M	28/09/1997	230	230	1997	9	28	1997	271	4	1993	28.4067	low
F	28/09/1997	160	162	1997	9	28	1997	271	2	1995	22.8742	low
F	29/09/1997	180	180	1997	9	29	1997	272	10	1987	25.0000	low
F	29/09/1997	130	130	1997	9	29	1997	272	3	1994	19.1909	low
M	29/09/1997	225	225	1997	9	29	1997	272	3	1994	32.0993	low
M	01/10/1997	210	210	1997	10	1	1997	274	3	1994	31.5000	low
M	01/10/1997	165	160	1997	10	1	1997	274	1	1996	16.0000	low
F	01/10/1997	135	140	1997	10	1	1997	274	1	1996	15.0000	low
M	01/10/1997	148	147	1997	10	1	1997	274	1	1996	18.7308	low
M	02/10/1997	210	210	1997	10	2	1997	275	4	1993	31.1759	low
M	04/10/1997	232	238	1997	10	4	1997	277	6	1991	34.8708	low
M	04/10/1997	212	202	1997	10	4	1997	277	4	1993	25.6394	low
M	04/10/1997	216	220	1997	10	4	1997	277	3	1994	34.8708	low
M	04/10/1997	180	185	1997	10	4	1997	277	1	1996	29.0000	low
M	04/10/1997	177	178	1997	10	4	1997	277	1	1996	14.2152	low
F	04/10/1997	130	135	1997	10	4	1997	277	1	1996	15.0000	low
F	05/10/1997	190	200	1997	10	5	1997	278	15	1982	21.0319	low
M	05/10/1997	215	220	1997	10	5	1997	278	6	1991	26.5616	low
M	05/10/1997	126	215	1997	10	5	1997	278	6	1991	32.0993	low
M	05/10/1997	240	235	1997	10	5	1997	278	5	1992	32.0993	low
M	05/10/1997	170	170	1997	10	5	1997	278	1	1996	23.7957	low
M	06/10/1997	155	155	1997	10	6	1997	279	1	1996	16.4316	low
F	06/10/1997	130	140	1997	10	6	1997	279	1	1996	19.0000	low
F	08/10/1997	254	255	1997	10	8	1997	281	8	1989	33.9468	low
F	08/10/1997	205	211	1997	10	8	1997	281	7	1990	24.5000	low
F	08/10/1997	179	175	1997	10	8	1997	281	3	1994	25.0000	low
M	08/10/1997	192	193	1997	10	8	1997	281	3	1994	21.5000	low
F	08/10/1997	195	188	1997	10	8	1997	281	2	1995	22.0000	low
F	08/10/1997	153	152	1997	10	8	1997	281	1	1996	20.1113	low
M	08/10/1997	160	159	1997	10	8	1997	281	1	1996	15.0531	low
M	08/10/1997	145	145	1997	10	8	1997	281	1	1996	15.9720	low
M	08/10/1997	174	173	1997	10	8	1997	281	1	1996	19.0000	low
M	08/10/1997	174	173	1997	10	8	1997	281	1	1996	19.0000	low
F	09/10/1997	195	192	1997	10	9	1997	282	11	1986	19.6510	low
F	09/10/1997	223	220	1997	10	9	1997	282	8	1989	22.8742	low
F	09/10/1997	195	190	1997	10	9	1997	282	7	1990	22.4135	low
M	09/10/1997	215	220	1997	10	9	1997	282	3	1994	26.5000	low
F	09/10/1997	137	136	1997	10	9	1997	282	1	1996	20.0000	low
M	09/10/1997	192	190	1997	10	9	1997	282	1	1996	21.9529	low
M	09/10/1997	163	163	1997	10	9	1997	282	1	1996	19.5000	low
M	11/10/1997	120	125	1997	10	11	1997	284	1	1996	19.0000	low
M	11/10/1997	150	150	1997	10	11	1997	284	1	1996	17.3510	low
M	11/10/1997	185	187	1997	10	11	1997	284	1	1996	24.2565	low
M	12/10/1997	225	230	1997	10	12	1997	285	7	1990	31.9791	low
F	12/10/1997	140	138	1997	10	12	1997	285	1	1996	18.2708	low
F	13/10/1997	209	209	1997	10	13	1997	286	10	1987	21.0319	low
M	13/10/1997	208	218	1997	10	13	1997	286	4	1993	32.0000	low
M	14/10/1997	212	213	1997	10	14	1997	287	4	1993	34.0000	low
M	14/10/1997	219	219	1997	10	14	1997	287	2	1995	25.1784	low
M	14/10/1997	164	168	1997	10	14	1997	287	1	1996	19.5000	low
F	15/10/1997	200	195	1997	10	15	1997	288	8	1989	23.7957	low
F	15/10/1997	190	190	1997	10	15	1997	288	5	1992	21.5000	low
M	15/10/1997	248	245	1997	10	15	1997	288	3	1994	25.0000	low
M	15/10/1997	205	205	1997	10	15	1997	288	3	1994	26.5616	low
M	15/10/1997	200	200	1997	10	15	1997	288	3	1994	21.0319	low
M	15/10/1997	160	160	1997	10	15	1997	288	1	1996	19.1909	low
F	18/10/1997	95	95	1997	10	18	1997	291	1	1996	18.0000	low
F	19/10/1997	210	210	1997	10	19	1997	292	14	1983	22.8742	low
F	19/10/1997	190	190	1997	10	19	1997	292	4	1993	24.7174	low
F	19/10/1997	130	135	1997	10	19	1997	292	1	1996	15.5125	low
F	21/10/1997	155	156	1997	10	21	1997	294	1	1996	21.0000	low
F	22/10/1997	189	190	1997	10	22	1997	295	7	1990	27.0000	low
F	22/10/1997	191	195	1997	10	22	1997	295	7	1990	22.8742	low
M	22/10/1997	200	200	1997	10	22	1997	295	5	1992	31.0000	low
M	22/10/1997	210	210	1997	10	22	1997	295	5	1992	25.7000	low
F	22/10/1997	185	185	1997	10	22	1997	295	5	1992	20.5716	low
M	22/10/1997	140	145	1997	10	22	1997	295	1	1996	20.0000	low
M	22/10/1997	164	164	1997	10	22	1997	295	1	1996	20.0000	low
M	22/10/1997	156	156	1997	10	22	1997	295	1	1996	19.0000	low
M	22/10/1997	152	152	1997	10	22	1997	295	1	1996	19.1909	low
M	23/10/1997	230	230	1997	10	23	1997	296	4	1993	25.0000	low
F	23/10/1997	120	124	1997	10	23	1997	296	1	1996	20.0000	low
M	25/10/1997	215	225	1997	10	25	1997	298	7	1990	28.0000	low
F	25/10/1997	205	205	1997	10	25	1997	298	5	1992	27.4840	low
M	25/10/1997	165	165	1997	10	25	1997	298	1	1996	17.5349	low
F	25/10/1997	142	140	1997	10	25	1997	298	1	1996	16.8912	low
M	26/10/1997	215	212	1997	10	26	1997	299	3	1994	30.2526	low
M	26/10/1997	170	165	1997	10	26	1997	299	1	1996	18.2708	low
M	26/10/1997	183	190	1997	10	26	1997	299	1	1996	18.2708	low
M	29/10/1997	210	210	1997	10	29	1997	302	7	1990	29.3296	low
M	29/10/1997	240	240	1997	10	29	1997	302	6	1991	33.0000	low
F	29/10/1997	195	200	1997	10	29	1997	302	5	1992	23.5000	low
F	30/10/1997	190	190	1997	10	30	1997	303	9	1988	20.0000	low
F	30/10/1997	220	220	1997	10	30	1997	303	7	1990	25.5000	low
M	30/10/1997	230	230	1997	10	30	1997	303	3	1994	24.5000	low
M	30/10/1997	210	210	1997	10	30	1997	303	2	1995	26.0000	low
F	30/10/1997	110	110	1997	10	30	1997	303	1	1996	15.5125	low
F	30/10/1997	110	110	1997	10	30	1997	303	1	1996	13.2165	low
F	30/10/1997	142	142	1997	10	30	1997	303	1	1996	20.1113	low
F	30/10/1997	150	150	1997	10	30	1997	303	1	1996	21.0000	low
F	30/10/1997	130	130	1997	10	30	1997	303	1	1996	21.0319	low
M	30/10/1997	50	50	1997	10	30	1997	303	0	1997	10.0000	low
M	01/11/1997	220	205	1997	11	1	1997	305	5	1992	26.5616	low
F	01/11/1997	165	165	1997	11	1	1997	305	4	1993	19.6510	low
M	01/11/1997	200	200	1997	11	1	1997	305	3	1994	28.0000	low
M	01/11/1997	200	205	1997	11	1	1997	305	2	1995	26.5616	low
F	01/11/1997	150	150	1997	11	1	1997	305	1	1996	18.5000	low
F	02/11/1997	200	205	1997	11	2	1997	306	11	1986	30.0000	low
M	02/11/1997	225	225	1997	11	2	1997	306	3	1994	27.4840	low
M	02/11/1997	121	119	1997	11	2	1997	306	1	1996	19.1909	low
M	03/11/1997	230	230	1997	11	3	1997	307	11	1986	27.0000	low
F	03/11/1997	210	202	1997	11	3	1997	307	7	1990	25.6394	low
F	03/11/1997	190	190	1997	11	3	1997	307	4	1993	24.7174	low
M	05/11/1997	225	225	1997	11	5	1997	309	5	1992	28.4067	low
M	05/11/1997	150	150	1997	11	5	1997	309	1	1996	20.0000	low
M	08/11/1997	235	235	1997	11	8	1997	312	4	1993	27.4840	low
F	08/11/1997	110	107	1997	11	8	1997	312	1	1996	15.5125	low
M	09/11/1997	230	230	1997	11	9	1997	313	7	1990	31.1759	low
M	09/11/1997	235	240	1997	11	9	1997	313	5	1992	28.4067	low
M	09/11/1997	220	220	1997	11	9	1997	313	4	1993	23.7957	low
M	09/11/1997	230	230	1997	11	9	1997	313	4	1993	28.4067	low
F	09/11/1997	109	107	1997	11	9	1997	313	1	1996	12.7576	low
F	09/11/1997	60	80	1997	11	9	1997	313	1	1996	20.0000	low
F	09/11/1997	162	168	1997	11	9	1997	313	1	1996	19.1909	low
F	11/11/1997	170	175	1997	11	11	1997	315	10	1987	21.7687	low
F	11/11/1997	215	220	1997	11	11	1997	315	7	1990	24.7174	low
F	11/11/1997	200	200	1997	11	11	1997	315	6	1991	23.7957	low
F	11/11/1997	205	205	1997	11	11	1997	315	5	1992	27.0000	low
M	11/11/1997	210	210	1997	11	11	1997	315	5	1992	30.0000	low
M	11/11/1997	210	205	1997	11	11	1997	315	4	1993	30.0000	low
F	11/11/1997	160	160	1997	11	11	1997	315	1	1996	16.4316	low
F	11/11/1997	104	107	1997	11	11	1997	315	1	1996	12.7576	low
M	11/11/1997	105	110	1997	11	11	1997	315	1	1996	21.9529	low
M	11/11/1997	180	180	1997	11	11	1997	315	1	1996	20.1113	low
M	11/11/1997	165	160	1997	11	11	1997	315	1	1996	21.9529	low
M	30/11/1997	240	245	1997	11	30	1997	334	3	1994	25.6394	low
M	04/12/1997	210	210	1997	12	4	1997	338	6	1991	27.4840	low
M	07/12/1997	225	235	1997	12	7	1997	341	8	1989	25.6394	low
F	09/12/1997	232	237	1997	12	9	1997	343	13	1984	21.5000	low
F	10/12/1997	215	210	1997	12	10	1997	344	10	1987	21.9529	low
F	10/12/1997	25	27	1997	12	10	1997	344	0	1997	9.0000	low
M	13/12/1997	160	170	1997	12	13	1997	347	1	1996	18.0000	low
F	13/12/1997	145	150	1997	12	13	1997	347	1	1996	17.5000	low
M	14/12/1997	190	190	1997	12	14	1997	348	6	1991	25.0000	low
M	14/12/1997	170	175	1997	12	14	1997	348	1	1996	16.4316	low
F	19/02/1998	180	180	1997	2	19	1998	415	7	1990	22.0000	low
F	24/02/1998	229	222	1997	2	24	1998	420	14	1983	18.0000	low
F	26/02/1998	223	224	1997	2	26	1998	422	4	1993	19.1909	low
F	26/02/1998	146	145	1997	2	26	1998	422	1	1996	18.0000	low
M	13/09/1998	194	198	1998	9	13	1998	256	4	1994	26.0000	low
M	13/09/1998	210	210	1998	9	13	1998	256	4	1994	31.5000	low
M	13/09/1998	205	200	1998	9	13	1998	256	3	1995	35.0000	low
F	13/09/1998	155	160	1998	9	13	1998	256	3	1995	21.9529	low
F	13/09/1998	132	130	1998	9	13	1998	256	1	1997	20.1113	low
M	13/09/1998	160	160	1998	9	13	1998	256	1	1997	20.1113	low
F	14/09/1998	193	190	1998	9	14	1998	257	10	1988	21.4000	low
M	15/09/1998	148	148	1998	9	15	1998	258	1	1997	15.2368	low
F	16/09/1998	180	178	1998	9	16	1998	259	8	1990	17.8000	low
M	16/09/1998	175	172	1998	9	16	1998	259	3	1995	23.0000	low
F	16/09/1998	180	175	1998	9	16	1998	259	3	1995	23.0000	low
F	16/09/1998	172	172	1998	9	16	1998	259	2	1996	16.4316	low
F	16/09/1998	148	150	1998	9	16	1998	259	1	1997	16.6000	low
F	16/09/1998	122	120	1998	9	16	1998	259	1	1997	18.4548	low
M	17/09/1998	240	240	1998	9	17	1998	260	8	1990	32.0000	low
M	17/09/1998	220	215	1998	9	17	1998	260	4	1994	33.0230	low
F	17/09/1998	180	175	1998	9	17	1998	260	2	1996	20.5000	low
F	17/09/1998	120	120	1998	9	17	1998	260	1	1997	15.0000	low
F	17/09/1998	130	125	1998	9	17	1998	260	1	1997	15.5125	low
F	17/09/1998	112	110	1998	9	17	1998	260	1	1997	15.9720	low
M	17/09/1998	150	150	1998	9	17	1998	260	1	1997	20.4000	low
M	19/09/1998	210	210	1998	9	19	1998	262	3	1995	20.1113	low
M	19/09/1998	210	205	1998	9	19	1998	262	2	1996	27.4840	low
M	19/09/1998	120	120	1998	9	19	1998	262	1	1997	15.0000	low
F	20/09/1998	200	190	1998	9	20	1998	263	10	1988	28.0000	low
F	20/09/1998	190	191	1998	9	20	1998	263	5	1993	21.5000	low
M	20/09/1998	205	205	1998	9	20	1998	263	3	1995	22.8742	low
F	20/09/1998	162	166	1998	9	20	1998	263	2	1996	25.0000	low
M	20/09/1998	160	151	1998	9	20	1998	263	1	1997	19.0000	low
M	20/09/1998	140	140	1998	9	20	1998	263	1	1997	15.0000	low
F	21/09/1998	202	203	1998	9	21	1998	264	9	1989	22.0000	low
M	21/09/1998	212	208	1998	9	21	1998	264	5	1993	29.0000	low
F	23/09/1998	206	210	1998	9	23	1998	266	8	1990	25.0000	low
M	23/09/1998	215	220	1998	9	23	1998	266	6	1992	29.6000	low
F	23/09/1998	168	168	1998	9	23	1998	266	4	1994	20.0000	low
F	23/09/1998	200	195	1998	9	23	1998	266	4	1994	28.0000	low
M	23/09/1998	205	205	1998	9	23	1998	266	2	1996	29.0000	low
M	23/09/1998	150	150	1998	9	23	1998	266	1	1997	20.0000	low
M	24/09/1998	245	245	1998	9	24	1998	267	7	1991	36.0000	low
F	24/09/1998	123	120	1998	9	24	1998	267	1	1997	19.0000	low
M	24/09/1998	83	85	1998	9	24	1998	267	1	1997	20.1113	low
M	24/09/1998	150	150	1998	9	24	1998	267	1	1997	21.0000	low
M	25/09/1998	239	229	1998	9	25	1998	268	7	1991	32.8000	low
F	25/09/1998	205	200	1998	9	25	1998	268	7	1991	20.4000	low
M	25/09/1998	240	240	1998	9	25	1998	268	7	1991	28.5000	low
M	25/09/1998	232	234	1998	9	25	1998	268	4	1994	21.5000	low
F	25/09/1998	166	163	1998	9	25	1998	268	2	1996	22.3000	low
M	26/09/1998	235	235	1998	9	26	1998	269	6	1992	24.5315	low
M	26/09/1998	200	200	1998	9	26	1998	269	6	1992	25.6394	low
M	26/09/1998	215	212	1998	9	26	1998	269	3	1995	27.4840	low
F	26/09/1998	138	138	1998	9	26	1998	269	1	1997	20.0000	low
F	27/09/1998	125	128	1998	9	27	1998	270	1	1997	16.4316	low
F	29/09/1998	135	132	1998	9	29	1998	272	1	1997	18.6000	low
M	30/09/1998	198	195	1998	9	30	1998	273	4	1994	31.5000	low
M	30/09/1998	115	120	1998	9	30	1998	273	1	1997	15.6000	low
M	01/10/1998	238	238	1998	10	1	1998	274	6	1992	36.0000	low
M	01/10/1998	222	230	1998	10	1	1998	274	4	1994	28.9000	low
F	01/10/1998	120	120	1998	10	1	1998	274	1	1997	17.8108	low
M	01/10/1998	155	154	1998	10	1	1998	274	1	1997	16.2000	low
M	04/10/1998	235	235	1998	10	4	1998	277	12	1986	34.0000	low
F	04/10/1998	130	125	1998	10	4	1998	277	1	1997	19.0000	low
M	05/10/1998	225	225	1998	10	5	1998	278	8	1990	32.0000	low
M	05/10/1998	225	235	1998	10	5	1998	278	6	1992	30.0000	low
M	05/10/1998	208	206	1998	10	5	1998	278	3	1995	23.8000	low
F	05/10/1998	120	124	1998	10	5	1998	278	1	1997	15.0000	low
F	05/10/1998	85	80	1998	10	5	1998	278	1	1997	16.8000	low
M	09/10/1998	206	210	1998	10	9	1998	282	12	1986	28.5000	low
F	09/10/1998	190	190	1998	10	9	1998	282	10	1988	22.8000	low
M	09/10/1998	239	261	1998	10	9	1998	282	10	1988	33.0000	low
F	09/10/1998	203	206	1998	10	9	1998	282	6	1992	23.5000	low
F	10/10/1998	200	203	1998	10	10	1998	283	8	1990	24.0000	low
F	10/10/1998	145	150	1998	10	10	1998	283	2	1996	20.1113	low
M	10/10/1998	135	135	1998	10	10	1998	283	1	1997	12.2989	low
M	10/10/1998	175	175	1998	10	10	1998	283	1	1997	20.1113	low
M	10/10/1998	42	42	1998	10	10	1998	283	0	1998	11.0000	high
F	12/10/1998	187	184	1998	10	12	1998	285	6	1992	19.9000	low
F	12/10/1998	175	190	1998	10	12	1998	285	5	1993	24.4409	low
F	13/10/1998	213	213	1998	10	13	1998	286	12	1986	19.8000	low
F	13/10/1998	205	203	1998	10	13	1998	286	8	1990	26.1005	low
F	13/10/1998	220	221	1998	10	13	1998	286	7	1991	20.8000	low
F	13/10/1998	175	190	1998	10	13	1998	286	5	1993	24.4409	low
F	13/10/1998	163	165	1998	10	13	1998	286	2	1996	20.9000	low
F	13/10/1998	155	153	1998	10	13	1998	286	1	1997	20.7000	low
F	14/10/1998	190	184	1998	10	14	1998	287	8	1990	21.6000	low
M	14/10/1998	230	230	1998	10	14	1998	287	5	1993	24.5315	low
F	15/10/1998	236	244	1998	10	15	1998	288	9	1989	25.1784	low
M	15/10/1998	230	232	1998	10	15	1998	288	2	1996	24.0000	low
M	15/10/1998	150	150	1998	10	15	1998	288	1	1997	16.4316	low
F	15/10/1998	124	120	1998	10	15	1998	288	1	1997	17.2590	low
F	15/10/1998	127	131	1998	10	15	1998	288	1	1997	17.2000	low
F	17/10/1998	223	220	1998	10	17	1998	290	9	1989	21.9529	low
F	17/10/1998	167	165	1998	10	17	1998	290	8	1990	27.0000	low
F	17/10/1998	130	130	1998	10	17	1998	290	7	1991	19.0000	low
M	17/10/1998	222	224	1998	10	17	1998	290	5	1993	27.4840	low
M	17/10/1998	215	215	1998	10	17	1998	290	4	1994	29.3296	low
F	17/10/1998	190	194	1998	10	17	1998	290	3	1995	25.6394	low
F	17/10/1998	160	160	1998	10	17	1998	290	3	1995	23.0000	low
F	18/10/1998	180	185	1998	10	18	1998	291	3	1995	21.0319	low
M	21/10/1998	230	235	1998	10	21	1998	294	5	1993	26.0165	low
M	21/10/1998	190	190	1998	10	21	1998	294	2	1996	22.8742	low
F	22/10/1998	185	185	1998	10	22	1998	295	3	1995	21.0000	low
F	22/10/1998	169	171	1998	10	22	1998	295	3	1995	17.5000	low
F	23/10/1998	210	213	1998	10	23	1998	296	11	1987	24.5000	low
F	23/10/1998	120	124	1998	10	23	1998	296	1	1997	15.0000	low
F	24/10/1998	190	190	1998	10	24	1998	297	3	1995	19.0000	low
M	24/10/1998	180	180	1998	10	24	1998	297	2	1996	23.7957	low
M	24/10/1998	130	130	1998	10	24	1998	297	1	1997	21.9529	low
M	25/10/1998	220	220	1998	10	25	1998	298	7	1991	28.0000	low
M	25/10/1998	235	230	1998	10	25	1998	298	4	1994	32.5000	low
F	25/10/1998	160	162	1998	10	25	1998	298	1	1997	20.5716	low
F	28/10/1998	203	200	1998	10	28	1998	301	7	1991	24.6000	low
M	28/10/1998	210	220	1998	10	28	1998	301	5	1993	33.0000	low
M	28/10/1998	230	230	1998	10	28	1998	301	4	1994	17.8816	low
F	29/10/1998	208	207	1998	10	29	1998	302	10	1988	24.5000	low
M	29/10/1998	210	219	1998	10	29	1998	302	7	1991	28.0000	low
F	29/10/1998	197	197	1998	10	29	1998	302	7	1991	21.1240	low
M	29/10/1998	195	192	1998	10	29	1998	302	3	1995	25.6394	low
M	30/10/1998	226	230	1998	10	30	1998	303	4	1994	24.2000	low
F	31/10/1998	215	210	1998	10	31	1998	304	6	1992	25.0000	low
M	31/10/1998	235	240	1998	10	31	1998	304	4	1994	30.0000	low
M	31/10/1998	220	225	1998	10	31	1998	304	3	1995	24.7174	low
F	31/10/1998	192	192	1998	10	31	1998	304	2	1996	22.8742	low
F	01/11/1998	135	145	1998	11	1	1998	305	2	1996	25.6394	low
M	03/11/1998	225	230	1998	11	3	1998	307	6	1992	33.5000	low
F	04/11/1998	109	105	1998	11	4	1998	308	1	1997	14.4000	low
M	04/11/1998	150	160	1998	11	4	1998	308	1	1997	16.6000	low
F	05/11/1998	192	195	1998	11	5	1998	309	11	1987	22.0000	low
F	05/11/1998	120	120	1998	11	5	1998	309	1	1997	20.1113	low
F	06/11/1998	206	208	1998	11	6	1998	310	10	1988	20.3000	low
M	07/11/1998	240	240	1998	11	7	1998	311	7	1991	34.0000	low
M	07/11/1998	210	210	1998	11	7	1998	311	4	1994	27.4840	low
M	07/11/1998	170	180	1998	11	7	1998	311	1	1997	21.0000	low
M	07/11/1998	183	184	1998	11	7	1998	311	1	1997	20.5000	low
M	07/11/1998	175	172	1998	11	7	1998	311	1	1997	18.2708	low
M	07/11/1998	185	185	1998	11	7	1998	311	1	1997	23.0000	low
F	08/11/1998	195	195	1998	11	8	1998	312	5	1993	22.0000	low
M	08/11/1998	205	205	1998	11	8	1998	312	4	1994	19.1909	low
M	08/11/1998	215	185	1998	11	8	1998	312	3	1995	21.9529	low
F	08/11/1998	198	200	1998	11	8	1998	312	2	1996	24.0000	low
M	09/11/1998	218	220	1998	11	9	1998	313	5	1993	28.0000	low
F	11/11/1998	180	182	1998	11	11	1998	315	5	1993	19.1909	low
F	11/11/1998	175	170	1998	11	11	1998	315	5	1993	21.5000	low
F	11/11/1998	170	170	1998	11	11	1998	315	3	1995	20.1113	low
M	11/11/1998	115	110	1998	11	11	1998	315	2	1996	22.0000	low
M	11/11/1998	180	180	1998	11	11	1998	315	1	1997	22.0000	low
F	11/11/1998	93	93	1998	11	11	1998	315	1	1997	14.5000	low
F	11/11/1998	27	25	1998	11	11	1998	315	0	1998	10.0000	high
M	15/11/1998	225	230	1998	11	15	1998	319	3	1995	27.5000	low
M	29/11/1998	230	235	1998	11	29	1998	333	6	1992	26.0000	low
F	29/11/1998	175	180	1998	11	29	1998	333	5	1993	26.0000	low
M	29/11/1998	225	230	1998	11	29	1998	333	4	1994	28.0000	low
M	29/11/1998	120	115	1998	11	29	1998	333	1	1997	18.2708	low
F	02/12/1998	170	170	1998	12	2	1998	336	7	1991	22.8742	low
F	05/12/1998	130	130	1998	12	5	1998	339	1	1997	17.0000	low
M	06/12/1998	225	225	1998	12	6	1998	340	7	1991	33.0230	low
F	09/12/1998	200	195	1998	12	9	1998	343	8	1990	27.0000	low
M	09/12/1998	225	225	1998	12	9	1998	343	3	1995	24.2565	low
M	09/12/1998	185	195	1998	12	9	1998	343	1	1997	19.1909	low
F	12/12/1998	200	200	1998	12	12	1998	346	1	1997	18.2708	low
M	12/12/1998	150	155	1998	12	12	1998	346	1	1997	17.0000	low
F	13/12/1998	180	176	1998	12	13	1998	347	2	1996	22.0000	low
F	15/12/1998	125	120	1998	12	15	1998	349	1	1997	20.0000	low
F	16/12/1998	160	160	1998	12	16	1998	350	4	1994	20.0000	low
F	19/12/1998	210	200	1998	12	19	1998	353	11	1987	29.0000	high
F	19/12/1998	245	245	1998	12	19	1998	353	9	1989	25.0000	low
F	19/12/1998	210	205	1998	12	19	1998	353	7	1991	24.7174	low
M	19/12/1998	230	235	1998	12	19	1998	353	7	1991	27.0000	low
M	19/12/1998	170	170	1998	12	19	1998	353	1	1997	16.4316	low
M	19/12/1998	165	150	1998	12	19	1998	353	1	1997	18.5000	low
F	19/12/1998	125	125	1998	12	19	1998	353	1	1997	16.4316	low
M	19/12/1998	55	52	1998	12	19	1998	353	0	1998	10.5000	high
M	20/12/1998	180	200	1998	12	20	1998	354	1	1997	18.0000	low
F	20/12/1998	149	150	1998	12	20	1998	354	1	1997	17.0000	low
M	20/12/1998	172	171	1998	12	20	1998	354	1	1997	21.0000	low
F	20/12/1998	87	90	1998	12	20	1998	354	0	1998	10.5000	high
F	02/01/1999	180	170	1998	1	2	1999	367	1	1997	18.2708	low
F	02/01/1999	180	170	1998	1	2	1999	367	1	1997	18.2708	low
F	07/01/1999	146	148	1998	1	7	1999	372	1	1997	20.0000	low
M	19/01/1999	225	225	1998	1	19	1999	384	15	1983	21.5000	low
F	19/01/1999	172	180	1998	1	19	1999	384	8	1990	22.1371	low
F	21/01/1999	185	190	1998	1	21	1999	386	11	1987	19.8000	low
M	21/01/1999	208	209	1998	1	21	1999	386	8	1990	24.3000	low
F	07/09/1999	240	243	1999	9	7	1999	250	14	1985	22.3000	low
F	12/09/1999	160	160	1999	9	12	1999	255	3	1996	20.5000	low
M	12/09/1999	200	200	1999	9	12	1999	255	1	1998	9.0912	high
F	12/09/1999	110	110	1999	9	12	1999	255	1	1998	21.0319	high
F	13/09/1999	162	165	1999	9	13	1999	256	4	1995	20.6000	low
F	13/09/1999	162	165	1999	9	13	1999	256	4	1995	20.6000	low
M	15/09/1999	240	240	1999	9	15	1999	258	7	1992	30.2526	low
F	15/09/1999	130	125	1999	9	15	1999	258	6	1993	20.0000	low
M	15/09/1999	210	214	1999	9	15	1999	258	4	1995	25.8000	low
M	15/09/1999	195	200	1999	9	15	1999	258	3	1996	27.4840	low
F	16/09/1999	70	70	1999	9	16	1999	259	1	1998	15.0000	high
F	17/09/1999	180	175	1999	9	17	1999	260	7	1992	23.7957	low
M	18/09/1999	220	220	1999	9	18	1999	261	3	1996	25.0000	low
M	18/09/1999	180	180	1999	9	18	1999	261	1	1998	22.0000	high
F	19/09/1999	110	110	1999	9	19	1999	262	7	1992	25.0000	low
M	19/09/1999	191	192	1999	9	19	1999	262	5	1994	27.0228	low
M	19/09/1999	203	205	1999	9	19	1999	262	4	1995	32.1000	low
M	19/09/1999	220	220	1999	9	19	1999	262	3	1996	22.8742	low
M	19/09/1999	210	205	1999	9	19	1999	262	3	1996	28.0000	low
M	19/09/1999	155	155	1999	9	19	1999	262	1	1998	19.1909	high
F	19/09/1999	139	138	1999	9	19	1999	262	1	1998	17.5000	high
M	19/09/1999	155	155	1999	9	19	1999	262	1	1998	18.0000	high
F	21/09/1999	179	179	1999	9	21	1999	264	7	1992	20.0192	low
F	21/09/1999	215	218	1999	9	21	1999	264	7	1992	24.9940	low
M	22/09/1999	177	178	1999	9	22	1999	265	3	1996	29.1000	low
M	22/09/1999	200	200	1999	9	22	1999	265	2	1997	25.6394	low
F	22/09/1999	150	150	1999	9	22	1999	265	2	1997	18.2708	low
M	22/09/1999	165	165	1999	9	22	1999	265	1	1998	21.0000	high
M	23/09/1999	199	200	1999	9	23	1999	266	7	1992	27.2000	low
F	23/09/1999	180	180	1999	9	23	1999	266	4	1995	32.5611	low
M	23/09/1999	205	205	1999	9	23	1999	266	3	1996	30.0000	low
M	23/09/1999	220	220	1999	9	23	1999	266	3	1996	25.6394	low
M	23/09/1999	140	140	1999	9	23	1999	266	1	1998	15.0000	high
F	23/09/1999	110	110	1999	9	23	1999	266	1	1998	11.8402	high
F	23/09/1999	153	148	1999	9	23	1999	266	1	1998	19.2000	high
M	26/09/1999	220	220	1999	9	26	1999	269	3	1996	29.0000	low
M	29/09/1999	190	150	1999	9	29	1999	272	8	1991	29.1450	low
F	29/09/1999	180	180	1999	9	29	1999	272	4	1995	29.3296	low
F	29/09/1999	165	162	1999	9	29	1999	272	2	1997	19.0068	low
F	01/10/1999	181	184	1999	10	1	1999	274	15	1984	26.3000	low
F	01/10/1999	155	150	1999	10	1	1999	274	9	1990	20.6636	low
M	01/10/1999	200	210	1999	10	1	1999	274	6	1993	32.2000	low
M	02/10/1999	200	200	1999	10	2	1999	275	7	1992	34.0000	low
M	02/10/1999	215	215	1999	10	2	1999	275	7	1992	34.9723	low
M	02/10/1999	150	175	1999	10	2	1999	275	3	1996	25.6394	low
M	03/10/1999	195	190	1999	10	3	1999	276	4	1995	27.4840	low
F	05/10/1999	152	152	1999	10	5	1999	278	3	1996	21.1000	low
M	06/10/1999	240	240	1999	10	6	1999	279	4	1995	30.0000	low
M	07/10/1999	195	193	1999	10	7	1999	280	2	1997	24.8096	low
M	09/10/1999	235	225	1999	10	9	1999	282	2	1997	27.9453	low
F	10/10/1999	155	155	1999	10	10	1999	283	6	1993	27.5000	low
F	10/10/1999	165	165	1999	10	10	1999	283	3	1996	24.5000	low
M	10/10/1999	170	170	1999	10	10	1999	283	1	1998	21.0319	high
F	12/10/1999	175	172	1999	10	12	1999	285	4	1995	21.2000	low
F	13/10/1999	180	181	1999	10	13	1999	286	12	1987	28.1000	low
M	13/10/1999	160	160	1999	10	13	1999	286	5	1994	33.0230	low
M	13/10/1999	245	245	1999	10	13	1999	286	5	1994	29.5000	low
M	16/10/1999	235	235	1999	10	16	1999	289	8	1991	34.8708	low
F	16/10/1999	205	205	1999	10	16	1999	289	5	1994	23.0000	low
M	16/10/1999	210	210	1999	10	16	1999	289	4	1995	25.6394	low
F	16/10/1999	190	190	1999	10	16	1999	289	3	1996	20.0000	low
M	16/10/1999	180	175	1999	10	16	1999	289	2	1997	22.3085	low
M	17/10/1999	202	204	1999	10	17	1999	290	4	1995	32.0993	low
M	17/10/1999	145	147	1999	10	17	1999	290	2	1997	20.0917	low
M	18/10/1999	185	187	1999	10	18	1999	291	10	1989	26.5000	low
F	20/10/1999	150	150	1999	10	20	1999	293	11	1988	16.3396	high
F	20/10/1999	148	155	1999	10	20	1999	293	9	1990	23.6000	low
F	21/10/1999	200	195	1999	10	21	1999	294	13	1986	21.9000	low
M	21/10/1999	190	200	1999	10	21	1999	294	4	1995	28.4067	low
F	21/10/1999	170	162	1999	10	21	1999	294	3	1996	23.7000	low
M	23/10/1999	220	210	1999	10	23	1999	296	6	1993	32.0000	low
M	23/10/1999	60	65	1999	10	23	1999	296	1	1998	15.5125	high
M	24/10/1999	200	200	1999	10	24	1999	297	5	1994	27.0228	low
F	24/10/1999	175	180	1999	10	24	1999	297	5	1994	25.6394	low
M	24/10/1999	198	192	1999	10	24	1999	297	3	1996	30.2526	low
F	24/10/1999	140	145	1999	10	24	1999	297	1	1998	22.0000	high
M	24/10/1999	150	150	1999	10	24	1999	297	1	1998	21.9529	high
M	27/10/1999	200	205	1999	10	27	1999	300	7	1992	31.1759	low
F	27/10/1999	175	175	1999	10	27	1999	300	3	1996	22.0000	low
F	27/10/1999	116	117	1999	10	27	1999	300	1	1998	13.0000	high
M	27/10/1999	120	125	1999	10	27	1999	300	1	1998	17.4430	high
F	30/10/1999	200	200	1999	10	30	1999	303	7	1992	25.6394	low
M	30/10/1999	150	150	1999	10	30	1999	303	2	1997	20.5716	low
M	31/10/1999	165	165	1999	10	31	1999	304	5	1994	31.1759	low
M	31/10/1999	180	180	1999	10	31	1999	304	4	1995	29.0000	low
M	01/11/1999	176	174	1999	11	1	1999	305	5	1994	23.4193	low
F	01/11/1999	114	112	1999	11	1	1999	305	1	1998	15.5125	high
M	10/11/1999	180	178	1999	11	10	1999	314	5	1994	26.0000	low
M	11/11/1999	170	170	1999	11	11	1999	315	8	1991	29.0000	low
M	11/11/1999	240	230	1999	11	11	1999	315	5	1994	19.0000	low
M	11/11/1999	180	180	1999	11	11	1999	315	5	1994	32.6000	low
M	17/11/1999	217	218	1999	11	17	1999	321	4	1995	19.8000	low
F	05/12/1999	142	140	1999	12	5	1999	339	4	1995	19.1909	low
F	08/12/1999	163	164	1999	12	8	1999	342	1	1998	16.6000	high
F	09/12/1999	175	170	1999	12	9	1999	343	11	1988	27.0000	high
F	09/12/1999	152	154	1999	12	9	1999	343	11	1988	22.1000	high
M	12/12/1999	140	145	1999	12	12	1999	346	1	1998	16.4316	high
F	12/12/1999	30	30	1999	12	12	1999	346	0	1999	11.8402	high
M	13/12/1999	210	211	1999	12	13	1999	347	14	1985	18.7768	low
M	16/12/1999	220	220	1999	12	16	1999	350	3	1996	19.5000	low
M	18/12/1999	207	218	1999	12	18	1999	352	6	1993	28.9000	low
M	18/12/1999	180	178	1999	12	18	1999	352	3	1996	25.0000	low
M	18/12/1999	200	195	1999	12	18	1999	352	3	1996	20.0000	low
M	18/12/1999	140	140	1999	12	18	1999	352	1	1998	13.6755	high
F	19/12/1999	183	183	1999	12	19	1999	353	4	1995	23.0000	low
M	22/12/1999	260	260	1999	12	22	1999	356	5	1994	21.9529	low
M	22/12/1999	220	220	1999	12	22	1999	356	4	1995	23.7957	low
M	22/12/1999	150	148	1999	12	22	1999	356	1	1998	18.0000	high
F	26/12/1999	165	165	1999	12	26	1999	360	4	1995	20.1113	low
F	02/01/2000	212	212	1999	1	2	2000	367	6	1993	23.7957	low
F	02/01/2000	230	230	1999	1	2	2000	367	5	1994	25.6394	low
F	02/01/2000	170	172	1999	1	2	2000	367	1	1998	21.0319	high
F	04/01/2000	170	170	1999	1	4	2000	369	4	1995	24.7174	low
M	07/01/2000	182	185	1999	1	7	2000	372	2	1997	18.2708	low
F	07/01/2000	131	132	1999	1	7	2000	372	1	1998	12.8000	high
F	08/01/2000	165	169	1999	1	8	2000	373	12	1987	20.2000	low
M	08/01/2000	175	172	1999	1	8	2000	373	8	1991	25.0000	low
F	08/01/2000	75	75	1999	1	8	2000	373	1	1998	17.0000	high
F	08/01/2000	150	155	1999	1	8	2000	373	1	1998	18.2708	high
F	15/01/2000	140	135	1999	1	15	2000	380	3	1996	22.0000	low
M	18/01/2000	229	214	1999	1	18	2000	383	10	1989	22.9000	low
M	03/02/2000	225	228	1999	2	3	2000	399	4	1995	23.0000	low
F	08/02/2000	180	180	1999	2	8	2000	404	10	1989	19.4669	low
M	10/02/2000	172	162	1999	2	10	2000	406	10	1989	21.1000	low
F	10/02/2000	231	229	1999	2	10	2000	406	6	1993	21.7000	low
M	17/02/2000	204	206	1999	2	17	2000	413	2	1997	18.6000	low
F	05/09/2000	183	181	2000	9	5	2000	248	5	1995	19.3749	low
F	07/09/2000	202	203	2000	9	7	2000	250	7	1993	21.9000	low
F	10/09/2000	150	150	2000	9	10	2000	253	7	1993	20.1113	low
M	10/09/2000	215	215	2000	9	10	2000	253	4	1996	29.8834	low
M	10/09/2000	208	208	2000	9	10	2000	253	3	1997	26.5616	low
M	10/09/2000	120	120	2000	9	10	2000	253	1	1999	15.8341	high
M	10/09/2000	140	130	2000	9	10	2000	253	1	1999	16.0000	high
F	11/09/2000	210	207	2000	9	11	2000	254	7	1993	24.3487	low
M	12/09/2000	188	186	2000	9	12	2000	255	5	1995	31.1759	low
F	12/09/2000	192	195	2000	9	12	2000	255	5	1995	25.2706	low
M	12/09/2000	246	242	2000	9	12	2000	255	4	1996	25.6394	low
M	12/09/2000	170	170	2000	9	12	2000	255	3	1997	25.2000	low
M	12/09/2000	160	160	2000	9	12	2000	255	2	1998	22.2000	high
M	13/09/2000	208	203	2000	9	13	2000	256	3	1997	24.0722	low
F	14/09/2000	190	190	2000	9	14	2000	257	4	1996	14.5938	low
M	16/09/2000	250	245	2000	9	16	2000	259	9	1991	29.1000	low
M	17/09/2000	214	214	2000	9	17	2000	260	6	1994	23.9800	low
M	17/09/2000	200	200	2000	9	17	2000	260	6	1994	21.2000	low
M	17/09/2000	175	175	2000	9	17	2000	260	6	1994	25.8000	low
M	17/09/2000	190	190	2000	9	17	2000	260	5	1995	27.1150	low
F	17/09/2000	110	112	2000	9	17	2000	260	1	1999	16.8912	high
F	19/09/2000	166	166	2000	9	19	2000	262	4	1996	18.7308	low
M	19/09/2000	206	206	2000	9	19	2000	262	3	1997	22.3214	low
F	19/09/2000	133	133	2000	9	19	2000	262	1	1999	17.7500	high
M	21/09/2000	210	200	2000	9	21	2000	264	5	1995	31.2000	low
F	22/09/2000	180	180	2000	9	22	2000	265	3	1997	27.2995	low
M	24/09/2000	212	212	2000	9	24	2000	267	3	1997	24.0722	low
F	24/09/2000	136	136	2000	9	24	2000	267	1	1999	17.2000	high
M	24/09/2000	120	121	2000	9	24	2000	267	1	1999	22.0450	high
F	26/09/2000	120	120	2000	9	26	2000	269	1	1999	17.3510	high
M	26/09/2000	130	132	2000	9	26	2000	269	1	1999	18.2708	high
M	28/09/2000	173	174	2000	9	28	2000	271	9	1991	28.4067	low
F	29/09/2000	200	199	2000	9	29	2000	272	9	1991	26.8000	low
F	30/09/2000	145	145	2000	9	30	2000	273	1	1999	19.1909	high
M	01/10/2000	205	215	2000	10	1	2000	274	5	1995	30.2526	low
F	01/10/2000	105	104	2000	10	1	2000	274	1	1999	15.6963	high
M	05/10/2000	225	220	2000	10	5	2000	278	3	1997	27.0000	low
M	06/10/2000	185	187	2000	10	6	2000	279	3	1997	25.0000	low
M	07/10/2000	180	180	2000	10	7	2000	280	5	1995	35.0000	low
M	08/10/2000	195	195	2000	10	8	2000	281	7	1993	35.0000	low
F	08/10/2000	206	206	2000	10	8	2000	281	4	1996	19.1909	low
F	08/10/2000	180	183	2000	10	8	2000	281	4	1996	14.3614	low
M	08/10/2000	156	157	2000	10	8	2000	281	3	1997	28.4067	low
M	08/10/2000	204	204	2000	10	8	2000	281	1	1999	21.4003	high
M	11/10/2000	132	135	2000	10	11	2000	284	2	1998	19.1909	high
M	12/10/2000	192	190	2000	10	12	2000	285	2	1998	29.4000	high
M	15/10/2000	185	180	2000	10	15	2000	288	3	1997	28.7758	low
M	16/10/2000	90	90	2000	10	16	2000	289	1	1999	17.3510	high
F	17/10/2000	177	176	2000	10	17	2000	290	7	1993	23.0584	low
M	18/10/2000	145	144	2000	10	18	2000	291	6	1994	31.0000	low
M	19/10/2000	216	217	2000	10	19	2000	292	5	1995	28.5000	low
M	19/10/2000	228	225	2000	10	19	2000	292	4	1996	30.1000	low
F	19/10/2000	173	170	2000	10	19	2000	292	3	1997	19.8000	low
M	19/10/2000	212	225	2000	10	19	2000	292	3	1997	27.8000	low
M	21/10/2000	200	200	2000	10	21	2000	294	5	1995	29.7911	low
M	21/10/2000	175	180	2000	10	21	2000	294	3	1997	23.8000	low
M	21/10/2000	214	212	2000	10	21	2000	294	2	1998	25.6394	high
M	22/10/2000	218	218	2000	10	22	2000	295	5	1995	25.2000	low
F	22/10/2000	180	180	2000	10	22	2000	295	5	1995	23.6000	low
M	22/10/2000	240	240	2000	10	22	2000	295	4	1996	30.6219	low
F	22/10/2000	155	160	2000	10	22	2000	295	2	1998	21.0000	high
M	22/10/2000	180	180	2000	10	22	2000	295	1	1999	20.1113	high
M	28/10/2000	180	180	2000	10	28	2000	301	2	1998	23.3349	high
M	28/10/2000	145	150	2000	10	28	2000	301	1	1999	17.8108	high
M	29/10/2000	210	210	2000	10	29	2000	302	6	1994	32.8382	low
M	29/10/2000	160	165	2000	10	29	2000	302	5	1995	26.0000	low
F	29/10/2000	140	136	2000	10	29	2000	302	4	1996	20.5000	low
M	29/10/2000	170	177	2000	10	29	2000	302	3	1997	27.4840	low
M	31/10/2000	205	200	2000	10	31	2000	304	2	1998	24.0000	high
M	02/11/2000	227	223	2000	11	2	2000	306	8	1992	36.4000	low
M	04/11/2000	193	192	2000	11	4	2000	308	4	1996	34.4000	low
F	04/11/2000	118	115	2000	11	4	2000	308	1	1999	18.2708	high
F	04/11/2000	140	139	2000	11	4	2000	308	1	1999	21.0319	high
M	05/11/2000	160	160	2000	11	5	2000	309	4	1996	24.8096	low
M	05/11/2000	185	190	2000	11	5	2000	309	3	1997	16.8894	low
M	05/11/2000	205	205	2000	11	5	2000	309	1	1999	18.7308	high
M	05/11/2000	60	60	2000	11	5	2000	309	0	2000	11.0000	high
F	06/11/2000	159	157	2000	11	6	2000	310	1	1999	13.4848	high
F	07/11/2000	155	158	2000	11	7	2000	311	5	1995	23.5000	low
F	08/11/2000	164	164	2000	11	8	2000	312	7	1993	22.9663	low
M	11/11/2000	165	130	2000	11	11	2000	315	10	1990	30.0000	low
F	11/11/2000	180	180	2000	11	11	2000	315	8	1992	24.2000	low
F	11/11/2000	142	140	2000	11	11	2000	315	1	1999	17.7500	high
M	12/11/2000	200	180	2000	11	12	2000	316	5	1995	25.6394	low
F	12/11/2000	90	92	2000	11	12	2000	316	1	1999	19.4000	high
M	07/12/2000	210	210	2000	12	7	2000	341	3	1997	17.3510	low
F	07/12/2000	133	132	2000	12	7	2000	341	3	1997	23.0000	low
M	09/12/2000	208	209	2000	12	9	2000	343	2	1998	21.9529	high
M	12/12/2000	201	200	2000	12	12	2000	346	9	1991	27.8000	low
F	12/12/2000	143	143	2000	12	12	2000	346	1	1999	17.8000	high
F	14/12/2000	200	210	2000	12	14	2000	348	2	1998	21.9529	high
F	14/12/2000	165	165	2000	12	14	2000	348	1	1999	21.0319	high
M	16/12/2000	22	21	2000	12	16	2000	350	0	2000	10.0000	high
M	17/12/2000	270	270	2000	12	17	2000	351	3	1997	24.7174	low
F	17/12/2000	140	140	2000	12	17	2000	351	1	1999	20.1113	high
M	19/12/2000	210	215	2000	12	19	2000	353	2	1998	23.4270	high
F	21/12/2000	110	115	2000	12	21	2000	355	1	1999	18.7308	high
F	21/12/2000	150	150	2000	12	21	2000	355	1	1999	21.0319	high
F	21/12/2000	105	105	2000	12	21	2000	355	1	1999	16.0000	high
M	23/12/2000	182	183	2000	12	23	2000	357	7	1993	26.6000	low
F	23/12/2000	175	175	2000	12	23	2000	357	3	1997	26.5000	low
M	23/12/2000	225	220	2000	12	23	2000	357	2	1998	23.3349	high
M	23/12/2000	120	120	2000	12	23	2000	357	1	1999	15.8801	high
F	23/12/2000	115	110	2000	12	23	2000	357	1	1999	16.8912	high
M	24/12/2000	240	240	2000	12	24	2000	358	6	1994	27.4840	low
F	24/12/2000	170	170	2000	12	24	2000	358	5	1995	20.6000	low
M	26/12/2000	25	25	2000	12	26	2000	360	0	2000	11.3000	high
F	30/12/2000	195	195	2000	12	30	2000	364	6	1994	29.2000	low
M	30/12/2000	200	200	2000	12	30	2000	364	4	1996	21.0000	low
M	30/12/2000	190	192	2000	12	30	2000	364	4	1996	20.6000	low
F	30/12/2000	120	120	2000	12	30	2000	364	1	1999	12.7576	high
F	30/12/2000	115	115	2000	12	30	2000	364	1	1999	17.8108	high
F	02/01/2001	200	210	2000	1	2	2001	367	8	1992	22.0000	low
M	02/01/2001	160	161	2000	1	2	2001	367	1	1999	19.5000	high
F	08/01/2001	200	205	2000	1	8	2001	373	7	1993	23.7957	low
M	09/01/2001	245	245	2000	1	9	2001	374	4	1996	20.1113	low
F	13/01/2001	160	160	2000	1	13	2001	378	6	1994	22.8742	low
M	14/01/2001	205	210	2000	1	14	2001	379	3	1997	23.0000	low
M	16/01/2001	198	190	2000	1	16	2001	381	2	1998	18.2708	high
M	06/09/2001	180	180	2001	9	6	2001	249	7	1994	30.7142	low
M	06/09/2001	185	188	2001	9	6	2001	249	3	1998	25.1784	high
M	06/09/2001	208	210	2001	9	6	2001	249	2	1999	21.6000	high
M	06/09/2001	203	203	2001	9	6	2001	249	2	1999	22.0000	high
F	07/09/2001	182	179	2001	9	7	2001	250	11	1990	23.7957	low
F	07/09/2001	187	188	2001	9	7	2001	250	8	1993	20.7000	low
F	07/09/2001	142	142	2001	9	7	2001	250	5	1996	22.2293	low
M	07/09/2001	218	220	2001	9	7	2001	250	3	1998	22.5000	high
M	09/09/2001	195	195	2001	9	9	2001	252	4	1997	33.1000	low
M	09/09/2001	220	220	2001	9	9	2001	252	3	1998	20.0000	high
M	09/09/2001	210	210	2001	9	9	2001	252	3	1998	22.8742	high
M	11/09/2001	205	205	2001	9	11	2001	254	7	1994	29.4219	low
F	11/09/2001	171	175	2001	9	11	2001	254	7	1994	24.7174	low
M	11/09/2001	212	205	2001	9	11	2001	254	4	1997	27.4840	low
M	11/09/2001	165	165	2001	9	11	2001	254	1	2000	32.4688	high
F	11/09/2001	132	132	2001	9	11	2001	254	1	2000	17.0000	high
F	13/09/2001	198	195	2001	9	13	2001	256	6	1995	24.3487	low
F	13/09/2001	180	180	2001	9	13	2001	256	3	1998	21.7687	high
M	15/09/2001	208	211	2001	9	15	2001	258	5	1996	24.1643	low
M	15/09/2001	200	205	2001	9	15	2001	258	2	1999	22.0000	high
M	16/09/2001	210	210	2001	9	16	2001	259	4	1997	29.0000	low
M	18/09/2001	230	230	2001	9	18	2001	261	5	1996	30.2526	low
M	18/09/2001	160	160	2001	9	18	2001	261	1	2000	21.0319	high
M	19/09/2001	228	230	2001	9	19	2001	262	7	1994	32.4688	low
M	20/09/2001	202	205	2001	9	20	2001	263	6	1995	21.8608	low
M	20/09/2001	202	205	2001	9	20	2001	263	6	1995	21.8608	low
F	20/09/2001	170	169	2001	9	20	2001	263	6	1995	19.2000	low
M	20/09/2001	190	200	2001	9	20	2001	263	4	1997	28.8681	low
F	21/09/2001	154	153	2001	9	21	2001	264	12	1989	22.5056	low
F	21/09/2001	184	162	2001	9	21	2001	264	11	1990	19.4669	low
F	21/09/2001	180	176	2001	9	21	2001	264	9	1992	24.7174	low
M	21/09/2001	208	210	2001	9	21	2001	264	2	1999	22.6000	high
F	25/09/2001	184	183	2001	9	25	2001	268	12	1989	26.1927	low
F	25/09/2001	185	196	2001	9	25	2001	268	4	1997	21.7687	low
M	25/09/2001	215	215	2001	9	25	2001	268	3	1998	24.5000	high
F	25/09/2001	160	165	2001	9	25	2001	268	3	1998	17.9948	high
F	27/09/2001	180	180	2001	9	27	2001	270	7	1994	23.3349	low
F	27/09/2001	186	187	2001	9	27	2001	270	7	1994	26.5000	low
M	27/09/2001	157	155	2001	9	27	2001	270	4	1997	28.2000	low
M	27/09/2001	205	205	2001	9	27	2001	270	3	1998	31.9791	high
M	27/09/2001	210	215	2001	9	27	2001	270	2	1999	29.0000	high
M	27/09/2001	210	215	2001	9	27	2001	270	2	1999	29.0000	high
M	29/09/2001	214	219	2001	9	29	2001	272	2	1999	23.9800	high
M	30/09/2001	200	190	2001	9	30	2001	273	2	1999	23.7957	high
M	03/10/2001	160	160	2000	10	3	2001	276	3	1997	26.1000	low
F	04/10/2001	152	150	2001	10	4	2001	277	11	1990	19.6510	low
F	04/10/2001	157	154	2001	10	4	2001	277	7	1994	18.5000	low
M	05/10/2001	203	205	2001	10	5	2001	278	4	1997	26.8383	low
M	05/10/2001	221	225	2001	10	5	2001	278	4	1997	27.5000	low
M	05/10/2001	215	217	2001	10	5	2001	278	4	1997	37.0000	low
M	06/10/2001	180	185	2001	10	6	2001	279	8	1993	32.0993	low
M	06/10/2001	175	180	2001	10	6	2001	279	7	1994	32.0993	low
M	06/10/2001	200	202	2001	10	6	2001	279	5	1996	31.0000	low
F	06/10/2001	120	120	2001	10	6	2001	279	1	2000	15.8000	high
M	07/10/2001	151	145	2001	10	7	2001	280	1	2000	16.6154	high
F	09/10/2001	162	160	2001	10	9	2001	282	9	1992	24.9018	low
F	09/10/2001	178	180	2001	10	9	2001	282	4	1997	23.0584	low
F	13/10/2001	200	200	2001	10	13	2001	286	8	1993	23.5000	low
M	13/10/2001	150	155	2001	10	13	2001	286	1	2000	16.6154	high
F	14/10/2001	210	210	2001	10	14	2001	287	7	1994	23.7957	low
M	14/10/2001	210	210	2001	10	14	2001	287	6	1995	29.0000	low
M	16/10/2001	150	150	2001	10	16	2001	289	1	2000	16.4000	high
M	16/10/2001	155	160	2001	10	16	2001	289	1	2000	18.0000	high
F	16/10/2001	145	150	2001	10	16	2001	289	1	2000	17.3510	high
F	18/10/2001	163	163	2001	10	18	2001	291	9	1992	23.5192	low
F	18/10/2001	177	176	2001	10	18	2001	291	3	1998	18.8228	high
F	19/10/2001	164	163	2001	10	19	2001	292	8	1993	22.3214	low
F	19/10/2001	163	164	2001	10	19	2001	292	7	1994	23.5192	low
F	19/10/2001	182	183	2001	10	19	2001	292	5	1996	22.8742	low
F	19/10/2001	173	172	2001	10	19	2001	292	2	1999	20.1000	high
F	20/10/2001	165	165	2001	10	20	2001	293	11	1990	18.0000	low
M	20/10/2001	212	211	2001	10	20	2001	293	4	1997	28.6000	low
F	20/10/2001	163	162	2001	10	20	2001	293	3	1998	20.6000	high
M	20/10/2001	206	211	2001	10	20	2001	293	3	1998	28.4067	high
F	20/10/2001	95	96	2001	10	20	2001	293	1	2000	14.3000	high
M	21/10/2001	135	135	2001	10	21	2001	294	1	2000	16.4316	high
M	23/10/2001	126	135	2001	10	23	2001	296	4	1997	27.8000	low
F	25/10/2001	180	175	2001	10	25	2001	298	8	1993	27.4840	low
F	25/10/2001	120	125	2001	10	25	2001	298	1	2000	17.8108	high
F	26/10/2001	165	160	2001	10	26	2001	299	6	1995	23.5000	low
M	26/10/2001	200	195	2001	10	26	2001	299	2	1999	28.0000	high
M	27/10/2001	197	200	2001	10	27	2001	300	7	1994	28.0000	low
M	27/10/2001	162	165	2001	10	27	2001	300	1	2000	14.2264	high
M	28/10/2001	200	200	2001	10	28	2001	301	7	1994	24.0000	low
F	28/10/2001	205	205	2001	10	28	2001	301	5	1996	27.0000	low
M	01/11/2001	210	210	2001	11	1	2001	305	5	1996	32.0993	low
F	02/11/2001	170	165	2001	11	2	2001	306	7	1994	23.7957	low
F	02/11/2001	145	140	2001	11	2	2001	306	1	2000	19.1909	high
M	03/11/2001	205	204	2001	11	3	2001	307	7	1994	30.9912	low
F	04/11/2001	220	220	2001	11	4	2001	308	7	1994	25.6394	low
F	04/11/2001	140	138	2001	11	4	2001	308	1	2000	17.0000	high
M	04/11/2001	130	130	2001	11	4	2001	308	1	2000	17.5349	high
M	04/11/2001	145	145	2001	11	4	2001	308	1	2000	16.9832	high
F	08/11/2001	181	184	2001	11	8	2001	312	10	1991	24.7174	low
F	08/11/2001	181	181	2001	11	8	2001	312	6	1995	21.5000	low
F	08/11/2001	184	170	2001	11	8	2001	312	6	1995	21.0000	low
F	09/11/2001	185	172	2001	11	9	2001	313	12	1989	19.2829	low
F	09/11/2001	187	186	2001	11	9	2001	313	5	1996	21.9000	low
F	10/11/2001	197	200	2001	11	10	2001	314	8	1993	18.2708	low
F	10/11/2001	210	210	2001	11	10	2001	314	7	1994	22.0000	low
M	10/11/2001	185	190	2001	11	10	2001	314	5	1996	26.0000	low
M	10/11/2001	192	190	2001	11	10	2001	314	4	1997	23.0000	low
M	11/11/2001	170	170	2001	11	11	2001	315	6	1995	27.0228	low
M	11/11/2001	160	160	2001	11	11	2001	315	1	2000	18.2708	high
F	26/11/2001	170	165	2001	11	26	2001	330	10	1991	16.8527	low
F	05/12/2001	150	150	2001	12	5	2001	339	1	2000	18.0868	high
F	09/12/2001	125	130	2001	12	9	2001	343	5	1996	21.5000	low
M	09/12/2001	190	195	2001	12	9	2001	343	5	1996	22.8742	low
M	09/12/2001	180	180	2001	12	9	2001	343	4	1997	25.1784	low
M	09/12/2001	213	215	2001	12	9	2001	343	4	1997	22.6899	low
F	13/12/2001	171	173	2001	12	13	2001	347	8	1993	21.3082	low
F	16/12/2001	220	221	2001	12	16	2001	350	10	1991	23.4000	low
M	16/12/2001	175	175	2001	12	16	2001	350	1	2000	18.5000	high
F	20/12/2001	219	220	2001	12	20	2001	354	9	1992	21.7687	low
F	22/12/2001	130	119	2001	12	22	2001	356	1	2000	23.9800	high
M	23/12/2001	143	143	2001	12	23	2001	357	1	2000	17.5349	high
M	29/12/2001	194	195	2001	12	29	2001	363	2	1999	22.0000	high
M	30/12/2001	244	246	2001	12	30	2001	364	12	1989	28.6210	low
F	30/12/2001	197	209	2001	12	30	2001	364	9	1992	26.8000	low
M	30/12/2001	180	180	2001	12	30	2001	364	3	1998	18.2000	high
M	30/12/2001	190	195	2001	12	30	2001	364	2	1999	19.5016	high
F	01/01/2002	150	150	2001	1	1	2002	366	1	2000	17.1671	high
F	05/01/2002	175	170	2001	1	5	2002	370	5	1996	24.0000	low
F	05/01/2002	120	115	2001	1	5	2002	370	1	2000	16.8912	high
M	06/01/2002	190	190	2001	1	6	2002	371	6	1995	29.5142	low
M	08/01/2002	155	155	2001	1	8	2002	373	1	2000	16.4316	high
M	10/01/2002	208	199	2001	1	10	2002	375	9	1992	28.1000	low
F	12/01/2002	155	155	2001	1	12	2002	377	5	1996	21.1000	low
F	12/01/2002	165	160	2001	1	12	2002	377	5	1996	21.4924	low
M	13/01/2002	125	130	2001	1	13	2002	378	5	1996	21.0000	low
F	31/01/2002	150	150	2001	1	31	2002	396	9	1992	22.0000	low
M	31/01/2002	213	221	2001	1	31	2002	396	6	1995	25.3000	low
F	01/02/2002	172	179	2001	2	1	2002	397	6	1995	13.5000	low
M	12/02/2002	194	195	2001	2	12	2002	408	13	1988	19.7228	high
M	08/09/2002	225	223	2002	9	8	2002	251	12	1990	26.5616	low
M	08/09/2002	190	190	2002	9	8	2002	251	6	1996	24.0000	low
M	08/09/2002	165	170	2002	9	8	2002	251	5	1997	26.0000	low
F	08/09/2002	125	130	2002	9	8	2002	251	3	1999	27.5000	high
M	08/09/2002	130	130	2002	9	8	2002	251	1	2001	14.5020	high
M	10/09/2002	198	197	2002	9	10	2002	253	7	1995	32.4688	low
F	10/09/2002	170	170	2002	9	10	2002	253	7	1995	19.3749	low
M	10/09/2002	136	136	2002	9	10	2002	253	6	1996	30.0000	low
M	10/09/2002	160	160	2002	9	10	2002	253	1	2001	17.5000	high
M	12/09/2002	212	214	2002	9	12	2002	255	6	1996	24.0000	low
F	14/09/2002	148	149	2002	9	14	2002	257	7	1995	26.0000	low
F	14/09/2002	160	165	2002	9	14	2002	257	6	1996	21.9529	low
M	15/09/2002	195	190	2002	9	15	2002	258	6	1996	32.5000	low
M	15/09/2002	180	190	2002	9	15	2002	258	4	1998	28.0000	high
F	17/09/2002	210	200	2002	9	17	2002	260	5	1997	22.0000	low
F	17/09/2002	140	142	2002	9	17	2002	260	4	1998	21.9529	high
M	17/09/2002	220	220	2002	9	17	2002	260	3	1999	23.0000	high
M	21/09/2002	165	162	2002	9	21	2002	264	1	2001	16.4316	high
M	21/09/2002	162	162	2002	9	21	2002	264	1	2001	18.7308	high
M	22/09/2002	192	192	2002	9	22	2002	265	2	2000	26.0000	high
M	26/09/2002	160	170	2002	9	26	2002	269	3	1999	19.3542	high
F	26/09/2002	155	160	2002	9	26	2002	269	2	2000	19.9272	high
M	28/09/2002	210	210	2002	9	28	2002	271	5	1997	32.2000	low
M	28/09/2002	217	211	2002	9	28	2002	271	5	1997	32.0000	low
F	28/09/2002	110	110	2002	9	28	2002	271	1	2001	18.4548	high
M	29/09/2002	140	150	2002	9	29	2002	272	6	1996	36.0000	low
F	01/10/2002	200	200	2002	10	1	2002	274	7	1995	20.0000	low
M	03/10/2002	210	210	2002	10	3	2002	276	9	1993	31.7299	low
F	05/10/2002	160	165	2002	10	5	2002	278	11	1991	27.0000	low
F	05/10/2002	168	165	2002	10	5	2002	278	7	1995	23.5000	low
M	05/10/2002	132	132	2002	10	5	2002	278	6	1996	32.0000	low
M	05/10/2002	135	140	2002	10	5	2002	278	2	2000	21.2000	high
F	07/10/2002	161	165	2002	10	7	2002	280	5	1997	22.2000	low
F	10/10/2002	178	176	2002	10	10	2002	283	10	1992	23.1000	low
F	15/10/2002	140	145	2002	10	15	2002	288	7	1995	25.1000	low
M	20/10/2002	150	152	2002	10	20	2002	293	8	1994	26.5616	low
M	20/10/2002	180	180	2002	10	20	2002	293	4	1998	32.0000	high
F	20/10/2002	130	140	2002	10	20	2002	293	3	1999	28.0000	high
M	22/10/2002	208	206	2002	10	22	2002	295	2	2000	23.0000	high
F	24/10/2002	160	160	2002	10	24	2002	297	4	1998	25.0000	high
M	24/10/2002	155	160	2002	10	24	2002	297	1	2001	23.0000	high
M	26/10/2002	127	126	2002	10	26	2002	299	2	2000	24.0000	high
F	27/10/2002	210	210	2002	10	27	2002	300	7	1995	28.0000	low
M	27/10/2002	130	130	2002	10	27	2002	300	1	2001	17.2590	high
M	31/10/2002	180	180	2002	10	31	2002	304	1	2001	15.6000	high
F	01/11/2002	215	210	2002	11	1	2002	305	7	1995	27.0000	low
F	01/11/2002	190	200	2002	11	1	2002	305	4	1998	20.0000	high
M	01/11/2002	155	125	2002	11	1	2002	305	1	2001	14.0000	high
M	02/11/2002	190	193	2002	11	2	2002	306	2	2000	22.3085	high
M	02/11/2002	160	160	2002	11	2	2002	306	1	2001	19.1909	high
F	05/11/2002	174	174	2002	11	5	2002	309	4	1998	24.0000	high
M	09/11/2002	220	220	2002	11	9	2002	313	7	1995	28.8000	low
M	09/11/2002	220	220	2002	11	9	2002	313	4	1998	30.6219	high
F	09/11/2002	140	135	2002	11	9	2002	313	1	2001	19.6510	high
M	10/11/2002	175	175	2002	11	10	2002	314	6	1996	22.3085	low
M	10/11/2002	240	240	2002	11	10	2002	314	5	1997	30.0000	low
F	11/11/2002	204	208	2002	11	11	2002	315	12	1990	22.0000	low
M	11/11/2002	224	224	2002	11	11	2002	315	4	1998	16.7793	high
F	11/11/2002	110	115	2002	11	11	2002	315	2	2000	20.0000	high
M	05/12/2002	145	150	2002	12	5	2002	339	1	2001	18.0000	high
F	08/12/2002	168	140	2002	12	8	2002	342	12	1990	22.8742	low
M	08/12/2002	110	115	2002	12	8	2002	342	1	2001	21.0319	high
M	10/12/2002	260	255	2002	12	10	2002	344	10	1992	35.7949	low
F	10/12/2002	165	153	2002	12	10	2002	344	7	1995	18.2000	low
F	10/12/2002	150	150	2002	12	10	2002	344	7	1995	27.8000	low
M	10/12/2002	205	205	2002	12	10	2002	344	6	1996	21.9529	low
F	10/12/2002	222	222	2002	12	10	2002	344	5	1997	20.1113	low
M	12/12/2002	180	180	2002	12	12	2002	346	6	1996	21.5000	low
F	12/12/2002	170	175	2002	12	12	2002	346	4	1998	23.7957	high
F	12/12/2002	115	120	2002	12	12	2002	346	2	2000	23.0000	high
F	13/12/2002	200	200	2002	12	13	2002	347	4	1998	21.6000	high
M	15/12/2002	137	137	2002	12	15	2002	349	1	2001	19.1909	high
F	17/12/2002	115	115	2002	12	17	2002	351	2	2000	31.0000	high
M	19/12/2002	188	130	2002	12	19	2002	353	7	1995	22.0000	low
F	19/12/2002	120	120	2002	12	19	2002	353	6	1996	23.7898	low
M	19/12/2002	175	180	2002	12	19	2002	353	2	2000	21.8000	high
M	19/12/2002	225	230	2002	12	19	2002	353	2	2000	23.4270	high
M	19/12/2002	140	140	2002	12	19	2002	353	1	2001	18.0868	high
F	21/12/2002	150	145	2002	12	21	2002	355	5	1997	22.4135	low
M	21/12/2002	152	146	2002	12	21	2002	355	4	1998	19.0000	high
M	21/12/2002	190	190	2002	12	21	2002	355	4	1998	25.5000	high
F	22/12/2002	235	225	2002	12	22	2002	356	12	1990	19.6510	low
F	22/12/2002	205	205	2002	12	22	2002	356	7	1995	20.5716	low
M	22/12/2002	190	192	2002	12	22	2002	356	4	1998	21.6000	high
M	22/12/2002	115	120	2002	12	22	2002	356	3	1999	25.9000	high
F	22/12/2002	120	125	2002	12	22	2002	356	1	2001	15.0000	high
F	22/12/2002	100	105	2002	12	22	2002	356	1	2001	20.1000	high
M	24/12/2002	210	215	2002	12	24	2002	358	4	1998	16.6154	high
F	26/12/2002	190	180	2002	12	26	2002	360	4	1998	18.9857	high
M	28/12/2002	223	224	2002	12	28	2002	362	2	2000	21.9529	high
M	28/12/2002	223	224	2002	12	28	2002	362	2	2000	21.9529	high
F	29/12/2002	125	130	2002	12	29	2002	363	4	1998	20.1000	high
F	31/12/2002	210	205	2002	12	31	2002	365	10	1992	19.0000	low
M	31/12/2002	225	225	2002	12	31	2002	365	5	1997	23.0000	low
M	02/01/2003	235	240	2002	1	2	2003	367	3	1999	25.0000	high
F	02/01/2003	210	210	2002	1	2	2003	367	2	2000	18.2708	high
F	07/01/2003	176	176	2002	1	7	2003	372	14	1988	20.0000	high
F	07/01/2003	176	176	2002	1	7	2003	372	14	1988	20.0000	high
M	07/01/2003	135	135	2002	1	7	2003	372	1	2001	17.4430	high
F	11/01/2003	170	177	2002	1	11	2003	376	12	1990	24.5000	low
F	11/01/2003	170	177	2002	1	11	2003	376	12	1990	24.5000	low
F	11/01/2003	170	172	2002	1	11	2003	376	6	1996	21.9529	low
F	11/01/2003	145	150	2002	1	11	2003	376	4	1998	19.2829	high
F	11/01/2003	36	36	2002	1	11	2003	376	0	2002	12.5000	high
M	11/01/2003	70	70	2002	1	11	2003	376	0	2002	11.8402	high
F	12/01/2003	180	182	2002	1	12	2003	377	4	1998	21.4000	high
F	12/01/2003	120	115	2002	1	12	2003	377	1	2001	19.3749	high
F	18/02/2003	167	165	2002	2	18	2003	414	3	1999	16.0000	high
M	20/02/2003	217	220	2002	2	20	2003	416	6	1996	22.0000	low
M	25/02/2003	212	212	2002	2	25	2003	421	4	1998	19.0000	high
M	02/09/2003	218	215	2003	9	2	2003	245	6	1997	26.6000	low
M	02/09/2003	182	185	2003	9	2	2003	245	4	1999	27.9453	high
F	04/09/2003	160	163	2003	9	4	2003	247	6	1997	19.5000	low
F	04/09/2003	151	151	2003	9	4	2003	247	6	1997	18.7308	low
M	04/09/2003	203	207	2003	9	4	2003	247	6	1997	29.3000	low
M	04/09/2003	198	198	2003	9	4	2003	247	5	1998	26.8000	high
F	04/09/2003	179	178	2003	9	4	2003	247	3	2000	12.5000	high
M	14/09/2003	205	205	2003	9	14	2003	257	7	1996	36.0000	low
M	14/09/2003	170	172	2003	9	14	2003	257	7	1996	26.5616	low
F	14/09/2003	130	130	2003	9	14	2003	257	3	2000	23.0000	high
M	14/09/2003	190	200	2003	9	14	2003	257	2	2001	28.0000	high
M	14/09/2003	180	175	2003	9	14	2003	257	1	2002	20.2033	high
M	16/09/2003	206	204	2003	9	16	2003	259	5	1998	22.2000	high
F	18/09/2003	78	75	2003	9	18	2003	261	9	1994	25.7000	low
F	18/09/2003	210	210	2003	9	18	2003	261	7	1996	21.0000	low
M	18/09/2003	160	150	2003	9	18	2003	261	4	1999	29.3296	high
M	19/09/2003	200	196	2003	9	19	2003	262	4	1999	24.9940	high
M	19/09/2003	210	205	2003	9	19	2003	262	3	2000	24.0000	high
F	19/09/2003	65	68	2003	9	19	2003	262	1	2002	17.3000	high
M	20/09/2003	210	210	2003	9	20	2003	263	5	1998	26.7461	high
F	20/09/2003	210	210	2003	9	20	2003	263	4	1999	25.0000	high
M	20/09/2003	130	130	2003	9	20	2003	263	1	2002	17.0000	high
F	21/09/2003	175	180	2003	9	21	2003	264	2	2001	19.1000	high
M	21/09/2003	145	143	2003	9	21	2003	264	1	2002	17.2199	high
F	22/09/2003	166	167	2003	9	22	2003	265	12	1991	26.5616	low
F	22/09/2003	172	171	2003	9	22	2003	265	4	1999	21.0319	high
F	25/09/2003	187	192	2003	9	25	2003	268	8	1995	25.0000	low
F	25/09/2003	130	134	2003	9	25	2003	268	7	1996	21.9529	low
M	25/09/2003	220	219	2003	9	25	2003	268	3	2000	20.3874	high
M	27/09/2003	150	150	2003	9	27	2003	270	3	2000	19.0000	high
M	27/09/2003	213	215	2003	9	27	2003	270	3	2000	32.5611	high
M	27/09/2003	109	110	2003	9	27	2003	270	1	2002	19.1909	high
M	28/09/2003	200	200	2003	9	28	2003	271	4	1999	23.5000	high
M	28/09/2003	178	174	2003	9	28	2003	271	3	2000	21.9529	high
M	28/09/2003	107	107	2003	9	28	2003	271	1	2002	10.0070	high
F	30/09/2003	172	180	2003	9	30	2003	273	10	1993	23.0000	low
F	30/09/2003	145	147	2003	9	30	2003	273	7	1996	22.5056	low
M	30/09/2003	225	230	2003	9	30	2003	273	7	1996	28.5000	low
M	30/09/2003	208	210	2003	9	30	2003	273	4	1999	25.9000	high
M	02/10/2003	204	206	2003	10	2	2003	275	7	1996	28.0000	low
M	02/10/2003	234	234	2003	10	2	2003	275	6	1997	31.1759	low
F	02/10/2003	153	151	2003	10	2	2003	275	4	1999	20.6000	high
F	02/10/2003	171	171	2003	10	2	2003	275	3	2000	23.0000	high
M	02/10/2003	213	212	2003	10	2	2003	275	2	2001	24.7000	high
F	02/10/2003	205	195	2003	10	2	2003	275	2	2001	20.3874	high
F	04/10/2003	155	160	2003	10	4	2003	277	5	1998	20.1113	high
F	04/10/2003	147	146	2003	10	4	2003	277	4	1999	25.6394	high
F	06/10/2003	178	178	2003	10	6	2003	279	4	1999	19.0000	high
F	06/10/2003	130	120	2003	10	6	2003	279	1	2002	17.3510	high
M	08/10/2003	132	134	2003	10	8	2003	281	4	1999	27.4840	high
F	08/10/2003	150	150	2003	10	8	2003	281	1	2002	15.5125	high
F	09/10/2003	165	168	2003	10	9	2003	282	3	2000	22.8742	high
F	09/10/2003	190	195	2003	10	9	2003	282	2	2001	20.1113	high
M	10/10/2003	160	160	2003	10	10	2003	283	5	1998	23.7957	high
M	11/10/2003	209	200	2003	10	11	2003	284	3	2000	27.4000	high
M	11/10/2003	132	135	2003	10	11	2003	284	2	2001	21.0000	high
M	11/10/2003	160	160	2003	10	11	2003	284	1	2002	18.0000	high
F	15/10/2003	162	160	2003	10	15	2003	288	4	1999	25.1784	high
M	15/10/2003	185	185	2003	10	15	2003	288	3	2000	22.5000	high
F	15/10/2003	186	180	2003	10	15	2003	288	3	2000	23.3349	high
F	15/10/2003	170	166	2003	10	15	2003	288	3	2000	19.0000	high
M	16/10/2003	200	200	2003	10	16	2003	289	8	1995	27.6000	low
M	16/10/2003	220	220	2003	10	16	2003	289	3	2000	27.8762	high
M	16/10/2003	170	170	2003	10	16	2003	289	2	2001	18.0000	high
M	17/10/2003	165	160	2003	10	17	2003	290	2	2001	25.4550	high
M	18/10/2003	223	222	2003	10	18	2003	291	4	1999	33.2077	high
F	18/10/2003	130	132	2003	10	18	2003	291	2	2001	21.0319	high
M	19/10/2003	195	200	2003	10	19	2003	292	4	1999	29.0000	high
M	19/10/2003	110	110	2003	10	19	2003	292	3	2000	30.0000	high
M	22/10/2003	215	216	2003	10	22	2003	295	3	2000	28.0000	high
F	23/10/2003	168	163	2003	10	23	2003	296	11	1992	17.6000	low
M	23/10/2003	205	204	2003	10	23	2003	296	3	2000	28.1299	high
M	23/10/2003	210	211	2003	10	23	2003	296	2	2001	21.4924	high
F	24/10/2003	172	172	2003	10	24	2003	297	11	1992	24.4409	low
F	24/10/2003	166	165	2003	10	24	2003	297	7	1996	21.7000	low
M	25/10/2003	180	180	2003	10	25	2003	298	5	1998	26.0083	high
M	26/10/2003	230	230	2003	10	26	2003	299	4	1999	32.0000	high
M	30/10/2003	160	162	2003	10	30	2003	303	3	2000	30.4373	high
F	01/11/2003	160	160	2003	11	1	2003	305	8	1995	21.9529	low
M	01/11/2003	201	203	2003	11	1	2003	305	3	2000	28.0000	high
M	01/11/2003	215	215	2003	11	1	2003	305	2	2001	26.0000	high
M	01/11/2003	110	111	2003	11	1	2003	305	1	2002	20.1113	high
F	01/11/2003	109	108	2003	11	1	2003	305	1	2002	19.1909	high
M	01/11/2003	40	40	2003	11	1	2003	305	0	2003	13.5000	high
F	02/11/2003	150	155	2003	11	2	2003	306	5	1998	25.0000	high
F	02/11/2003	41	42	2003	11	2	2003	306	0	2003	10.9233	high
F	04/11/2003	232	235	2003	11	4	2003	308	14	1989	28.2000	low
M	06/11/2003	210	202	2003	11	6	2003	310	5	1998	23.0000	high
F	06/11/2003	120	118	2003	11	6	2003	310	4	1999	16.2477	high
F	07/11/2003	180	180	2003	11	7	2003	311	5	1998	21.0000	high
F	09/11/2003	185	185	2003	11	9	2003	313	5	1998	21.8000	high
F	11/11/2003	187	180	2003	11	11	2003	315	12	1991	22.0000	low
M	11/11/2003	175	170	2003	11	11	2003	315	7	1996	27.4840	low
F	11/11/2003	210	210	2003	11	11	2003	315	6	1997	24.5000	low
F	11/11/2003	198	198	2003	11	11	2003	315	6	1997	16.6000	low
M	11/11/2003	186	185	2003	11	11	2003	315	4	1999	24.0000	high
M	11/11/2003	155	155	2003	11	11	2003	315	1	2002	17.8108	high
F	07/12/2003	235	240	2003	12	7	2003	341	11	1992	22.0000	low
M	07/12/2003	223	220	2003	12	7	2003	341	7	1996	23.0000	low
F	07/12/2003	195	195	2003	12	7	2003	341	7	1996	25.0000	low
F	07/12/2003	180	180	2003	12	7	2003	341	6	1997	21.2161	low
M	07/12/2003	190	190	2003	12	7	2003	341	5	1998	25.0000	high
F	07/12/2003	85	85	2003	12	7	2003	341	1	2002	16.2477	high
M	07/12/2003	153	153	2003	12	7	2003	341	1	2002	15.0000	high
M	10/12/2003	220	222	2003	12	10	2003	344	6	1997	25.6394	low
F	11/12/2003	150	160	2003	12	11	2003	345	1	2002	19.5000	high
F	13/12/2003	170	175	2003	12	13	2003	347	8	1995	21.0000	low
M	13/12/2003	210	210	2003	12	13	2003	347	5	1998	24.0000	high
F	13/12/2003	198	205	2003	12	13	2003	347	4	1999	24.0000	high
F	13/12/2003	156	155	2003	12	13	2003	347	4	1999	24.6000	high
M	13/12/2003	210	210	2003	12	13	2003	347	3	2000	19.0000	high
M	13/12/2003	220	221	2003	12	13	2003	347	2	2001	27.0000	high
M	13/12/2003	130	130	2003	12	13	2003	347	1	2002	15.5000	high
M	14/12/2003	220	220	2003	12	14	2003	348	5	1998	27.5000	high
F	17/12/2003	160	160	2003	12	17	2003	351	4	1999	23.3349	high
F	17/12/2003	160	165	2003	12	17	2003	351	3	2000	18.0000	high
M	18/12/2003	175	170	2003	12	18	2003	352	8	1995	20.5000	low
F	18/12/2003	172	170	2003	12	18	2003	352	3	2000	24.5000	high
F	18/12/2003	172	170	2003	12	18	2003	352	3	2000	24.5000	high
M	18/12/2003	210	210	2003	12	18	2003	352	3	2000	22.3085	high
M	20/12/2003	212	205	2003	12	20	2003	354	4	1999	24.9000	high
F	22/12/2003	205	205	2003	12	22	2003	356	7	1996	20.5716	low
F	24/12/2003	180	182	2003	12	24	2003	358	4	1999	20.6000	high
M	24/12/2003	210	210	2003	12	24	2003	358	4	1999	26.5616	high
F	25/12/2003	165	160	2003	12	25	2003	359	1	2002	24.0000	high
F	27/12/2003	215	175	2003	12	27	2003	361	6	1997	22.0000	low
F	27/12/2003	145	140	2003	12	27	2003	361	4	1999	22.3000	high
F	27/12/2003	105	103	2003	12	27	2003	361	1	2002	17.3510	high
M	27/12/2003	135	135	2003	12	27	2003	361	1	2002	16.8912	high
M	27/12/2003	160	165	2003	12	27	2003	361	1	2002	22.5056	high
M	28/12/2003	220	215	2003	12	28	2003	362	8	1995	24.5315	low
F	28/12/2003	165	170	2003	12	28	2003	362	5	1998	23.9800	high
F	28/12/2003	160	165	2003	12	28	2003	362	4	1999	23.3349	high
M	31/12/2003	220	223	2003	12	31	2003	365	4	1999	28.8681	high
F	31/12/2003	175	170	2003	12	31	2003	365	3	2000	23.6113	high
M	01/01/2004	235	238	2003	1	1	2004	366	8	1995	31.6376	low
M	03/01/2004	224	224	2003	1	3	2004	368	8	1995	18.0287	low
F	04/01/2004	188	188	2003	1	4	2004	369	6	1997	20.5000	low
M	04/01/2004	170	165	2003	1	4	2004	369	6	1997	25.5472	low
M	07/01/2004	190	195	2003	1	7	2004	372	5	1998	23.5000	high
M	08/01/2004	192	203	2003	1	8	2004	373	4	1999	32.0000	high
M	08/01/2004	155	155	2003	1	8	2004	373	1	2002	16.4316	high
M	10/01/2004	205	205	2003	1	10	2004	375	8	1995	19.1909	low
F	10/01/2004	185	184	2003	1	10	2004	375	4	1999	23.0000	high
F	10/01/2004	215	210	2003	1	10	2004	375	2	2001	21.1240	high
M	10/01/2004	140	147	2003	1	10	2004	375	1	2002	15.0000	high
M	11/01/2004	210	210	2003	1	11	2004	376	6	1997	32.0993	low
M	11/01/2004	135	138	2003	1	11	2004	376	1	2002	13.0000	high
F	13/01/2004	105	105	2003	1	13	2004	378	1	2002	11.3006	high
F	14/01/2004	184	185	2003	1	14	2004	379	9	1994	20.2000	low
M	14/01/2004	193	195	2003	1	14	2004	379	4	1999	24.2000	high
M	14/01/2004	190	197	2003	1	14	2004	379	3	2000	23.0000	high
F	15/01/2004	210	210	2003	1	15	2004	380	8	1995	21.9529	low
M	15/01/2004	212	211	2003	1	15	2004	380	6	1997	20.8299	low
M	17/01/2004	245	250	2003	1	17	2004	382	5	1998	25.8238	high
M	18/01/2004	132	137	2003	1	18	2004	383	1	2002	20.5716	high
F	07/09/2004	186	186	2004	9	7	2004	250	7	1997	23.8000	low
F	07/09/2004	155	155	2004	9	7	2004	250	5	1999	19.0000	high
F	07/09/2004	177	181	2004	9	7	2004	250	2	2002	13.4000	high
F	07/09/2004	175	180	2004	9	7	2004	250	2	2002	25.3000	high
F	08/09/2004	162	183	2004	9	8	2004	251	10	1994	21.1000	low
F	09/09/2004	200	200	2004	9	9	2004	252	4	2000	20.5000	high
M	09/09/2004	250	250	2004	9	9	2004	252	3	2001	25.9000	high
M	12/09/2004	143	143	2004	9	12	2004	255	9	1995	22.1371	low
F	12/09/2004	220	215	2004	9	12	2004	255	8	1996	22.4135	low
M	12/09/2004	211	213	2004	9	12	2004	255	7	1997	30.8066	low
M	12/09/2004	195	190	2004	9	12	2004	255	4	2000	28.0000	high
M	12/09/2004	240	240	2004	9	12	2004	255	3	2001	30.2526	high
F	14/09/2004	200	200	2004	9	14	2004	257	7	1997	22.5000	low
F	15/09/2004	208	208	2004	9	15	2004	258	6	1998	21.4924	high
M	15/09/2004	170	170	2004	9	15	2004	258	1	2003	20.4335	high
F	16/09/2004	152	154	2004	9	16	2004	259	6	1998	17.9000	high
F	18/09/2004	205	205	2004	9	18	2004	261	8	1996	21.9529	low
M	18/09/2004	200	200	2004	9	18	2004	261	5	1999	38.5684	high
M	18/09/2004	185	185	2004	9	18	2004	261	4	2000	30.0000	high
F	18/09/2004	170	170	2004	9	18	2004	261	3	2001	15.5125	high
M	18/09/2004	140	140	2004	9	18	2004	261	1	2003	12.0000	high
F	18/09/2004	140	140	2004	9	18	2004	261	1	2003	19.1909	high
M	19/09/2004	235	240	2004	9	19	2004	262	8	1996	34.8708	low
M	19/09/2004	225	230	2004	9	19	2004	262	6	1998	31.0000	high
M	19/09/2004	190	190	2004	9	19	2004	262	5	1999	27.4840	high
M	19/09/2004	143	143	2004	9	19	2004	262	4	2000	18.2708	high
M	19/09/2004	200	200	2004	9	19	2004	262	4	2000	26.5616	high
F	19/09/2004	135	135	2004	9	19	2004	262	1	2003	18.0868	high
F	21/09/2004	165	165	2004	9	21	2004	264	7	1997	21.9000	low
F	21/09/2004	171	170	2004	9	21	2004	264	5	1999	18.3000	high
M	21/09/2004	206	209	2004	9	21	2004	264	2	2002	23.7000	high
F	23/09/2004	166	166	2004	9	23	2004	266	5	1999	18.2000	high
F	23/09/2004	166	166	2004	9	23	2004	266	5	1999	19.0000	high
M	23/09/2004	174	170	2004	9	23	2004	266	5	1999	27.8000	high
F	23/09/2004	174	174	2004	9	23	2004	266	5	1999	19.1909	high
M	23/09/2004	140	140	2004	9	23	2004	266	1	2003	22.0000	high
F	25/09/2004	160	160	2004	9	25	2004	268	9	1995	20.1113	low
M	25/09/2004	155	155	2004	9	25	2004	268	6	1998	23.7898	high
M	25/09/2004	190	192	2004	9	25	2004	268	5	1999	31.0000	high
F	25/09/2004	140	140	2004	9	25	2004	268	1	2003	18.0000	high
M	26/09/2004	164	165	2004	9	26	2004	269	1	2003	19.0000	high
F	27/09/2004	164	167	2004	9	27	2004	270	5	1999	20.3874	high
F	29/09/2004	160	159	2004	9	29	2004	272	12	1992	19.8000	low
M	29/09/2004	190	188	2004	9	29	2004	272	8	1996	29.3296	low
M	29/09/2004	160	160	2004	9	29	2004	272	1	2003	21.0319	high
F	01/10/2004	160	160	2004	10	1	2004	274	14	1990	29.1000	low
F	01/10/2004	152	152	2004	10	1	2004	274	12	1992	19.0000	low
M	02/10/2004	170	170	2004	10	2	2004	275	5	1999	29.2373	high
F	02/10/2004	178	175	2004	10	2	2004	275	5	1999	22.0000	high
M	02/10/2004	192	192	2004	10	2	2004	275	3	2001	21.9529	high
M	03/10/2004	160	160	2004	10	3	2004	276	7	1997	31.6376	low
M	03/10/2004	165	165	2004	10	3	2004	276	1	2003	17.8108	high
F	05/10/2004	160	157	2004	10	5	2004	278	9	1995	19.7000	low
M	06/10/2004	210	215	2004	10	6	2004	279	5	1999	32.5000	high
M	06/10/2004	215	220	2004	10	6	2004	279	5	1999	31.5000	high
M	06/10/2004	181	178	2004	10	6	2004	279	4	2000	24.7174	high
F	06/10/2004	160	160	2004	10	6	2004	279	4	2000	29.0000	high
F	07/10/2004	173	173	2004	10	7	2004	280	7	1997	24.3000	low
M	07/10/2004	240	240	2004	10	7	2004	280	5	1999	28.0000	high
M	07/10/2004	206	206	2004	10	7	2004	280	5	1999	23.4000	high
M	07/10/2004	195	195	2004	10	7	2004	280	5	1999	28.5000	high
M	09/10/2004	180	180	2004	10	9	2004	282	6	1998	27.0000	high
F	09/10/2004	185	185	2004	10	9	2004	282	6	1998	22.8742	high
M	09/10/2004	225	224	2004	10	9	2004	282	5	1999	21.0319	high
M	09/10/2004	140	140	2004	10	9	2004	282	1	2003	17.0000	high
F	10/10/2004	166	166	2004	10	10	2004	283	12	1992	22.4000	low
M	10/10/2004	200	250	2004	10	10	2004	283	2	2002	23.0000	high
F	12/10/2004	175	180	2004	10	12	2004	285	13	1991	19.5000	low
F	12/10/2004	162	162	2004	10	12	2004	285	10	1994	28.7000	low
M	12/10/2004	230	230	2004	10	12	2004	285	6	1998	28.1000	high
F	12/10/2004	140	141	2004	10	12	2004	285	5	1999	17.6000	high
M	12/10/2004	205	205	2004	10	12	2004	285	4	2000	29.3000	high
M	12/10/2004	218	218	2004	10	12	2004	285	2	2002	21.6766	high
M	12/10/2004	175	175	2004	10	12	2004	285	2	2002	22.1000	high
F	14/10/2004	161	163	2004	10	14	2004	287	7	1997	18.7000	low
F	14/10/2004	172	175	2004	10	14	2004	287	6	1998	24.4000	high
M	14/10/2004	190	190	2004	10	14	2004	287	4	2000	20.2393	high
F	14/10/2004	150	152	2004	10	14	2004	287	3	2001	22.0000	high
F	15/10/2004	167	167	2004	10	15	2004	288	9	1995	17.1000	low
F	15/10/2004	189	189	2004	10	15	2004	288	7	1997	26.9000	low
F	16/10/2004	181	180	2004	10	16	2004	289	5	1999	28.2000	high
F	16/10/2004	184	185	2004	10	16	2004	289	4	2000	25.6394	high
M	16/10/2004	100	100	2004	10	16	2004	289	1	2003	20.0000	high
F	17/10/2004	210	210	2004	10	17	2004	290	4	2000	26.6000	high
F	19/10/2004	180	185	2004	10	19	2004	292	4	2000	21.6000	high
M	20/10/2004	210	210	2004	10	20	2004	293	3	2001	31.1759	high
F	22/10/2004	185	186	2004	10	22	2004	295	13	1991	26.0083	low
F	22/10/2004	171	171	2004	10	22	2004	295	10	1994	18.6388	low
F	22/10/2004	176	175	2004	10	22	2004	295	8	1996	20.5000	low
M	23/10/2004	245	250	2004	10	23	2004	296	10	1994	32.0000	low
F	23/10/2004	186	181	2004	10	23	2004	296	9	1995	24.0261	low
F	23/10/2004	117	115	2004	10	23	2004	296	9	1995	26.0000	low
F	23/10/2004	145	145	2004	10	23	2004	296	4	2000	22.0000	high
F	23/10/2004	175	165	2004	10	23	2004	296	3	2001	19.0000	high
F	23/10/2004	140	138	2004	10	23	2004	296	1	2003	18.5000	high
M	24/10/2004	195	195	2004	10	24	2004	297	8	1996	26.2849	low
F	24/10/2004	195	195	2004	10	24	2004	297	8	1996	22.8742	low
M	24/10/2004	170	170	2004	10	24	2004	297	2	2002	22.0450	high
F	25/10/2004	186	185	2004	10	25	2004	298	11	1993	27.0000	low
F	25/10/2004	169	167	2004	10	25	2004	298	11	1993	18.2708	low
M	25/10/2004	215	219	2004	10	25	2004	298	3	2001	26.1005	high
F	25/10/2004	178	177	2004	10	25	2004	298	3	2001	19.1909	high
M	30/10/2004	240	231	2004	10	30	2004	303	7	1997	31.8000	low
M	30/10/2004	175	190	2004	10	30	2004	303	4	2000	27.0000	high
M	31/10/2004	170	190	2004	10	31	2004	304	10	1994	21.2161	low
M	31/10/2004	156	156	2004	10	31	2004	304	4	2000	27.4840	high
F	01/11/2004	200	200	2004	11	1	2004	305	13	1991	20.0000	low
M	01/11/2004	200	200	2004	11	1	2004	305	5	1999	23.0000	high
M	01/11/2004	217	215	2004	11	1	2004	305	4	2000	32.0000	high
M	04/11/2004	127	123	2004	11	4	2004	308	5	1999	29.0000	high
F	06/11/2004	165	160	2004	11	6	2004	310	6	1998	21.9529	high
M	06/11/2004	155	155	2004	11	6	2004	310	1	2003	14.5076	high
M	06/11/2004	130	140	2004	11	6	2004	310	1	2003	13.6308	high
M	06/11/2004	134	134	2004	11	6	2004	310	1	2003	17.0000	high
M	07/11/2004	185	190	2004	11	7	2004	311	4	2000	25.4000	high
M	07/11/2004	175	160	2004	11	7	2004	311	2	2002	20.0000	high
F	11/11/2004	180	180	2004	11	11	2004	315	9	1995	24.5000	low
M	11/11/2004	190	185	2004	11	11	2004	315	8	1996	29.0000	low
F	11/11/2004	150	152	2004	11	11	2004	315	6	1998	24.9018	high
F	11/11/2004	180	180	2004	11	11	2004	315	5	1999	19.3749	high
F	11/11/2004	165	170	2004	11	11	2004	315	4	2000	21.5845	high
F	11/11/2004	143	143	2004	11	11	2004	315	4	2000	22.0000	high
F	11/11/2004	165	170	2004	11	11	2004	315	3	2001	23.7957	high
M	11/11/2004	185	192	2004	11	11	2004	315	3	2001	21.0515	high
F	11/11/2004	168	170	2004	11	11	2004	315	2	2002	19.5000	high
M	07/12/2004	207	208	2004	12	7	2004	341	10	1994	22.5000	low
M	07/12/2004	192	190	2004	12	7	2004	341	4	2000	22.5000	high
F	08/12/2004	162	164	2004	12	8	2004	342	10	1994	21.4000	low
F	08/12/2004	234	238	2004	12	8	2004	342	10	1994	25.5000	low
F	08/12/2004	175	170	2004	12	8	2004	342	3	2001	20.1113	high
M	09/12/2004	170	165	2004	12	9	2004	343	10	1994	24.0000	low
M	11/12/2004	198	196	2004	12	11	2004	345	7	1997	28.2000	low
M	12/12/2004	260	260	2004	12	12	2004	346	11	1993	21.7687	low
M	12/12/2004	215	215	2004	12	12	2004	346	3	2001	18.0868	high
M	12/12/2004	198	195	2004	12	12	2004	346	3	2001	21.4003	high
F	13/12/2004	145	145	2004	12	13	2004	347	9	1995	21.1240	low
F	14/12/2004	162	163	2004	12	14	2004	348	10	1994	33.0000	low
F	14/12/2004	165	168	2004	12	14	2004	348	4	2000	23.2000	high
F	15/12/2004	180	180	2004	12	15	2004	349	11	1993	19.6510	low
F	16/12/2004	185	155	2004	12	16	2004	350	8	1996	24.5000	low
F	16/12/2004	160	161	2004	12	16	2004	350	1	2003	21.2000	high
F	16/12/2004	160	161	2004	12	16	2004	350	1	2003	21.2000	high
M	22/12/2004	175	180	2004	12	22	2004	356	8	1996	30.0000	low
M	22/12/2004	220	220	2004	12	22	2004	356	2	2002	20.4795	high
F	23/12/2004	189	185	2004	12	23	2004	357	8	1996	25.1784	low
F	23/12/2004	170	180	2004	12	23	2004	357	5	1999	24.2000	high
F	25/12/2004	151	152	2004	12	25	2004	359	4	2000	24.7174	high
M	29/12/2004	220	220	2004	12	29	2004	363	4	2000	21.4924	high
F	30/12/2004	219	216	2004	12	30	2004	364	11	1993	24.6000	low
F	30/12/2004	162	160	2004	12	30	2004	364	8	1996	19.7431	low
M	30/12/2004	230	230	2004	12	30	2004	364	8	1996	25.0000	low
M	30/12/2004	215	217	2004	12	30	2004	364	3	2001	17.2000	high
M	01/01/2005	77	80	2004	1	1	2005	366	0	2004	12.9412	high
M	06/01/2005	230	232	2004	1	6	2005	371	4	2000	20.2000	high
F	08/01/2005	180	182	2004	1	8	2005	373	5	1999	25.0000	high
M	08/01/2005	165	165	2004	1	8	2005	373	1	2003	16.4316	high
F	09/01/2005	180	180	2004	1	9	2005	374	3	2001	21.0319	high
M	12/01/2005	185	180	2004	1	12	2005	377	2	2002	22.8742	high
M	15/01/2005	190	185	2004	1	15	2005	380	1	2003	20.5716	high
M	06/09/2005	212	217	2005	9	6	2005	249	5	2000	26.1927	high
F	06/09/2005	83	82	2005	9	6	2005	249	1	2004	20.4000	high
M	06/09/2005	143	145	2005	9	6	2005	249	1	2004	15.3000	high
F	06/09/2005	108	107	2005	9	6	2005	249	1	2004	15.1000	high
M	08/09/2005	216	216	2005	9	8	2005	251	4	2001	26.3000	high
M	08/09/2005	187	188	2005	9	8	2005	251	2	2003	19.9000	high
F	11/09/2005	203	202	2005	9	11	2005	254	7	1998	28.7000	high
M	11/09/2005	250	255	2005	9	11	2005	254	7	1998	34.1000	high
F	11/09/2005	200	200	2005	9	11	2005	254	4	2001	25.0000	high
M	11/09/2005	207	210	2005	9	11	2005	254	3	2002	22.8742	high
M	11/09/2005	102	102	2005	9	11	2005	254	1	2004	18.8000	high
M	13/09/2005	218	218	2005	9	13	2005	256	14	1991	26.6000	low
F	13/09/2005	187	193	2005	9	13	2005	256	4	2001	21.6000	high
F	13/09/2005	176	178	2005	9	13	2005	256	2	2003	19.4000	high
F	14/09/2005	197	202	2005	9	14	2005	257	8	1997	22.6000	low
M	14/09/2005	230	235	2005	9	14	2005	257	5	2000	32.5611	high
M	14/09/2005	223	225	2005	9	14	2005	257	4	2001	25.5000	high
M	14/09/2005	247	248	2005	9	14	2005	257	4	2001	26.4000	high
F	14/09/2005	180	175	2005	9	14	2005	257	3	2002	19.1909	high
F	14/09/2005	172	170	2005	9	14	2005	257	3	2002	21.5000	high
M	14/09/2005	144	140	2005	9	14	2005	257	1	2004	18.0868	high
F	14/09/2005	92	94	2005	9	14	2005	257	1	2004	15.0000	high
M	14/09/2005	144	144	2005	9	14	2005	257	1	2004	13.2000	high
F	14/09/2005	30	28	2005	9	14	2005	257	0	2005	8.1760	high
F	15/09/2005	218	225	2005	9	15	2005	258	14	1991	22.6000	low
F	15/09/2005	185	187	2005	9	15	2005	258	13	1992	17.8000	low
F	15/09/2005	216	214	2005	9	15	2005	258	9	1996	24.8000	low
M	15/09/2005	181	183	2005	9	15	2005	258	3	2002	21.0000	high
M	15/09/2005	140	143	2005	9	15	2005	258	1	2004	18.8000	high
F	15/09/2005	135	138	2005	9	15	2005	258	1	2004	14.8000	high
F	17/09/2005	197	202	2005	9	17	2005	260	7	1998	20.2954	high
M	17/09/2005	226	230	2005	9	17	2005	260	5	2000	27.0000	high
F	17/09/2005	154	153	2005	9	17	2005	260	4	2001	21.1000	high
F	17/09/2005	195	190	2005	9	17	2005	260	4	2001	23.7957	high
M	17/09/2005	235	235	2005	9	17	2005	260	4	2001	28.4067	high
F	17/09/2005	117	117	2005	9	17	2005	260	1	2004	15.0531	high
F	18/09/2005	117	114	2005	9	18	2005	261	1	2004	15.0000	high
F	20/09/2005	174	175	2005	9	20	2005	263	4	2001	17.5000	high
M	20/09/2005	221	225	2005	9	20	2005	263	2	2003	24.9000	high
M	21/09/2005	210	215	2005	9	21	2005	264	7	1998	33.4849	high
M	22/09/2005	229	227	2005	9	22	2005	265	10	1995	24.2000	low
F	22/09/2005	198	198	2005	9	22	2005	265	9	1996	21.7000	low
F	22/09/2005	199	200	2005	9	22	2005	265	7	1998	24.3000	high
M	22/09/2005	214	214	2005	9	22	2005	265	4	2001	23.5000	high
M	22/09/2005	222	222	2005	9	22	2005	265	2	2003	26.4000	high
F	22/09/2005	160	166	2005	9	22	2005	265	2	2003	20.4000	high
M	22/09/2005	120	120	2005	9	22	2005	265	1	2004	18.2708	high
F	22/09/2005	111	110	2005	9	22	2005	265	1	2004	16.6000	high
M	24/09/2005	195	185	2005	9	24	2005	267	7	1998	29.5000	high
M	24/09/2005	195	185	2005	9	24	2005	267	7	1998	29.5000	high
M	24/09/2005	204	209	2005	9	24	2005	267	4	2001	23.9800	high
M	24/09/2005	204	209	2005	9	24	2005	267	4	2001	23.9800	high
M	24/09/2005	213	215	2005	9	24	2005	267	4	2001	27.4840	high
M	24/09/2005	218	217	2005	9	24	2005	267	3	2002	23.3349	high
M	24/09/2005	184	182	2005	9	24	2005	267	2	2003	18.4548	high
M	24/09/2005	142	143	2005	9	24	2005	267	1	2004	18.5000	high
F	24/09/2005	150	158	2005	9	24	2005	267	1	2004	14.0000	high
M	25/09/2005	235	260	2005	9	25	2005	268	10	1995	30.0000	low
M	28/09/2005	220	218	2005	9	28	2005	271	6	1999	32.4000	high
F	28/09/2005	25	25	2005	9	28	2005	271	0	2005	7.9931	high
M	29/09/2005	240	241	2005	9	29	2005	272	4	2001	33.0000	high
M	29/09/2005	220	222	2005	9	29	2005	272	4	2001	30.0000	high
M	29/09/2005	200	200	2005	9	29	2005	272	1	2004	21.0000	high
M	01/10/2005	156	152	2005	10	1	2005	274	2	2003	14.5938	high
F	04/10/2005	181	179	2005	10	4	2005	277	5	2000	20.3000	high
F	04/10/2005	190	190	2005	10	4	2005	277	3	2002	22.3000	high
M	04/10/2005	175	170	2005	10	4	2005	277	1	2004	19.7000	high
F	04/10/2005	124	124	2005	10	4	2005	277	1	2004	17.6000	high
M	04/10/2005	135	137	2005	10	4	2005	277	1	2004	17.5000	high
M	04/10/2005	131	131	2005	10	4	2005	277	1	2004	14.5000	high
M	05/10/2005	230	230	2005	10	5	2005	278	2	2003	23.0000	high
M	05/10/2005	60	60	2005	10	5	2005	278	0	2005	13.4000	high
F	06/10/2005	220	228	2005	10	6	2005	279	15	1990	20.3000	low
F	06/10/2005	165	166	2005	10	6	2005	279	8	1997	22.7000	low
M	06/10/2005	250	247	2005	10	6	2005	279	7	1998	32.7000	high
F	06/10/2005	204	204	2005	10	6	2005	279	5	2000	25.7000	high
M	06/10/2005	210	210	2005	10	6	2005	279	4	2001	29.5000	high
F	06/10/2005	175	172	2005	10	6	2005	279	3	2002	21.6000	high
M	06/10/2005	160	158	2005	10	6	2005	279	1	2004	16.5000	high
F	08/10/2005	225	226	2005	10	8	2005	281	8	1997	24.6000	low
F	08/10/2005	85	85	2005	10	8	2005	281	1	2004	15.0000	high
M	08/10/2005	51	51	2005	10	8	2005	281	0	2005	13.5837	high
M	09/10/2005	217	215	2005	10	9	2005	282	5	2000	29.3296	high
M	09/10/2005	198	200	2005	10	9	2005	282	3	2002	22.9000	high
M	09/10/2005	220	220	2005	10	9	2005	282	2	2003	24.3000	high
M	09/10/2005	165	165	2005	10	9	2005	282	1	2004	18.4000	high
F	11/10/2005	191	194	2005	10	11	2005	284	5	2000	20.6000	high
F	12/10/2005	210	212	2005	10	12	2005	285	6	1999	27.0000	high
F	12/10/2005	165	165	2005	10	12	2005	285	3	2002	21.5000	high
F	12/10/2005	145	145	2005	10	12	2005	285	2	2003	23.4000	high
M	12/10/2005	210	210	2005	10	12	2005	285	2	2003	23.0000	high
F	13/10/2005	236	234	2005	10	13	2005	286	12	1993	23.9000	low
F	13/10/2005	125	125	2005	10	13	2005	286	1	2004	18.3000	high
M	13/10/2005	150	150	2005	10	13	2005	286	1	2004	17.3000	high
M	15/10/2005	155	154	2005	10	15	2005	288	2	2003	17.8108	high
M	16/10/2005	140	140	2005	10	16	2005	289	1	2004	15.0000	high
F	18/10/2005	210	214	2005	10	18	2005	291	14	1991	20.1000	low
F	18/10/2005	210	209	2005	10	18	2005	291	10	1995	19.5000	low
F	18/10/2005	188	184	2005	10	18	2005	291	4	2001	18.1000	high
M	18/10/2005	222	222	2005	10	18	2005	291	4	2001	22.6000	high
F	18/10/2005	185	187	2005	10	18	2005	291	4	2001	23.1000	high
F	18/10/2005	139	137	2005	10	18	2005	291	2	2003	15.7000	high
F	20/10/2005	194	197	2005	10	20	2005	293	9	1996	22.0000	low
F	20/10/2005	210	210	2005	10	20	2005	293	6	1999	27.0000	high
M	20/10/2005	220	220	2005	10	20	2005	293	5	2000	30.5000	high
M	20/10/2005	193	190	2005	10	20	2005	293	2	2003	22.0000	high
F	20/10/2005	140	138	2005	10	20	2005	293	1	2004	16.8912	high
F	20/10/2005	103	104	2005	10	20	2005	293	1	2004	17.7000	high
F	21/10/2005	193	195	2005	10	21	2005	294	8	1997	23.3000	low
F	21/10/2005	176	174	2005	10	21	2005	294	4	2001	19.1000	high
M	21/10/2005	164	165	2005	10	21	2005	294	1	2004	17.8000	high
M	22/10/2005	205	207	2005	10	22	2005	295	5	2000	29.7000	high
F	22/10/2005	175	175	2005	10	22	2005	295	2	2003	21.6000	high
F	24/10/2005	163	164	2005	10	24	2005	297	4	2001	18.3000	high
F	24/10/2005	119	122	2005	10	24	2005	297	1	2004	17.2000	high
F	25/10/2005	160	170	2005	10	25	2005	298	2	2003	20.5000	high
F	26/10/2005	194	195	2005	10	26	2005	299	3	2002	19.3749	high
M	26/10/2005	200	199	2005	10	26	2005	299	3	2002	28.1000	high
F	26/10/2005	155	150	2005	10	26	2005	299	3	2002	20.0000	high
M	26/10/2005	160	155	2005	10	26	2005	299	1	2004	23.0000	high
F	27/10/2005	243	244	2005	10	27	2005	300	14	1991	26.2000	low
F	27/10/2005	198	198	2005	10	27	2005	300	9	1996	23.5000	low
F	27/10/2005	201	202	2005	10	27	2005	300	7	1998	21.9000	high
F	27/10/2005	190	189	2005	10	27	2005	300	7	1998	18.9000	high
M	27/10/2005	150	152	2005	10	27	2005	300	1	2004	19.4209	high
F	28/10/2005	185	187	2005	10	28	2005	301	4	2001	22.0000	high
F	28/10/2005	179	176	2005	10	28	2005	301	4	2001	18.1000	high
M	28/10/2005	150	150	2005	10	28	2005	301	1	2004	17.5000	high
F	28/10/2005	118	120	2005	10	28	2005	301	1	2004	17.9000	high
M	29/10/2005	245	240	2005	10	29	2005	302	7	1998	24.8000	high
M	29/10/2005	230	226	2005	10	29	2005	302	6	1999	31.2000	high
M	29/10/2005	250	230	2005	10	29	2005	302	6	1999	27.0000	high
F	29/10/2005	192	190	2005	10	29	2005	302	5	2000	23.5000	high
F	30/10/2005	205	205	2005	10	30	2005	303	11	1994	23.0000	low
F	30/10/2005	191	190	2005	10	30	2005	303	5	2000	23.9339	high
M	30/10/2005	60	60	2005	10	30	2005	303	0	2005	12.6000	high
M	31/10/2005	191	187	2005	10	31	2005	304	2	2003	22.5000	high
M	31/10/2005	143	143	2005	10	31	2005	304	1	2004	17.2000	high
F	01/11/2005	168	171	2005	11	1	2005	305	3	2002	17.4000	high
F	01/11/2005	126	126	2005	11	1	2005	305	3	2002	23.5000	high
M	01/11/2005	225	220	2005	11	1	2005	305	3	2002	34.8708	high
F	01/11/2005	140	140	2005	11	1	2005	305	2	2003	15.5125	high
F	04/11/2005	200	199	2005	11	4	2005	308	4	2001	22.3000	high
F	05/11/2005	189	187	2005	11	5	2005	309	6	1999	25.1784	high
M	06/11/2005	220	215	2005	11	6	2005	310	5	2000	31.0000	high
M	09/11/2005	78	75	2005	11	9	2005	313	0	2005	9.1827	high
M	10/11/2005	230	230	2005	11	10	2005	314	4	2001	22.0000	high
F	10/11/2005	115	110	2005	11	10	2005	314	1	2004	15.2000	high
F	10/11/2005	115	115	2005	11	10	2005	314	1	2004	16.8912	high
M	11/11/2005	215	216	2005	11	11	2005	315	4	2001	17.0000	high
M	11/11/2005	245	245	2005	11	11	2005	315	4	2001	20.2000	high
M	11/11/2005	211	213	2005	11	11	2005	315	3	2002	23.0000	high
F	11/11/2005	70	70	2005	11	11	2005	315	1	2004	13.4000	high
F	04/12/2005	200	205	2005	12	4	2005	338	7	1998	21.0319	high
M	04/12/2005	196	196	2005	12	4	2005	338	4	2001	21.2161	high
F	04/12/2005	45	40	2005	12	4	2005	338	0	2005	10.1000	high
F	07/12/2005	191	192	2005	12	7	2005	341	7	1998	22.7360	high
M	08/12/2005	230	226	2005	12	8	2005	342	4	2001	23.4000	high
F	08/12/2005	172	172	2005	12	8	2005	342	3	2002	21.8000	high
F	10/12/2005	190	191	2005	12	10	2005	344	8	1997	21.0319	low
M	10/12/2005	210	210	2005	12	10	2005	344	4	2001	22.1371	high
M	10/12/2005	60	60	2005	12	10	2005	344	0	2005	12.7576	high
F	14/12/2005	195	195	2005	12	14	2005	348	6	1999	18.7308	high
F	14/12/2005	195	195	2005	12	14	2005	348	6	1999	18.7308	high
M	14/12/2005	210	200	2005	12	14	2005	348	5	2000	32.0000	high
F	15/12/2005	195	200	2005	12	15	2005	349	12	1993	21.0000	low
M	15/12/2005	220	220	2005	12	15	2005	349	6	1999	21.5689	high
F	15/12/2005	184	186	2005	12	15	2005	349	5	2000	21.2000	high
M	15/12/2005	187	190	2005	12	15	2005	349	2	2003	20.0000	high
F	17/12/2005	198	200	2005	12	17	2005	351	6	1999	23.0000	high
M	18/12/2005	254	248	2005	12	18	2005	352	7	1998	23.4270	high
F	18/12/2005	190	192	2005	12	18	2005	352	4	2001	22.7000	high
M	18/12/2005	220	210	2005	12	18	2005	352	3	2002	18.2000	high
M	21/12/2005	235	235	2005	12	21	2005	355	5	2000	23.0000	high
M	22/12/2005	240	238	2005	12	22	2005	356	8	1997	24.2000	low
F	22/12/2005	187	185	2005	12	22	2005	356	6	1999	19.0000	high
M	24/12/2005	266	266	2005	12	24	2005	358	10	1995	22.1000	low
M	24/12/2005	230	230	2005	12	24	2005	358	4	2001	23.0000	high
M	24/12/2005	225	230	2005	12	24	2005	358	3	2002	29.3296	high
M	27/12/2005	220	215	2005	12	27	2005	361	5	2000	20.5000	high
F	27/12/2005	178	172	2005	12	27	2005	361	3	2002	17.6000	high
M	31/12/2005	155	156	2005	12	31	2005	365	1	2004	17.6000	high
M	04/01/2006	178	176	2005	1	4	2006	369	5	2000	33.0000	high
M	05/01/2006	230	230	2005	1	5	2006	370	6	1999	28.0000	high
M	05/01/2006	220	220	2005	1	5	2006	370	4	2001	21.6000	high
M	05/01/2006	237	232	2005	1	5	2006	370	4	2001	21.6000	high
F	05/01/2006	195	200	2005	1	5	2006	370	4	2001	21.0319	high
F	05/01/2006	190	190	2005	1	5	2006	370	3	2002	23.3000	high
M	05/01/2006	125	125	2005	1	5	2006	370	1	2004	11.8402	high
F	05/01/2006	60	60	2005	1	5	2006	370	0	2005	9.2000	high
F	05/01/2006	60	60	2005	1	5	2006	370	0	2005	9.2000	high
F	07/01/2006	224	222	2005	1	7	2006	372	8	1997	23.2000	low
M	07/01/2006	210	210	2005	1	7	2006	372	5	2000	21.9529	high
M	07/01/2006	220	225	2005	1	7	2006	372	2	2003	19.4669	high
M	07/01/2006	158	157	2005	1	7	2006	372	1	2004	18.0000	high
F	07/01/2006	125	125	2005	1	7	2006	372	1	2004	14.5938	high
F	08/01/2006	180	180	2005	1	8	2006	373	6	1999	23.0000	high
M	08/01/2006	230	230	2005	1	8	2006	373	5	2000	23.7898	high
M	08/01/2006	162	160	2005	1	8	2006	373	1	2004	18.2708	high
F	08/01/2006	155	160	2005	1	8	2006	373	1	2004	18.2708	high
F	11/01/2006	180	80	2005	1	11	2006	376	3	2002	19.0000	high
F	11/01/2006	170	175	2005	1	11	2006	376	3	2002	18.7308	high
F	14/01/2006	130	125	2005	1	14	2006	379	1	2004	17.0000	high
F	14/01/2006	115	120	2005	1	14	2006	379	1	2004	18.7308	high
M	15/01/2006	105	110	2005	1	15	2006	380	1	2004	17.5349	high
F	21/02/2006	182	179	2005	2	21	2006	417	3	2002	18.4000	high
M	05/09/2006	132	130	2006	9	5	2006	248	1	2005	16.9000	high
M	05/09/2006	148	147	2006	9	5	2006	248	1	2005	17.6000	high
M	05/09/2006	147	145	2006	9	5	2006	248	1	2005	16.9000	high
M	07/09/2006	229	223	2006	9	7	2006	250	14	1992	31.0000	low
F	07/09/2006	191	201	2006	9	7	2006	250	13	1993	21.2000	low
F	07/09/2006	183	180	2006	9	7	2006	250	5	2001	17.3000	high
F	07/09/2006	108	106	2006	9	7	2006	250	1	2005	13.1000	high
M	09/09/2006	210	210	2006	9	9	2006	252	9	1997	22.8742	low
F	09/09/2006	190	193	2006	9	9	2006	252	5	2001	23.3349	high
F	10/09/2006	230	230	2006	9	10	2006	253	15	1991	20.1113	low
F	10/09/2006	180	180	2006	9	10	2006	253	15	1991	18.7308	low
M	10/09/2006	232	240	2006	9	10	2006	253	12	1994	28.0000	low
F	10/09/2006	165	170	2006	9	10	2006	253	6	2000	20.0000	high
M	10/09/2006	222	232	2006	9	10	2006	253	6	2000	32.1000	high
M	10/09/2006	210	215	2006	9	10	2006	253	4	2002	27.9000	high
M	10/09/2006	248	246	2006	9	10	2006	253	4	2002	27.5040	high
M	10/09/2006	210	215	2006	9	10	2006	253	4	2002	31.0000	high
M	12/09/2006	217	216	2006	9	12	2006	255	2	2004	25.0000	high
F	12/09/2006	115	124	2006	9	12	2006	255	1	2005	18.2000	high
M	13/09/2006	225	220	2006	9	13	2006	256	4	2002	25.1784	high
F	13/09/2006	140	141	2006	9	13	2006	256	1	2005	21.5000	high
F	14/09/2006	132	134	2006	9	14	2006	257	1	2005	18.7308	high
F	14/09/2006	129	132	2006	9	14	2006	257	1	2005	17.0000	high
F	14/09/2006	33	33	2006	9	14	2006	257	0	2006	11.4000	high
M	16/09/2006	212	203	2006	9	16	2006	259	5	2001	24.0000	high
F	16/09/2006	220	223	2006	9	16	2006	259	5	2001	26.0000	high
M	16/09/2006	217	217	2006	9	16	2006	259	4	2002	30.0000	high
F	16/09/2006	127	124	2006	9	16	2006	259	1	2005	17.3000	high
M	17/09/2006	201	206	2006	9	17	2006	260	3	2003	25.5000	high
M	17/09/2006	120	130	2006	9	17	2006	260	1	2005	15.5000	high
F	19/09/2006	232	243	2006	9	19	2006	262	10	1996	30.9000	low
F	19/09/2006	201	193	2006	9	19	2006	262	5	2001	18.6000	high
F	19/09/2006	205	203	2006	9	19	2006	262	4	2002	22.2000	high
M	20/09/2006	227	231	2006	9	20	2006	263	8	1998	30.2000	high
M	20/09/2006	200	200	2006	9	20	2006	263	4	2002	29.0000	high
F	21/09/2006	209	213	2006	9	21	2006	264	13	1993	18.0000	low
M	21/09/2006	200	204	2006	9	21	2006	264	8	1998	25.0000	high
M	21/09/2006	235	245	2006	9	21	2006	264	4	2002	24.0000	high
M	21/09/2006	202	207	2006	9	21	2006	264	3	2003	29.4219	high
F	21/09/2006	120	115	2006	9	21	2006	264	1	2005	19.3000	high
F	23/09/2006	188	190	2006	9	23	2006	266	4	2002	22.5056	high
F	23/09/2006	125	127	2006	9	23	2006	266	1	2005	14.4101	high
F	23/09/2006	120	150	2006	9	23	2006	266	1	2005	14.0000	high
M	23/09/2006	165	170	2006	9	23	2006	266	1	2005	20.1000	high
M	23/09/2006	170	163	2006	9	23	2006	266	1	2005	21.0000	high
F	23/09/2006	35	35	2006	9	23	2006	266	0	2006	9.4574	high
F	24/09/2006	152	151	2006	9	24	2006	267	3	2003	17.3510	high
F	24/09/2006	165	170	2006	9	24	2006	267	3	2003	20.5716	high
F	26/09/2006	217	217	2006	9	26	2006	269	11	1995	22.8000	low
F	26/09/2006	205	207	2006	9	26	2006	269	5	2001	17.3000	high
F	26/09/2006	198	193	2006	9	26	2006	269	3	2003	20.0000	high
F	26/09/2006	113	114	2006	9	26	2006	269	1	2005	16.3000	high
M	27/09/2006	223	224	2006	9	27	2006	270	15	1991	16.1000	low
F	27/09/2006	180	180	2006	9	27	2006	270	8	1998	25.0000	high
F	28/09/2006	206	209	2006	9	28	2006	271	8	1998	26.2000	high
F	28/09/2006	186	182	2006	9	28	2006	271	8	1998	26.2000	high
F	28/09/2006	180	170	2006	9	28	2006	271	3	2003	26.0000	high
F	28/09/2006	25	24	2006	9	28	2006	271	0	2006	9.5490	high
F	29/09/2006	189	186	2006	9	29	2006	272	3	2003	20.0000	high
F	30/09/2006	195	185	2006	9	30	2006	273	8	1998	26.0000	high
M	30/09/2006	225	220	2006	9	30	2006	273	4	2002	30.2526	high
F	30/09/2006	181	185	2006	9	30	2006	273	3	2003	22.0000	high
M	30/09/2006	290	290	2006	9	30	2006	273	3	2003	27.4840	high
M	30/09/2006	105	105	2006	9	30	2006	273	1	2005	16.0000	high
F	30/09/2006	110	110	2006	9	30	2006	273	1	2005	13.6755	high
M	01/10/2006	200	206	2006	10	1	2006	274	3	2003	22.0000	high
F	01/10/2006	185	180	2006	10	1	2006	274	3	2003	20.0000	high
F	03/10/2006	181	183	2006	10	3	2006	276	7	1999	20.7000	high
F	03/10/2006	179	176	2006	10	3	2006	276	4	2002	21.1000	high
F	03/10/2006	201	195	2006	10	3	2006	276	4	2002	22.3000	high
F	03/10/2006	176	183	2006	10	3	2006	276	3	2003	20.1000	high
M	04/10/2006	215	205	2006	10	4	2006	277	8	1998	27.0000	high
M	04/10/2006	235	235	2006	10	4	2006	277	5	2001	33.0000	high
F	05/10/2006	196	196	2006	10	5	2006	278	10	1996	19.3000	low
F	05/10/2006	195	192	2006	10	5	2006	278	8	1998	21.9000	high
M	05/10/2006	190	185	2006	10	5	2006	278	1	2005	18.5000	high
F	05/10/2006	117	120	2006	10	5	2006	278	1	2005	19.8000	high
F	07/10/2006	190	180	2006	10	7	2006	280	6	2000	26.0000	high
M	07/10/2006	224	222	2006	10	7	2006	280	6	2000	30.0000	high
F	08/10/2006	200	200	2006	10	8	2006	281	11	1995	19.0000	low
M	08/10/2006	251	251	2006	10	8	2006	281	7	1999	28.1000	high
F	08/10/2006	180	170	2006	10	8	2006	281	5	2001	25.0000	high
M	08/10/2006	228	225	2006	10	8	2006	281	5	2001	26.7000	high
M	08/10/2006	230	220	2006	10	8	2006	281	4	2002	29.0000	high
F	08/10/2006	146	148	2006	10	8	2006	281	1	2005	15.5125	high
F	09/10/2006	196	192	2006	10	9	2006	282	5	2001	21.5000	high
M	10/10/2006	218	219	2006	10	10	2006	283	4	2002	27.1000	high
M	10/10/2006	217	217	2006	10	10	2006	283	4	2002	28.9000	high
M	11/10/2006	216	215	2006	10	11	2006	284	4	2002	27.9453	high
F	11/10/2006	176	176	2006	10	11	2006	284	4	2002	24.5000	high
F	11/10/2006	195	200	2006	10	11	2006	284	4	2002	25.2000	high
M	12/10/2006	222	223	2006	10	12	2006	285	4	2002	26.0000	high
M	12/10/2006	210	210	2006	10	12	2006	285	4	2002	31.0000	high
F	12/10/2006	158	150	2006	10	12	2006	285	2	2004	21.0000	high
F	13/10/2006	210	202	2006	10	13	2006	286	11	1995	20.8000	low
F	13/10/2006	183	181	2006	10	13	2006	286	10	1996	20.3874	low
F	14/10/2006	220	225	2006	10	14	2006	287	17	1989	29.4000	low
M	14/10/2006	235	235	2006	10	14	2006	287	6	2000	35.0000	high
M	14/10/2006	220	215	2006	10	14	2006	287	3	2003	26.2000	high
M	14/10/2006	210	208	2006	10	14	2006	287	3	2003	25.3000	high
M	15/10/2006	190	188	2006	10	15	2006	288	6	2000	30.0000	high
F	15/10/2006	180	180	2006	10	15	2006	288	5	2001	21.0000	high
M	15/10/2006	220	215	2006	10	15	2006	288	5	2001	25.0000	high
M	15/10/2006	210	210	2006	10	15	2006	288	5	2001	30.4373	high
M	15/10/2006	208	211	2006	10	15	2006	288	3	2003	25.0000	high
M	15/10/2006	140	140	2006	10	15	2006	288	1	2005	15.0000	high
M	17/10/2006	154	154	2006	10	17	2006	290	1	2005	17.9000	high
F	17/10/2006	132	130	2006	10	17	2006	290	1	2005	16.7000	high
M	18/10/2006	229	228	2006	10	18	2006	291	14	1992	41.4358	low
M	18/10/2006	244	248	2006	10	18	2006	291	6	2000	32.3000	high
M	18/10/2006	158	159	2006	10	18	2006	291	1	2005	16.6154	high
F	19/10/2006	207	204	2006	10	19	2006	292	12	1994	22.4000	low
M	19/10/2006	223	225	2006	10	19	2006	292	5	2001	30.0000	high
F	19/10/2006	189	186	2006	10	19	2006	292	4	2002	23.3000	high
M	19/10/2006	142	144	2006	10	19	2006	292	1	2005	15.6000	high
M	19/10/2006	143	146	2006	10	19	2006	292	1	2005	17.6000	high
F	20/10/2006	204	209	2006	10	20	2006	293	5	2001	21.7000	high
F	20/10/2006	201	204	2006	10	20	2006	293	5	2001	21.2000	high
M	20/10/2006	211	209	2006	10	20	2006	293	3	2003	28.9000	high
F	20/10/2006	179	184	2006	10	20	2006	293	2	2004	21.9000	high
F	21/10/2006	220	218	2006	10	21	2006	294	5	2001	26.9000	high
F	22/10/2006	190	195	2006	10	22	2006	295	2	2004	23.2000	high
F	22/10/2006	108	108	2006	10	22	2006	295	1	2005	16.0000	high
M	24/10/2006	222	225	2006	10	24	2006	297	4	2002	27.4000	high
M	24/10/2006	227	220	2006	10	24	2006	297	2	2004	19.0000	high
M	24/10/2006	222	210	2006	10	24	2006	297	2	2004	22.4000	high
F	25/10/2006	210	200	2006	10	25	2006	298	10	1996	25.0000	low
F	25/10/2006	200	190	2006	10	25	2006	298	8	1998	25.2000	high
M	25/10/2006	222	220	2006	10	25	2006	298	4	2002	30.5000	high
F	25/10/2006	190	185	2006	10	25	2006	298	3	2003	25.6394	high
F	25/10/2006	121	120	2006	10	25	2006	298	1	2005	18.1000	high
M	25/10/2006	49	47	2006	10	25	2006	298	0	2006	12.9000	high
F	26/10/2006	185	187	2006	10	26	2006	299	4	2002	18.5000	high
M	28/10/2006	222	220	2006	10	28	2006	301	5	2001	27.6000	high
F	28/10/2006	122	120	2006	10	28	2006	301	1	2005	18.7308	high
F	28/10/2006	137	135	2006	10	28	2006	301	1	2005	17.5349	high
M	29/10/2006	136	136	2006	10	29	2006	302	1	2005	16.7074	high
M	29/10/2006	50	45	2006	10	29	2006	302	0	2006	15.5125	high
F	30/10/2006	140	140	2006	10	30	2006	303	10	1996	22.7000	low
F	30/10/2006	198	197	2006	10	30	2006	303	7	1999	24.0000	high
F	30/10/2006	188	192	2006	10	30	2006	303	5	2001	23.5000	high
F	31/10/2006	182	181	2006	10	31	2006	304	5	2001	21.0000	high
M	01/11/2006	235	230	2006	11	1	2006	305	7	1999	20.0000	high
M	01/11/2006	252	248	2006	11	1	2006	305	7	1999	24.5315	high
M	01/11/2006	252	248	2006	11	1	2006	305	7	1999	24.5315	high
F	01/11/2006	220	210	2006	11	1	2006	305	5	2001	21.0000	high
M	01/11/2006	215	213	2006	11	1	2006	305	5	2001	22.4135	high
M	02/11/2006	210	210	2006	11	2	2006	306	5	2001	26.5000	high
M	02/11/2006	240	235	2006	11	2	2006	306	4	2002	27.5000	high
M	02/11/2006	258	254	2006	11	2	2006	306	4	2002	29.3000	high
M	02/11/2006	130	130	2006	11	2	2006	306	1	2005	19.1000	high
M	02/11/2006	166	164	2006	11	2	2006	306	1	2005	20.5716	high
F	04/11/2006	187	188	2006	11	4	2006	308	5	2001	20.1113	high
M	04/11/2006	150	140	2006	11	4	2006	308	1	2005	19.8000	high
F	05/11/2006	193	191	2006	11	5	2006	309	5	2001	23.8000	high
M	05/11/2006	214	216	2006	11	5	2006	309	3	2003	23.7957	high
F	05/11/2006	170	170	2006	11	5	2006	309	3	2003	21.0000	high
F	05/11/2006	142	144	2006	11	5	2006	309	1	2005	19.0988	high
M	05/11/2006	145	145	2006	11	5	2006	309	1	2005	18.2708	high
M	05/11/2006	170	170	2006	11	5	2006	309	1	2005	21.9529	high
M	08/11/2006	221	225	2006	11	8	2006	312	5	2001	26.2000	high
F	09/11/2006	184	186	2006	11	9	2006	313	11	1995	14.0000	low
F	09/11/2006	223	248	2006	11	9	2006	313	11	1995	22.5000	low
M	09/11/2006	220	220	2006	11	9	2006	313	4	2002	29.5142	high
M	09/11/2006	220	220	2006	11	9	2006	313	4	2002	30.5000	high
M	09/11/2006	145	150	2006	11	9	2006	313	1	2005	14.5000	high
M	09/11/2006	163	160	2006	11	9	2006	313	1	2005	17.0000	high
F	09/11/2006	128	130	2006	11	9	2006	313	1	2005	17.3510	high
F	09/11/2006	197	197	2006	11	9	2006	313	1	2005	19.0000	high
M	09/11/2006	50	40	2006	11	9	2006	313	0	2006	11.3817	high
F	11/11/2006	181	183	2006	11	11	2006	315	4	2002	19.0000	high
M	11/11/2006	176	176	2006	11	11	2006	315	1	2005	17.0000	high
M	02/12/2006	150	148	2006	12	2	2006	336	3	2003	22.8742	high
M	03/12/2006	200	198	2006	12	3	2006	337	5	2001	19.0000	high
M	03/12/2006	171	174	2006	12	3	2006	337	1	2005	17.0000	high
F	03/12/2006	138	135	2006	12	3	2006	337	1	2005	21.0319	high
M	04/12/2006	231	225	2006	12	4	2006	338	10	1996	21.3000	low
M	07/12/2006	210	207	2006	12	7	2006	341	3	2003	22.8742	high
F	07/12/2006	170	171	2006	12	7	2006	341	3	2003	19.0000	high
F	10/12/2006	199	198	2006	12	10	2006	344	5	2001	13.4848	high
M	10/12/2006	159	160	2006	12	10	2006	344	1	2005	10.2000	high
F	12/12/2006	233	224	2006	12	12	2006	346	15	1991	22.3000	low
F	12/12/2006	185	180	2006	12	12	2006	346	6	2000	20.0000	high
M	12/12/2006	205	207	2006	12	12	2006	346	5	2001	32.0000	high
F	13/12/2006	165	175	2006	12	13	2006	347	8	1998	23.0000	high
F	13/12/2006	215	213	2006	12	13	2006	347	5	2001	23.3000	high
M	13/12/2006	144	142	2006	12	13	2006	347	1	2005	15.6044	high
F	14/12/2006	160	160	2006	12	14	2006	348	5	2001	21.0000	high
F	14/12/2006	108	111	2006	12	14	2006	348	1	2005	15.6789	high
M	16/12/2006	250	245	2006	12	16	2006	350	11	1995	26.4000	low
M	16/12/2006	215	220	2006	12	16	2006	350	6	2000	24.4000	high
M	16/12/2006	218	225	2006	12	16	2006	350	5	2001	23.5000	high
F	16/12/2006	210	215	2006	12	16	2006	350	5	2001	26.5616	high
F	17/12/2006	225	230	2006	12	17	2006	351	8	1998	21.9529	high
F	20/12/2006	125	125	2006	12	20	2006	354	1	2005	18.5000	high
F	23/12/2006	205	205	2006	12	23	2006	357	9	1997	22.5000	low
M	23/12/2006	204	210	2006	12	23	2006	357	6	2000	20.2954	high
M	23/12/2006	218	220	2006	12	23	2006	357	5	2001	19.3749	high
M	23/12/2006	205	210	2006	12	23	2006	357	4	2002	22.0000	high
F	23/12/2006	189	184	2006	12	23	2006	357	3	2003	22.0000	high
F	24/12/2006	215	210	2006	12	24	2006	358	9	1997	20.5000	low
M	24/12/2006	210	210	2006	12	24	2006	358	5	2001	22.0000	high
M	24/12/2006	152	158	2006	12	24	2006	358	1	2005	11.5000	high
M	25/12/2006	150	159	2006	12	25	2006	359	1	2005	18.6000	high
F	25/12/2006	110	120	2006	12	25	2006	359	1	2005	15.1000	high
F	27/12/2006	220	225	2006	12	27	2006	361	7	1999	22.8000	high
M	27/12/2006	190	190	2006	12	27	2006	361	3	2003	11.0102	high
M	27/12/2006	205	206	2006	12	27	2006	361	3	2003	21.5000	high
M	27/12/2006	176	174	2006	12	27	2006	361	1	2005	19.0000	high
F	27/12/2006	48	49	2006	12	27	2006	361	0	2006	10.0000	high
M	28/12/2006	200	202	2006	12	28	2006	362	5	2001	20.0000	high
F	28/12/2006	181	181	2006	12	28	2006	362	3	2003	20.2000	high
F	30/12/2006	51	48	2006	12	30	2006	364	0	2006	12.4000	high
M	30/12/2006	66	67	2006	12	30	2006	364	0	2006	11.0000	high
M	31/12/2006	215	215	2006	12	31	2006	365	4	2002	22.0000	high
M	31/12/2006	160	160	2006	12	31	2006	365	1	2005	15.8000	high
F	31/12/2006	48	50	2006	12	31	2006	365	0	2006	13.0000	high
F	31/12/2006	55	60	2006	12	31	2006	365	0	2006	11.0000	high
F	31/12/2006	50	54	2006	12	31	2006	365	0	2006	12.1000	high
F	02/01/2007	202	200	2006	1	2	2007	367	7	1999	21.5000	high
F	03/01/2007	198	200	2006	1	3	2007	368	8	1998	25.6000	high
F	03/01/2007	220	225	2006	1	3	2007	368	6	2000	22.1000	high
M	03/01/2007	225	222	2006	1	3	2007	368	6	2000	24.5315	high
F	04/01/2007	173	169	2006	1	4	2007	369	3	2003	23.0489	high
M	06/01/2007	230	225	2006	1	6	2007	371	7	1999	22.0000	high
M	06/01/2007	202	212	2006	1	6	2007	371	4	2002	23.0489	high
M	06/01/2007	210	215	2006	1	6	2007	371	3	2003	27.4840	high
F	07/01/2007	190	185	2006	1	7	2007	372	5	2001	22.6000	high
F	12/01/2007	200	198	2006	1	12	2007	377	5	2001	21.7000	high
F	13/01/2007	153	154	2006	1	13	2007	378	4	2002	23.1000	high
M	13/01/2007	112	110	2006	1	13	2007	378	1	2005	16.0000	high
F	14/01/2007	223	223	2006	1	14	2007	379	8	1998	24.0000	high
M	22/01/2007	230	231	2006	1	22	2007	387	3	2003	23.0000	high
M	22/01/2007	101	98	2006	1	22	2007	387	1	2005	16.1000	high
F	23/01/2007	218	217	2006	1	23	2007	388	15	1991	17.2000	low
M	04/09/2007	206	209	2007	9	4	2007	247	3	2004	26.6000	high
M	04/09/2007	143	139	2007	9	4	2007	247	1	2006	17.3000	high
M	04/09/2007	168	171	2007	9	4	2007	247	1	2006	14.0000	high
F	06/09/2007	193	195	2007	9	6	2007	249	5	2002	22.8000	high
M	06/09/2007	217	216	2007	9	6	2007	249	4	2003	26.7000	high
M	06/09/2007	207	202	2007	9	6	2007	249	3	2004	24.7000	high
M	09/09/2007	222	221	2007	9	9	2007	252	3	2004	23.7957	high
F	10/09/2007	195	189	2007	9	10	2007	253	5	2002	22.4000	high
M	10/09/2007	218	218	2007	9	10	2007	253	4	2003	24.3000	high
M	10/09/2007	187	188	2007	9	10	2007	253	2	2005	19.7000	high
M	12/09/2007	234	230	2007	9	12	2007	255	5	2002	33.0000	high
F	13/09/2007	191	194	2007	9	13	2007	256	7	2000	14.9612	high
F	13/09/2007	156	154	2007	9	13	2007	256	4	2003	19.9000	high
F	13/09/2007	201	208	2007	9	13	2007	256	4	2003	28.7000	high
F	13/09/2007	147	147	2007	9	13	2007	256	3	2004	22.5000	high
M	13/09/2007	190	191	2007	9	13	2007	256	2	2005	17.4000	high
F	13/09/2007	159	159	2007	9	13	2007	256	2	2005	21.1000	high
F	14/09/2007	170	170	2007	9	14	2007	257	5	2002	25.3000	high
M	15/09/2007	195	195	2007	9	15	2007	258	4	2003	19.7431	high
F	15/09/2007	191	192	2007	9	15	2007	258	4	2003	18.6388	high
M	16/09/2007	220	225	2007	9	16	2007	259	5	2002	25.0000	high
F	18/09/2007	190	187	2007	9	18	2007	261	4	2003	21.0000	high
M	19/09/2007	198	200	2007	9	19	2007	262	3	2004	22.0000	high
M	20/09/2007	214	212	2007	9	20	2007	263	9	1998	29.6000	high
M	20/09/2007	225	228	2007	9	20	2007	263	8	1999	27.0000	high
M	20/09/2007	212	224	2007	9	20	2007	263	7	2000	27.8000	high
M	20/09/2007	253	251	2007	9	20	2007	263	3	2004	24.2000	high
F	22/09/2007	138	140	2007	9	22	2007	265	1	2006	19.5000	high
M	22/09/2007	165	155	2007	9	22	2007	265	1	2006	15.5125	high
M	23/09/2007	243	238	2007	9	23	2007	266	6	2001	32.4000	high
M	23/09/2007	242	241	2007	9	23	2007	266	6	2001	21.0000	high
M	23/09/2007	110	110	2007	9	23	2007	266	1	2006	11.5000	high
M	24/09/2007	229	230	2007	9	24	2007	267	9	1998	32.4000	high
M	24/09/2007	230	225	2007	9	24	2007	267	3	2004	29.0000	high
F	24/09/2007	190	192	2007	9	24	2007	267	3	2004	18.7000	high
M	25/09/2007	227	238	2007	9	25	2007	268	13	1994	25.6000	low
M	25/09/2007	235	235	2007	9	25	2007	268	4	2003	27.3000	high
M	25/09/2007	201	190	2007	9	25	2007	268	2	2005	31.0000	high
M	28/09/2007	149	149	2007	9	28	2007	271	1	2006	21.0000	high
M	29/09/2007	213	216	2007	9	29	2007	272	6	2001	34.0000	high
M	29/09/2007	216	214	2007	9	29	2007	272	2	2005	24.4000	high
F	30/09/2007	245	245	2007	9	30	2007	273	7	2000	25.0000	high
F	30/09/2007	134	135	2007	9	30	2007	273	1	2006	15.8801	high
M	03/10/2007	232	235	2007	10	3	2007	276	6	2001	28.6000	high
M	03/10/2007	192	192	2007	10	3	2007	276	2	2005	20.1113	high
M	04/10/2007	230	230	2007	10	4	2007	277	3	2004	31.0000	high
F	06/10/2007	225	226	2007	10	6	2007	279	7	2000	29.3296	high
M	06/10/2007	245	245	2007	10	6	2007	279	6	2001	28.0000	high
M	07/10/2007	142	145	2007	10	7	2007	280	1	2006	16.4316	high
M	08/10/2007	226	223	2007	10	8	2007	281	6	2001	29.8000	high
M	08/10/2007	213	210	2007	10	8	2007	281	3	2004	25.1000	high
F	08/10/2007	216	213	2007	10	8	2007	281	3	2004	26.9000	high
M	08/10/2007	205	205	2007	10	8	2007	281	2	2005	23.1000	high
M	09/10/2007	215	212	2007	10	9	2007	282	4	2003	28.0000	high
M	10/10/2007	232	231	2007	10	10	2007	283	3	2004	30.0000	high
M	10/10/2007	154	155	2007	10	10	2007	283	1	2006	18.1788	high
F	12/10/2007	220	230	2007	10	12	2007	285	7	2000	23.1000	high
F	12/10/2007	136	134	2007	10	12	2007	285	1	2006	18.1000	high
F	12/10/2007	140	140	2007	10	12	2007	285	1	2006	20.0000	high
M	12/10/2007	108	104	2007	10	12	2007	285	1	2006	16.3000	high
M	12/10/2007	40	42	2007	10	12	2007	285	0	2007	11.3000	high
M	12/10/2007	35	30	2007	10	12	2007	285	0	2007	9.8000	high
M	12/10/2007	50	50	2007	10	12	2007	285	0	2007	13.2000	high
F	12/10/2007	36	38	2007	10	12	2007	285	0	2007	11.0000	high
M	12/10/2007	47	49	2007	10	12	2007	285	0	2007	12.4000	high
M	13/10/2007	255	252	2007	10	13	2007	286	11	1996	31.0000	low
M	13/10/2007	210	210	2007	10	13	2007	286	5	2002	28.0000	high
M	13/10/2007	226	223	2007	10	13	2007	286	4	2003	26.0000	high
F	13/10/2007	175	175	2007	10	13	2007	286	4	2003	22.0000	high
M	13/10/2007	230	220	2007	10	13	2007	286	4	2003	25.6394	high
F	13/10/2007	135	139	2007	10	13	2007	286	1	2006	17.1000	high
M	13/10/2007	160	160	2007	10	13	2007	286	1	2006	14.0000	high
M	14/10/2007	240	240	2007	10	14	2007	287	6	2001	24.6000	high
F	14/10/2007	187	184	2007	10	14	2007	287	5	2002	19.0000	high
F	14/10/2007	186	188	2007	10	14	2007	287	3	2004	22.1371	high
F	14/10/2007	142	142	2007	10	14	2007	287	2	2005	14.9612	high
M	14/10/2007	138	140	2007	10	14	2007	287	1	2006	18.5000	high
M	14/10/2007	154	156	2007	10	14	2007	287	1	2006	17.3510	high
F	16/10/2007	190	196	2007	10	16	2007	289	11	1996	19.8000	low
M	16/10/2007	208	214	2007	10	16	2007	289	2	2005	25.8000	high
F	16/10/2007	107	107	2007	10	16	2007	289	1	2006	13.9000	high
M	17/10/2007	192	191	2007	10	17	2007	290	5	2002	22.9663	high
F	17/10/2007	184	187	2007	10	17	2007	290	5	2002	23.6000	high
F	17/10/2007	165	166	2007	10	17	2007	290	4	2003	12.1154	high
M	17/10/2007	175	172	2007	10	17	2007	290	1	2006	17.0000	high
M	18/10/2007	29	30	2007	10	18	2007	291	0	2007	13.4000	high
M	19/10/2007	235	248	2007	10	19	2007	292	8	1999	30.2000	high
F	19/10/2007	199	202	2007	10	19	2007	292	5	2002	23.2000	high
M	20/10/2007	202	200	2007	10	20	2007	293	11	1996	30.8066	low
M	20/10/2007	235	235	2007	10	20	2007	293	4	2003	27.0000	high
F	20/10/2007	164	164	2007	10	20	2007	293	4	2003	28.4067	high
M	21/10/2007	216	216	2007	10	21	2007	294	4	2003	31.8000	high
M	21/10/2007	145	145	2007	10	21	2007	294	1	2006	20.1113	high
M	22/10/2007	212	216	2007	10	22	2007	295	3	2004	29.5000	high
M	22/10/2007	200	215	2007	10	22	2007	295	2	2005	26.5000	high
M	22/10/2007	176	174	2007	10	22	2007	295	1	2006	18.9000	high
F	23/10/2007	218	217	2007	10	23	2007	296	7	2000	24.1000	high
M	23/10/2007	145	142	2007	10	23	2007	296	1	2006	13.1000	high
F	25/10/2007	193	195	2007	10	25	2007	298	12	1995	20.7000	low
M	27/10/2007	231	231	2007	10	27	2007	300	4	2003	27.1000	high
M	27/10/2007	173	169	2007	10	27	2007	300	2	2005	21.0000	high
M	27/10/2007	160	162	2007	10	27	2007	300	1	2006	22.5000	high
F	28/10/2007	197	194	2007	10	28	2007	301	4	2003	25.0000	high
F	29/10/2007	200	210	2007	10	29	2007	302	10	1997	22.1000	low
M	29/10/2007	226	231	2007	10	29	2007	302	6	2001	29.0000	high
F	29/10/2007	98	100	2007	10	29	2007	302	1	2006	14.7000	high
M	31/10/2007	185	190	2007	10	31	2007	304	4	2003	23.7000	high
M	31/10/2007	206	207	2007	10	31	2007	304	2	2005	24.2000	high
M	01/11/2007	208	211	2007	11	1	2007	305	5	2002	30.0000	high
F	02/11/2007	200	200	2007	11	2	2007	306	10	1997	23.0000	low
M	03/11/2007	219	218	2007	11	3	2007	307	5	2002	29.8000	high
M	03/11/2007	216	215	2007	11	3	2007	307	5	2002	29.6988	high
M	03/11/2007	207	210	2007	11	3	2007	307	5	2002	24.5330	high
M	03/11/2007	220	225	2007	11	3	2007	307	3	2004	27.5000	high
F	03/11/2007	134	132	2007	11	3	2007	307	1	2006	16.9832	high
M	04/11/2007	236	241	2007	11	4	2007	308	5	2002	27.3000	high
F	04/11/2007	147	152	2007	11	4	2007	308	1	2006	18.5000	high
M	04/11/2007	158	156	2007	11	4	2007	308	1	2006	15.6963	high
F	06/11/2007	145	147	2007	11	6	2007	310	1	2006	19.0000	high
F	07/11/2007	223	220	2007	11	7	2007	311	9	1998	24.0000	high
M	07/11/2007	237	237	2007	11	7	2007	311	9	1998	29.0527	high
M	07/11/2007	237	237	2007	11	7	2007	311	9	1998	31.7000	high
F	07/11/2007	194	192	2007	11	7	2007	311	8	1999	20.3874	high
M	07/11/2007	223	222	2007	11	7	2007	311	4	2003	22.7000	high
M	07/11/2007	179	181	2007	11	7	2007	311	1	2006	16.2000	high
M	08/11/2007	230	222	2007	11	8	2007	312	7	2000	28.0000	high
M	08/11/2007	30	30	2007	11	8	2007	312	0	2007	10.2000	high
M	08/11/2007	40	40	2007	11	8	2007	312	0	2007	9.0000	high
M	11/11/2007	183	182	2007	11	11	2007	315	2	2005	15.5125	high
F	27/11/2007	171	172	2007	11	27	2007	331	5	2002	24.0000	high
M	01/12/2007	242	243	2007	12	1	2007	335	10	1997	27.5040	low
F	01/12/2007	183	186	2007	12	1	2007	335	8	1999	20.3874	high
F	01/12/2007	218	220	2007	12	1	2007	335	8	1999	22.5000	high
M	01/12/2007	291	290	2007	12	1	2007	335	7	2000	31.1759	high
F	01/12/2007	195	183	2007	12	1	2007	335	6	2001	15.0531	high
M	02/12/2007	263	263	2007	12	2	2007	336	8	1999	20.0000	high
F	02/12/2007	230	225	2007	12	2	2007	336	7	2000	25.1000	high
M	02/12/2007	260	250	2007	12	2	2007	336	6	2001	27.4840	high
M	02/12/2007	220	222	2007	12	2	2007	336	6	2001	22.5000	high
M	02/12/2007	140	140	2007	12	2	2007	336	1	2006	15.8000	high
F	02/12/2007	138	138	2007	12	2	2007	336	1	2006	13.5000	high
F	03/12/2007	121	120	2007	12	3	2007	337	1	2006	9.5000	high
F	05/12/2007	210	210	2007	12	5	2007	339	4	2003	31.0000	high
M	05/12/2007	170	171	2007	12	5	2007	339	1	2006	14.5938	high
F	05/12/2007	27	28	2007	12	5	2007	339	0	2007	9.0000	high
F	06/12/2007	210	220	2007	12	6	2007	340	4	2003	28.0000	high
M	06/12/2007	221	223	2007	12	6	2007	340	4	2003	23.9800	high
F	08/12/2007	223	224	2007	12	8	2007	342	8	1999	24.5000	high
F	08/12/2007	40	40	2007	12	8	2007	342	0	2007	10.5000	high
F	09/12/2007	195	205	2007	12	9	2007	343	13	1994	23.7957	low
M	09/12/2007	250	250	2007	12	9	2007	343	6	2001	29.3296	high
F	09/12/2007	20	20	2007	12	9	2007	343	0	2007	11.6568	high
F	12/12/2007	210	212	2007	12	12	2007	346	8	1999	20.5716	high
F	12/12/2007	170	170	2007	12	12	2007	346	7	2000	27.2000	high
F	13/12/2007	181	179	2007	12	13	2007	347	7	2000	21.5689	high
F	15/12/2007	205	202	2007	12	15	2007	349	10	1997	21.0000	low
M	15/12/2007	230	230	2007	12	15	2007	349	8	1999	22.8742	high
M	15/12/2007	178	179	2007	12	15	2007	349	1	2006	13.0000	high
M	16/12/2007	228	232	2007	12	16	2007	350	9	1998	22.0000	high
M	16/12/2007	252	252	2007	12	16	2007	350	9	1998	21.2161	high
M	16/12/2007	252	252	2007	12	16	2007	350	9	1998	21.2161	high
F	16/12/2007	210	210	2007	12	16	2007	350	8	1999	23.6000	high
M	16/12/2007	170	170	2007	12	16	2007	350	1	2006	14.0000	high
F	20/12/2007	220	220	2007	12	20	2007	354	7	2000	21.0000	high
F	20/12/2007	208	205	2007	12	20	2007	354	5	2002	17.8108	high
M	20/12/2007	50	52	2007	12	20	2007	354	0	2007	9.0000	high
F	22/12/2007	181	181	2007	12	22	2007	356	6	2001	22.2000	high
M	22/12/2007	218	216	2007	12	22	2007	356	3	2004	20.0000	high
M	23/12/2007	244	243	2007	12	23	2007	357	14	1993	19.1909	low
M	23/12/2007	242	246	2007	12	23	2007	357	6	2001	24.0000	high
M	23/12/2007	240	240	2007	12	23	2007	357	5	2002	25.0000	high
F	25/12/2007	195	195	2007	12	25	2007	359	4	2003	23.5000	high
F	27/12/2007	210	215	2007	12	27	2007	361	7	2000	22.8742	high
F	27/12/2007	135	135	2007	12	27	2007	361	1	2006	13.5000	high
M	27/12/2007	110	125	2007	12	27	2007	361	1	2006	18.6000	high
F	29/12/2007	200	200	2007	12	29	2007	363	5	2002	19.1909	high
F	29/12/2007	144	145	2007	12	29	2007	363	1	2006	13.0000	high
F	30/12/2007	160	155	2007	12	30	2007	364	3	2004	22.0000	high
M	02/01/2008	212	215	2007	1	2	2008	367	4	2003	23.0000	high
M	03/01/2008	204	212	2007	1	3	2008	368	4	2003	22.8000	high
M	03/01/2008	210	204	2007	1	3	2008	368	4	2003	24.5000	high
F	03/01/2008	120	125	2007	1	3	2008	368	1	2006	16.0000	high
F	03/01/2008	130	135	2007	1	3	2008	368	1	2006	15.3000	high
M	03/01/2008	65	65	2007	1	3	2008	368	0	2007	9.0000	high
M	05/01/2008	235	235	2007	1	5	2008	370	6	2001	24.0000	high
F	05/01/2008	195	198	2007	1	5	2008	370	5	2002	21.0319	high
F	05/01/2008	218	214	2007	1	5	2008	370	5	2002	25.0000	high
M	05/01/2008	162	162	2007	1	5	2008	370	4	2003	25.6000	high
M	05/01/2008	145	140	2007	1	5	2008	370	1	2006	19.1000	high
M	06/01/2008	200	200	2007	1	6	2008	371	5	2002	23.0000	high
F	06/01/2008	169	170	2007	1	6	2008	371	4	2003	16.1000	high
M	06/01/2008	225	225	2007	1	6	2008	371	4	2003	22.8742	high
F	08/01/2008	198	192	2007	1	8	2008	373	5	2002	14.2000	high
M	08/01/2008	237	236	2007	1	8	2008	373	3	2004	20.5000	high
F	09/01/2008	200	198	2007	1	9	2008	374	5	2002	22.4135	high
F	10/01/2008	198	195	2007	1	10	2008	375	10	1997	22.0000	low
F	10/01/2008	187	188	2007	1	10	2008	375	5	2002	24.3000	high
F	10/01/2008	215	213	2007	1	10	2008	375	5	2002	19.1909	high
F	10/01/2008	190	183	2007	1	10	2008	375	4	2003	21.9529	high
F	12/01/2008	202	202	2007	1	12	2008	377	5	2002	20.4000	high
M	13/01/2008	112	110	2007	1	13	2008	378	1	2006	16.0000	high
F	02/09/2008	200	207	2008	9	2	2008	245	11	1997	22.5000	low
F	02/09/2008	177	181	2008	9	2	2008	245	8	2000	20.3000	high
F	02/09/2008	180	183	2008	9	2	2008	245	8	2000	17.8000	high
M	02/09/2008	170	165	2008	9	2	2008	245	1	2007	17.6269	high
M	02/09/2008	154	155	2008	9	2	2008	245	1	2007	14.0000	high
F	02/09/2008	112	114	2008	9	2	2008	245	1	2007	16.4000	high
F	04/09/2008	215	213	2008	9	4	2008	247	11	1997	22.3000	low
F	04/09/2008	186	188	2008	9	4	2008	247	7	2001	22.0000	high
M	04/09/2008	241	246	2008	9	4	2008	247	7	2001	30.6000	high
F	04/09/2008	182	180	2008	9	4	2008	247	3	2005	18.3000	high
F	04/09/2008	173	170	2008	9	4	2008	247	3	2005	19.9000	high
F	08/09/2008	206	210	2008	9	8	2008	251	7	2001	20.3000	high
M	09/09/2008	225	226	2008	9	9	2008	252	3	2005	25.5000	high
F	09/09/2008	136	134	2008	9	9	2008	252	2	2006	17.5000	high
F	09/09/2008	168	171	2008	9	9	2008	252	2	2006	18.0000	high
M	09/09/2008	150	151	2008	9	9	2008	252	1	2007	16.2000	high
M	13/09/2008	240	248	2008	9	13	2008	256	4	2004	14.5000	high
M	14/09/2008	139	146	2008	9	14	2008	257	1	2007	15.5000	high
M	16/09/2008	212	210	2008	9	16	2008	259	6	2002	25.5000	high
F	16/09/2008	196	198	2008	9	16	2008	259	4	2004	20.4000	high
F	16/09/2008	176	179	2008	9	16	2008	259	4	2004	23.0000	high
F	16/09/2008	191	188	2008	9	16	2008	259	3	2005	21.9000	high
M	16/09/2008	196	197	2008	9	16	2008	259	2	2006	19.4000	high
F	16/09/2008	106	105	2008	9	16	2008	259	1	2007	13.5000	high
F	17/09/2008	218	219	2008	9	17	2008	260	10	1998	26.5616	high
F	17/09/2008	211	212	2008	9	17	2008	260	5	2003	25.4000	high
M	18/09/2008	210	210	2008	9	18	2008	261	7	2001	22.3085	high
M	18/09/2008	238	238	2008	9	18	2008	261	5	2003	25.8000	high
M	18/09/2008	225	225	2008	9	18	2008	261	4	2004	25.0000	high
F	18/09/2008	190	186	2008	9	18	2008	261	4	2004	21.0000	high
F	19/09/2008	193	192	2008	9	19	2008	262	7	2001	22.6000	high
F	19/09/2008	217	217	2008	9	19	2008	262	6	2002	20.1000	high
M	20/09/2008	260	261	2008	9	20	2008	263	11	1997	28.2222	low
M	20/09/2008	205	205	2008	9	20	2008	263	3	2005	25.8000	high
M	20/09/2008	191	200	2008	9	20	2008	263	3	2005	22.7820	high
M	20/09/2008	150	150	2008	9	20	2008	263	1	2007	13.0000	high
F	21/09/2008	160	162	2008	9	21	2008	264	3	2005	24.0000	high
F	22/09/2008	188	184	2008	9	22	2008	265	5	2003	17.7000	high
F	22/09/2008	158	160	2008	9	22	2008	265	1	2007	15.5000	high
M	23/09/2008	220	220	2008	9	23	2008	266	8	2000	29.0000	high
F	26/09/2008	192	193	2008	9	26	2008	269	7	2001	21.5000	high
M	26/09/2008	232	227	2008	9	26	2008	269	4	2004	27.2000	high
F	26/09/2008	174	168	2008	9	26	2008	269	4	2004	19.5590	high
F	27/09/2008	198	197	2008	9	27	2008	270	5	2003	19.1909	high
M	27/09/2008	220	220	2008	9	27	2008	270	4	2004	28.0000	high
F	28/09/2008	195	195	2008	9	28	2008	271	9	1999	24.7174	high
M	28/09/2008	290	280	2008	9	28	2008	271	8	2000	43.0000	high
M	28/09/2008	210	215	2008	9	28	2008	271	5	2003	26.0000	high
F	29/09/2008	190	193	2008	9	29	2008	272	8	2000	28.0000	high
M	01/10/2008	205	208	2008	10	1	2008	274	6	2002	23.3349	high
M	01/10/2008	187	190	2008	10	1	2008	274	3	2005	24.9000	high
M	01/10/2008	190	190	2008	10	1	2008	274	3	2005	20.1113	high
M	01/10/2008	143	142	2008	10	1	2008	274	1	2007	17.4000	high
F	02/10/2008	184	184	2008	10	2	2008	275	5	2003	14.6857	high
F	03/10/2008	174	176	2008	10	3	2008	276	7	2001	23.4270	high
F	03/10/2008	185	185	2008	10	3	2008	276	6	2002	21.4000	high
F	03/10/2008	170	170	2008	10	3	2008	276	5	2003	17.8108	high
F	05/10/2008	200	195	2008	10	5	2008	278	7	2001	24.0000	high
F	05/10/2008	156	155	2008	10	5	2008	278	5	2003	20.1113	high
F	05/10/2008	180	181	2008	10	5	2008	278	2	2006	19.2000	high
F	07/10/2008	155	155	2008	10	7	2008	280	3	2005	19.0000	high
M	08/10/2008	215	215	2008	10	8	2008	281	6	2002	29.7911	high
M	08/10/2008	206	199	2008	10	8	2008	281	6	2002	29.3296	high
F	09/10/2008	126	127	2008	10	9	2008	282	1	2007	17.6000	high
F	09/10/2008	126	127	2008	10	9	2008	282	1	2007	17.6000	high
F	10/10/2008	200	198	2008	10	10	2008	283	11	1997	18.5000	low
F	10/10/2008	195	195	2008	10	10	2008	283	6	2002	23.8000	high
F	10/10/2008	114	113	2008	10	10	2008	283	1	2007	17.1000	high
F	11/10/2008	200	200	2008	10	11	2008	284	8	2000	21.0000	high
M	11/10/2008	129	128	2008	10	11	2008	284	1	2007	11.0000	high
M	12/10/2008	220	219	2008	10	12	2008	285	5	2003	30.0000	high
F	12/10/2008	182	180	2008	10	12	2008	285	4	2004	22.0000	high
F	12/10/2008	180	182	2008	10	12	2008	285	3	2005	23.0000	high
M	12/10/2008	160	160	2008	10	12	2008	285	1	2007	20.2000	high
F	14/10/2008	208	214	2008	10	14	2008	287	5	2003	21.5000	high
F	14/10/2008	210	205	2008	10	14	2008	287	4	2004	21.8000	high
M	15/10/2008	221	223	2008	10	15	2008	288	9	1999	27.2000	high
M	15/10/2008	224	220	2008	10	15	2008	288	6	2002	30.6219	high
F	15/10/2008	179	179	2008	10	15	2008	288	3	2005	21.2000	high
M	15/10/2008	195	195	2008	10	15	2008	288	2	2006	20.0000	high
F	16/10/2008	217	217	2008	10	16	2008	289	7	2001	21.5000	high
F	16/10/2008	196	191	2008	10	16	2008	289	2	2006	24.1000	high
F	16/10/2008	164	166	2008	10	16	2008	289	2	2006	21.1000	high
M	16/10/2008	156	162	2008	10	16	2008	289	1	2007	20.0000	high
M	16/10/2008	160	161	2008	10	16	2008	289	1	2007	16.6000	high
M	16/10/2008	152	154	2008	10	16	2008	289	1	2007	13.9000	high
M	16/10/2008	132	132	2008	10	16	2008	289	1	2007	12.5000	high
M	17/10/2008	136	135	2008	10	17	2008	290	1	2007	16.3000	high
M	17/10/2008	131	131	2008	10	17	2008	290	1	2007	14.7000	high
M	18/10/2008	220	221	2008	10	18	2008	291	6	2002	25.6394	high
F	18/10/2008	180	185	2008	10	18	2008	291	4	2004	25.1000	high
F	19/10/2008	185	180	2008	10	19	2008	292	5	2003	21.0000	high
M	19/10/2008	238	238	2008	10	19	2008	292	5	2003	29.5000	high
F	19/10/2008	20	20	2008	10	19	2008	292	0	2008	9.0000	high
F	20/10/2008	220	212	2008	10	20	2008	293	9	1999	24.0000	high
M	20/10/2008	175	175	2008	10	20	2008	293	1	2007	16.5000	high
M	21/10/2008	237	236	2008	10	21	2008	294	6	2002	26.7000	high
M	21/10/2008	228	229	2008	10	21	2008	294	3	2005	26.0000	high
M	23/10/2008	237	237	2008	10	23	2008	296	6	2002	27.5000	high
F	24/10/2008	213	214	2008	10	24	2008	297	10	1998	24.6000	high
F	24/10/2008	208	205	2008	10	24	2008	297	10	1998	21.0000	high
F	24/10/2008	190	193	2008	10	24	2008	297	4	2004	24.1000	high
M	25/10/2008	230	235	2008	10	25	2008	298	11	1997	25.0000	low
F	25/10/2008	220	220	2008	10	25	2008	298	8	2000	20.0000	high
F	25/10/2008	187	189	2008	10	25	2008	298	6	2002	25.0000	high
M	25/10/2008	217	217	2008	10	25	2008	298	5	2003	25.5000	high
F	25/10/2008	182	182	2008	10	25	2008	298	5	2003	22.8000	high
M	25/10/2008	237	230	2008	10	25	2008	298	5	2003	24.0000	high
F	25/10/2008	150	150	2008	10	25	2008	298	3	2005	23.0000	high
M	26/10/2008	230	240	2008	10	26	2008	299	9	1999	32.0000	high
M	26/10/2008	145	146	2008	10	26	2008	299	1	2007	15.0000	high
M	26/10/2008	32	33	2008	10	26	2008	299	0	2008	11.0000	high
F	29/10/2008	196	197	2008	10	29	2008	302	6	2002	24.2000	high
F	29/10/2008	187	184	2008	10	29	2008	302	5	2003	18.4548	high
F	31/10/2008	198	203	2008	10	31	2008	304	6	2002	20.5716	high
F	01/11/2008	185	190	2008	11	1	2008	305	13	1995	19.0000	low
M	01/11/2008	216	218	2008	11	1	2008	305	6	2002	25.2706	high
M	01/11/2008	204	209	2008	11	1	2008	305	5	2003	23.0584	high
M	01/11/2008	220	220	2008	11	1	2008	305	3	2005	22.0000	high
M	01/11/2008	125	124	2008	11	1	2008	305	1	2007	18.0000	high
M	02/11/2008	224	221	2008	11	2	2008	306	13	1995	24.0864	low
M	02/11/2008	235	238	2008	11	2	2008	306	9	1999	27.4840	high
F	02/11/2008	220	220	2008	11	2	2008	306	5	2003	22.0000	high
M	04/11/2008	35	32	2008	11	4	2008	308	0	2008	15.0000	high
M	05/11/2008	225	225	2008	11	5	2008	309	4	2004	26.9306	high
M	05/11/2008	225	225	2008	11	5	2008	309	4	2004	26.9306	high
F	06/11/2008	182	188	2008	11	6	2008	310	4	2004	21.5000	high
F	06/11/2008	120	120	2008	11	6	2008	310	1	2007	17.0000	high
M	08/11/2008	230	230	2008	11	8	2008	312	4	2004	30.0000	high
F	08/11/2008	143	144	2008	11	8	2008	312	1	2007	14.2000	high
F	08/11/2008	140	144	2008	11	8	2008	312	1	2007	15.5000	high
F	08/11/2008	110	112	2008	11	8	2008	312	1	2007	13.8591	high
M	09/11/2008	232	235	2008	11	9	2008	313	6	2002	26.1005	high
M	09/11/2008	235	238	2008	11	9	2008	313	5	2003	30.0000	high
M	09/11/2008	178	175	2008	11	9	2008	313	1	2007	18.6000	high
F	11/11/2008	220	215	2008	11	11	2008	315	6	2002	24.5000	high
M	11/11/2008	220	221	2008	11	11	2008	315	5	2003	25.8238	high
M	11/11/2008	230	220	2008	11	11	2008	315	5	2003	24.0000	high
F	11/11/2008	150	150	2008	11	11	2008	315	2	2006	18.0000	high
F	11/11/2008	200	205	2008	11	11	2008	315	2	2006	27.5763	high
M	11/11/2008	180	185	2008	11	11	2008	315	2	2006	19.0000	high
M	01/12/2008	213	213	2008	12	1	2008	335	5	2003	23.5000	high
F	02/12/2008	207	208	2008	12	2	2008	336	5	2003	23.5000	high
M	02/12/2008	225	225	2008	12	2	2008	336	3	2005	21.2161	high
F	03/12/2008	221	224	2008	12	3	2008	337	13	1995	21.4000	low
M	03/12/2008	214	223	2008	12	3	2008	337	5	2003	29.5000	high
M	03/12/2008	167	166	2008	12	3	2008	337	1	2007	18.1000	high
F	04/12/2008	240	238	2008	12	4	2008	338	11	1997	18.5000	low
F	04/12/2008	200	195	2008	12	4	2008	338	4	2004	20.2954	high
F	10/12/2008	185	182	2008	12	10	2008	344	5	2003	21.5000	high
F	10/12/2008	192	192	2008	12	10	2008	344	4	2004	23.0000	high
M	10/12/2008	180	183	2008	12	10	2008	344	1	2007	18.2000	high
F	11/12/2008	208	207	2008	12	11	2008	345	4	2004	24.5000	high
M	13/12/2008	213	213	2008	12	13	2008	347	5	2003	23.2000	high
F	13/12/2008	193	192	2008	12	13	2008	347	4	2004	20.4607	high
F	14/12/2008	214	212	2008	12	14	2008	348	11	1997	29.0000	low
F	14/12/2008	207	180	2008	12	14	2008	348	7	2001	21.0000	high
M	14/12/2008	220	223	2008	12	14	2008	348	5	2003	20.2000	high
F	14/12/2008	129	131	2008	12	14	2008	348	1	2007	17.0000	high
F	20/12/2008	193	193	2008	12	20	2008	354	7	2001	18.2708	high
F	20/12/2008	208	210	2008	12	20	2008	354	6	2002	24.0000	high
M	20/12/2008	198	200	2008	12	20	2008	354	5	2003	21.0319	high
M	20/12/2008	212	213	2008	12	20	2008	354	3	2005	18.4000	high
M	20/12/2008	117	180	2008	12	20	2008	354	2	2006	18.5000	high
M	21/12/2008	135	135	2008	12	21	2008	355	1	2007	13.1000	high
M	24/12/2008	220	220	2008	12	24	2008	358	9	1999	24.7174	high
M	24/12/2008	223	223	2008	12	24	2008	358	6	2002	21.9529	high
F	24/12/2008	140	145	2008	12	24	2008	358	1	2007	14.1000	high
F	27/12/2008	183	192	2008	12	27	2008	361	6	2002	23.6000	high
M	27/12/2008	195	200	2008	12	27	2008	361	6	2002	23.0000	high
M	27/12/2008	138	138	2008	12	27	2008	361	1	2007	17.5000	high
M	28/12/2008	149	149	2008	12	28	2008	362	1	2007	15.0000	high
F	28/12/2008	38	38	2008	12	28	2008	362	0	2008	13.0000	high
F	01/01/2009	212	212	2008	1	1	2009	366	5	2003	22.1000	high
F	03/01/2009	195	192	2008	1	3	2009	368	5	2003	21.5689	high
M	08/01/2009	210	215	2008	1	8	2009	373	3	2005	17.0000	high
F	10/01/2009	210	210	2008	1	10	2009	375	15	1993	19.0000	low
F	10/01/2009	201	199	2008	1	10	2009	375	9	1999	18.1000	high
F	10/01/2009	188	191	2008	1	10	2009	375	8	2000	24.0000	high
M	10/01/2009	205	205	2008	1	10	2009	375	2	2006	20.7000	high
M	10/01/2009	225	220	2008	1	10	2009	375	2	2006	24.0000	high
F	10/01/2009	110	110	2008	1	10	2009	375	1	2007	13.7000	high
M	11/01/2009	212	212	2008	1	11	2009	376	5	2003	19.0000	high
M	11/01/2009	207	209	2008	1	11	2009	376	5	2003	24.0000	high
M	11/01/2009	207	209	2008	1	11	2009	376	5	2003	24.0000	high
M	11/01/2009	220	220	2008	1	11	2009	376	4	2004	24.0000	high
F	11/01/2009	170	170	2008	1	11	2009	376	3	2005	21.0000	high
M	11/01/2009	240	238	2008	1	11	2009	376	3	2005	21.0000	high
M	11/01/2009	117	117	2008	1	11	2009	376	1	2007	14.5000	high
F	11/01/2009	175	175	2008	1	11	2009	376	1	2007	15.8000	high
F	14/01/2009	120	121	2008	1	14	2009	379	1	2007	14.8000	high
M	15/01/2009	215	210	2008	1	15	2009	380	7	2001	19.0000	high
F	17/01/2009	195	195	2008	1	17	2009	382	8	2000	24.0000	high
F	17/01/2009	162	162	2008	1	17	2009	382	1	2007	15.1000	high
M	17/01/2009	150	145	2008	1	17	2009	382	1	2007	17.6000	high
F	18/01/2009	210	213	2008	1	18	2009	383	12	1996	24.5330	low
M	18/01/2009	210	210	2008	1	18	2009	383	3	2005	24.7000	high
M	18/01/2009	148	150	2008	1	18	2009	383	1	2007	15.0531	high
M	01/09/2009	186	185	2009	9	1	2009	244	2	2007	16.2000	high
F	01/09/2009	90	90	2009	9	1	2009	244	1	2008	14.2000	high
M	01/09/2009	146	140	2009	9	1	2009	244	1	2008	15.4000	high
F	01/09/2009	98	100	2009	9	1	2009	244	1	2008	13.4000	high
M	01/09/2009	30	30	2009	9	1	2009	244	0	2009	10.4000	high
M	01/09/2009	17	16	2009	9	1	2009	244	0	2009	9.4000	high
F	03/09/2009	176	180	2009	9	3	2009	246	5	2004	20.4000	high
F	03/09/2009	181	182	2009	9	3	2009	246	5	2004	19.2000	high
F	03/09/2009	203	203	2009	9	3	2009	246	5	2004	19.9000	high
M	03/09/2009	223	222	2009	9	3	2009	246	4	2005	19.5000	high
M	03/09/2009	210	207	2009	9	3	2009	246	2	2007	24.5000	high
F	03/09/2009	78	79	2009	9	3	2009	246	0	2009	9.1000	high
F	04/09/2009	204	207	2009	9	4	2009	247	9	2000	24.2104	high
F	04/09/2009	217	205	2009	9	4	2009	247	6	2003	23.2500	high
F	04/09/2009	192	193	2009	9	4	2009	247	5	2004	22.0000	high
F	04/09/2009	199	202	2009	9	4	2009	247	4	2005	17.3000	high
F	04/09/2009	159	154	2009	9	4	2009	247	2	2007	14.1500	high
F	07/09/2009	182	180	2009	9	7	2009	250	6	2003	21.3000	high
F	07/09/2009	180	188	2009	9	7	2009	250	5	2004	17.7189	high
M	08/09/2009	229	226	2009	9	8	2009	251	13	1996	25.2000	low
F	08/09/2009	184	189	2009	9	8	2009	251	5	2004	21.0000	high
F	11/09/2009	211	208	2009	9	11	2009	254	10	1999	24.2500	high
F	11/09/2009	210	208	2009	9	11	2009	254	7	2002	21.5000	high
F	11/09/2009	198	189	2009	9	11	2009	254	7	2002	18.2000	high
F	11/09/2009	182	178	2009	9	11	2009	254	4	2005	20.7000	high
F	11/09/2009	107	105	2009	9	11	2009	254	1	2008	12.5500	high
M	13/09/2009	228	230	2009	9	13	2009	256	7	2002	28.9000	high
M	13/09/2009	202	202	2009	9	13	2009	256	6	2003	28.4990	high
M	13/09/2009	231	230	2009	9	13	2009	256	6	2003	28.7758	high
M	13/09/2009	192	198	2009	9	13	2009	256	3	2006	22.0000	high
F	13/09/2009	31	30	2009	9	13	2009	256	0	2009	10.1000	high
F	15/09/2009	210	205	2009	9	15	2009	258	3	2006	16.3000	high
M	15/09/2009	155	158	2009	9	15	2009	258	1	2008	19.4500	high
F	15/09/2009	130	133	2009	9	15	2009	258	1	2008	18.2000	high
M	15/09/2009	145	148	2009	9	15	2009	258	1	2008	16.6500	high
M	16/09/2009	210	210	2009	9	16	2009	259	3	2006	26.0000	high
M	16/09/2009	122	126	2009	9	16	2009	259	1	2008	17.4000	high
F	17/09/2009	213	210	2009	9	17	2009	260	8	2001	18.7500	high
M	17/09/2009	220	220	2009	9	17	2009	260	7	2002	28.0000	high
F	17/09/2009	188	190	2009	9	17	2009	260	7	2002	23.0500	high
F	17/09/2009	205	200	2009	9	17	2009	260	6	2003	24.3000	high
M	17/09/2009	231	231	2009	9	17	2009	260	5	2004	27.8500	high
F	17/09/2009	135	134	2009	9	17	2009	260	1	2008	15.0000	high
F	17/09/2009	111	109	2009	9	17	2009	260	1	2008	14.7775	high
M	17/09/2009	33	34	2009	9	17	2009	260	0	2009	11.2500	high
M	17/09/2009	32	31	2009	9	17	2009	260	0	2009	10.4500	high
M	18/09/2009	204	195	2009	9	18	2009	261	4	2005	26.7500	high
F	19/09/2009	173	173	2009	9	19	2009	262	4	2005	19.0000	high
M	21/09/2009	225	230	2009	9	21	2009	264	10	1999	29.4500	high
M	22/09/2009	191	187	2009	9	22	2009	265	6	2003	26.4500	high
F	22/09/2009	202	201	2009	9	22	2009	265	3	2006	18.7500	high
M	22/09/2009	207	204	2009	9	22	2009	265	2	2007	23.0500	high
F	23/09/2009	140	137	2009	9	23	2009	266	1	2008	16.6154	high
F	25/09/2009	206	209	2009	9	25	2009	268	10	1999	17.2000	high
F	25/09/2009	187	187	2009	9	25	2009	268	7	2002	22.2000	high
F	25/09/2009	211	208	2009	9	25	2009	268	7	2002	24.2000	high
F	25/09/2009	203	206	2009	9	25	2009	268	7	2002	23.4000	high
F	25/09/2009	225	226	2009	9	25	2009	268	5	2004	22.2293	high
M	26/09/2009	234	233	2009	9	26	2009	269	2	2007	24.6000	high
M	26/09/2009	150	149	2009	9	26	2009	269	1	2008	17.8000	high
M	27/09/2009	218	219	2009	9	27	2009	270	4	2005	24.6799	high
M	28/09/2009	245	241	2009	9	28	2009	271	9	2000	32.5000	high
M	28/09/2009	228	227	2009	9	28	2009	271	3	2006	30.1000	high
F	28/09/2009	181	176	2009	9	28	2009	271	3	2006	22.7000	high
F	28/09/2009	163	161	2009	9	28	2009	271	2	2007	18.0000	high
F	28/09/2009	168	168	2009	9	28	2009	271	2	2007	21.2000	high
M	28/09/2009	107	111	2009	9	28	2009	271	1	2008	11.1500	high
F	29/09/2009	195	187	2009	9	29	2009	272	3	2006	22.0000	high
M	30/09/2009	225	225	2009	9	30	2009	273	6	2003	31.0000	high
F	30/09/2009	165	160	2009	9	30	2009	273	2	2007	19.5000	high
M	01/10/2009	225	230	2009	10	1	2009	274	6	2003	27.0000	high
M	01/10/2009	168	170	2009	10	1	2009	274	1	2008	21.0319	high
F	02/10/2009	201	196	2009	10	2	2009	275	7	2002	24.5330	high
F	02/10/2009	184	184	2009	10	2	2009	275	7	2002	20.2000	high
F	02/10/2009	176	177	2009	10	2	2009	275	3	2006	21.3000	high
F	02/10/2009	176	174	2009	10	2	2009	275	2	2007	21.2000	high
M	03/10/2009	217	223	2009	10	3	2009	276	5	2004	30.4373	high
M	03/10/2009	225	227	2009	10	3	2009	276	3	2006	26.4694	high
M	03/10/2009	203	208	2009	10	3	2009	276	2	2007	21.5000	high
M	04/10/2009	200	200	2009	10	4	2009	277	9	2000	26.0000	high
F	04/10/2009	210	212	2009	10	4	2009	277	8	2001	28.0000	high
F	04/10/2009	180	175	2009	10	4	2009	277	5	2004	23.7957	high
M	04/10/2009	205	210	2009	10	4	2009	277	3	2006	19.5000	high
M	04/10/2009	225	230	2009	10	4	2009	277	2	2007	23.5000	high
F	04/10/2009	122	122	2009	10	4	2009	277	1	2008	18.4500	high
F	05/10/2009	228	224	2009	10	5	2009	278	13	1996	24.0500	low
F	05/10/2009	193	198	2009	10	5	2009	278	12	1997	23.1000	low
M	05/10/2009	250	253	2009	10	5	2009	278	7	2002	33.5000	high
M	06/10/2009	236	234	2009	10	6	2009	279	9	2000	32.6000	high
M	06/10/2009	165	220	2009	10	6	2009	279	2	2007	24.3000	high
M	07/10/2009	170	175	2009	10	7	2009	280	2	2007	15.9722	high
F	07/10/2009	150	155	2009	10	7	2009	280	1	2008	17.1000	high
F	08/10/2009	206	200	2009	10	8	2009	281	17	1992	19.7500	low
F	08/10/2009	206	200	2009	10	8	2009	281	17	1992	19.7500	low
F	08/10/2009	218	224	2009	10	8	2009	281	12	1997	23.6000	low
F	08/10/2009	197	198	2009	10	8	2009	281	10	1999	21.3000	high
F	08/10/2009	169	178	2009	10	8	2009	281	5	2004	20.8000	high
F	08/10/2009	178	170	2009	10	8	2009	281	4	2005	24.0500	high
M	08/10/2009	210	209	2009	10	8	2009	281	3	2006	22.9500	high
M	08/10/2009	190	191	2009	10	8	2009	281	1	2008	20.0000	high
M	08/10/2009	30	28	2009	10	8	2009	281	0	2009	9.1827	high
M	10/10/2009	220	218	2009	10	10	2009	283	6	2003	28.2000	high
F	11/10/2009	218	218	2009	10	11	2009	284	6	2003	23.6000	high
F	11/10/2009	102	102	2009	10	11	2009	284	1	2008	16.2000	high
F	13/10/2009	212	220	2009	10	13	2009	286	14	1995	22.3500	low
M	13/10/2009	133	130	2009	10	13	2009	286	1	2008	13.1500	high
M	13/10/2009	160	160	2009	10	13	2009	286	1	2008	17.5500	high
M	14/10/2009	185	187	2009	10	14	2009	287	2	2007	23.0000	high
F	14/10/2009	110	110	2009	10	14	2009	287	1	2008	18.0000	high
F	15/10/2009	229	233	2009	10	15	2009	288	11	1998	19.9500	high
F	15/10/2009	186	184	2009	10	15	2009	288	4	2005	20.2500	high
M	17/10/2009	204	208	2009	10	17	2009	290	2	2007	21.0000	high
M	17/10/2009	180	185	2009	10	17	2009	290	2	2007	20.2000	high
M	17/10/2009	135	135	2009	10	17	2009	290	1	2008	16.0000	high
F	18/10/2009	191	190	2009	10	18	2009	291	6	2003	24.7174	high
F	18/10/2009	180	181	2009	10	18	2009	291	6	2003	22.0000	high
M	18/10/2009	200	194	2009	10	18	2009	291	2	2007	25.6394	high
M	19/10/2009	240	230	2009	10	19	2009	292	4	2005	30.4000	high
M	19/10/2009	161	154	2009	10	19	2009	292	1	2008	15.2000	high
M	20/10/2009	234	230	2009	10	20	2009	293	11	1998	27.1000	high
M	21/10/2009	57	57	2009	10	21	2009	294	0	2009	11.8402	high
M	22/10/2009	201	203	2009	10	22	2009	295	2	2007	21.4924	high
F	22/10/2009	125	120	2009	10	22	2009	295	1	2008	16.0000	high
M	24/10/2009	228	227	2009	10	24	2009	297	5	2004	31.2000	high
M	24/10/2009	232	230	2009	10	24	2009	297	5	2004	26.0000	high
F	24/10/2009	47	48	2009	10	24	2009	297	0	2009	11.0000	high
M	25/10/2009	225	226	2009	10	25	2009	298	4	2005	20.0000	high
F	28/10/2009	146	139	2009	10	28	2009	301	1	2008	16.2018	high
F	28/10/2009	159	159	2009	10	28	2009	301	1	2008	23.3000	high
F	28/10/2009	80	82	2009	10	28	2009	301	0	2009	8.4047	high
F	29/10/2009	209	212	2009	10	29	2009	302	12	1997	24.0500	low
M	29/10/2009	207	207	2009	10	29	2009	302	6	2003	25.2000	high
M	29/10/2009	130	126	2009	10	29	2009	302	1	2008	16.3396	high
F	29/10/2009	36	36	2009	10	29	2009	302	0	2009	11.1525	high
M	30/10/2009	54	54	2009	10	30	2009	303	0	2009	11.3817	high
M	31/10/2009	240	241	2009	10	31	2009	304	8	2001	25.7000	high
M	31/10/2009	205	200	2009	10	31	2009	304	8	2001	26.0000	high
F	31/10/2009	170	165	2009	10	31	2009	304	1	2008	18.2000	high
M	01/11/2009	190	192	2009	11	1	2009	305	5	2004	24.0000	high
F	01/11/2009	160	157	2009	11	1	2009	305	4	2005	22.0000	high
M	04/11/2009	249	248	2009	11	4	2009	308	12	1997	29.4680	low
M	05/11/2009	245	250	2009	11	5	2009	309	6	2003	24.9000	high
F	06/11/2009	123	122	2009	11	6	2009	310	2	2007	17.9500	high
M	06/11/2009	160	175	2009	11	6	2009	310	1	2008	21.3500	high
M	07/11/2009	212	209	2009	11	7	2009	311	10	1999	26.1005	high
M	07/11/2009	205	205	2009	11	7	2009	311	7	2002	21.9529	high
M	07/11/2009	220	221	2009	11	7	2009	311	6	2003	26.5616	high
F	07/11/2009	165	165	2009	11	7	2009	311	1	2008	20.0000	high
M	08/11/2009	220	220	2009	11	8	2009	312	10	1999	28.0000	high
M	09/11/2009	216	202	2009	11	9	2009	313	4	2005	25.4500	high
F	11/11/2009	209	208	2009	11	11	2009	315	9	2000	27.4840	high
M	14/11/2009	215	213	2009	11	14	2009	318	3	2006	30.0000	high
F	17/11/2009	205	210	2009	11	17	2009	321	8	2001	23.0000	high
F	03/12/2009	154	154	2009	12	3	2009	337	1	2008	16.0000	high
F	05/12/2009	170	171	2009	12	5	2009	339	5	2004	21.3000	high
F	05/12/2009	225	225	2009	12	5	2009	339	3	2006	20.5000	high
F	06/12/2009	215	213	2009	12	6	2009	340	4	2005	23.0000	high
M	06/12/2009	200	200	2009	12	6	2009	340	4	2005	22.1371	high
F	07/12/2009	134	130	2009	12	7	2009	341	1	2008	16.7500	high
F	08/12/2009	206	204	2009	12	8	2009	342	10	1999	23.9500	high
F	09/12/2009	215	214	2009	12	9	2009	343	6	2003	20.8478	high
M	09/12/2009	225	223	2009	12	9	2009	343	5	2004	23.2427	high
M	09/12/2009	208	207	2009	12	9	2009	343	5	2004	23.1000	high
F	09/12/2009	185	185	2009	12	9	2009	343	5	2004	21.2000	high
F	10/12/2009	220	210	2009	12	10	2009	344	5	2004	22.0000	high
M	10/12/2009	219	220	2009	12	10	2009	344	5	2004	27.2000	high
F	12/12/2009	160	165	2009	12	12	2009	346	1	2008	17.8000	high
M	13/12/2009	211	211	2009	12	13	2009	347	6	2003	23.2000	high
F	13/12/2009	190	195	2009	12	13	2009	347	5	2004	24.5000	high
M	16/12/2009	215	215	2009	12	16	2009	350	5	2004	21.4000	high
F	17/12/2009	181	179	2009	12	17	2009	351	3	2006	20.1113	high
F	17/12/2009	160	160	2009	12	17	2009	351	3	2006	17.5000	high
M	17/12/2009	81	82	2009	12	17	2009	351	0	2009	13.6000	high
F	19/12/2009	196	196	2009	12	19	2009	353	7	2002	17.0000	high
F	19/12/2009	170	170	2009	12	19	2009	353	4	2005	20.0000	high
M	19/12/2009	50	50	2009	12	19	2009	353	0	2009	9.0000	high
F	19/12/2009	30	35	2009	12	19	2009	353	0	2009	12.0000	high
M	20/12/2009	215	220	2009	12	20	2009	354	8	2001	22.0000	high
F	20/12/2009	204	202	2009	12	20	2009	354	6	2003	24.5315	high
M	20/12/2009	210	215	2009	12	20	2009	354	4	2005	26.6000	high
F	20/12/2009	177	180	2009	12	20	2009	354	3	2006	20.6000	high
F	20/12/2009	124	130	2009	12	20	2009	354	1	2008	18.0000	high
F	23/12/2009	130	130	2009	12	23	2009	357	1	2008	16.8000	high
M	24/12/2009	207	206	2009	12	24	2009	358	5	2004	18.0000	high
M	24/12/2009	208	208	2009	12	24	2009	358	5	2004	21.4924	high
M	24/12/2009	142	141	2009	12	24	2009	358	1	2008	15.8000	high
M	26/12/2009	201	203	2009	12	26	2009	360	5	2004	26.5000	high
M	26/12/2009	190	190	2009	12	26	2009	360	4	2005	17.0000	high
M	26/12/2009	159	159	2009	12	26	2009	360	1	2008	16.5000	high
M	26/12/2009	170	169	2009	12	26	2009	360	1	2008	19.1909	high
F	27/12/2009	170	170	2009	12	27	2009	361	8	2001	22.0000	high
M	27/12/2009	210	211	2009	12	27	2009	361	3	2006	19.3749	high
M	27/12/2009	174	174	2009	12	27	2009	361	1	2008	18.0000	high
M	27/12/2009	141	141	2009	12	27	2009	361	1	2008	19.3000	high
F	30/12/2009	112	111	2009	12	30	2009	364	1	2008	14.5000	high
F	01/01/2010	180	180	2009	1	1	2010	366	9	2000	21.0000	high
M	01/01/2010	215	213	2009	1	1	2010	366	4	2005	21.0319	high
F	02/01/2010	195	195	2009	1	2	2010	367	10	1999	19.0000	high
F	02/01/2010	205	210	2009	1	2	2010	367	8	2001	20.5000	high
M	02/01/2010	230	240	2009	1	2	2010	367	7	2002	29.0000	high
M	02/01/2010	215	213	2009	1	2	2010	367	6	2003	26.0000	high
F	02/01/2010	224	224	2009	1	2	2010	367	5	2004	21.5000	high
F	02/01/2010	168	167	2009	1	2	2010	367	3	2006	21.2161	high
M	02/01/2010	177	185	2009	1	2	2010	367	1	2008	19.7000	high
M	07/01/2010	205	200	2009	1	7	2010	372	6	2003	16.5000	high
F	07/01/2010	38	38	2009	1	7	2010	372	0	2009	11.5000	high
M	08/01/2010	233	233	2010	1	8	2010	373	3	2007	30.2000	high
F	10/01/2010	178	175	2009	1	10	2010	375	4	2005	23.0000	high
M	10/01/2010	167	172	2009	1	10	2010	375	1	2008	16.0000	high
F	11/01/2010	210	210	2009	1	11	2010	376	8	2001	25.0000	high
F	12/01/2010	192	190	2010	1	12	2010	377	5	2005	17.8816	high
M	13/01/2010	210	208	2009	1	13	2010	378	3	2006	21.1993	high
F	14/01/2010	217	207	2009	1	14	2010	379	10	1999	21.0000	high
F	14/01/2010	188	186	2009	1	14	2010	379	10	1999	23.0000	high
F	14/01/2010	212	211	2009	1	14	2010	379	6	2003	21.5000	high
F	14/01/2010	181	180	2009	1	14	2010	379	4	2005	20.3869	high
M	16/01/2010	262	260	2009	1	16	2010	381	9	2000	22.0000	high
F	16/01/2010	180	181	2009	1	16	2010	381	6	2003	22.0000	high
M	16/01/2010	220	224	2010	1	16	2010	381	7	2003	24.0000	high
M	16/01/2010	194	197	2009	1	16	2010	381	2	2007	20.8478	high
F	16/01/2010	159	162	2009	1	16	2010	381	1	2008	15.6000	high
M	16/01/2010	152	154	2009	1	16	2010	381	1	2008	17.0000	high
M	17/01/2010	216	215	2009	1	17	2010	382	4	2005	20.8000	high
M	17/01/2010	191	191	2009	1	17	2010	382	2	2007	16.1000	high
M	17/01/2010	210	215	2009	1	17	2010	382	2	2007	18.0000	high
F	17/01/2010	156	153	2009	1	17	2010	382	1	2008	16.6000	high
F	17/01/2010	115	115	2009	1	17	2010	382	1	2008	16.4000	high
M	02/09/2010	250	262	2010	9	2	2010	245	4	2006	23.2000	high
F	03/09/2010	190	196	2010	9	3	2010	246	10	2000	15.9000	high
M	03/09/2010	245	235	2010	9	3	2010	246	5	2005	27.0689	high
M	03/09/2010	180	182	2010	9	3	2010	246	2	2008	20.1573	high
M	07/09/2010	232	231	2010	9	7	2010	250	7	2003	31.1000	high
M	08/09/2010	147	144	2010	9	8	2010	251	1	2009	20.8000	high
M	09/09/2010	213	212	2010	9	9	2010	252	3	2007	29.5000	high
F	10/09/2010	198	202	2010	9	10	2010	253	11	1999	23.8500	high
F	10/09/2010	198	192	2010	9	10	2010	253	9	2001	19.8811	high
M	10/09/2010	142	148	2010	9	10	2010	253	1	2009	21.0500	high
M	10/09/2010	132	132	2010	9	10	2010	253	1	2009	17.0292	high
M	12/09/2010	225	222	2010	9	12	2010	255	6	2004	25.2000	high
M	12/09/2010	235	236	2010	9	12	2010	255	4	2006	29.5142	high
M	12/09/2010	206	206	2010	9	12	2010	255	3	2007	20.0000	high
M	13/09/2010	228	228	2010	9	13	2010	256	14	1996	26.8500	low
F	13/09/2010	192	193	2010	9	13	2010	256	8	2002	20.2000	high
M	13/09/2010	232	231	2010	9	13	2010	256	7	2003	30.9000	high
M	13/09/2010	194	196	2010	9	13	2010	256	4	2006	28.7000	high
M	13/09/2010	232	230	2010	9	13	2010	256	3	2007	25.6000	high
M	14/09/2010	220	222	2010	9	14	2010	257	7	2003	25.8500	high
M	14/09/2010	199	198	2010	9	14	2010	257	5	2005	27.0000	high
F	14/09/2010	159	160	2010	9	14	2010	257	4	2006	22.0000	high
M	14/09/2010	212	215	2010	9	14	2010	257	3	2007	25.3000	high
M	14/09/2010	197	192	2010	9	14	2010	257	2	2008	20.0500	high
F	15/09/2010	217	209	2010	9	15	2010	258	10	2000	19.7891	high
F	15/09/2010	192	190	2010	9	15	2010	258	7	2003	18.1328	high
M	15/09/2010	147	147	2010	9	15	2010	258	1	2009	14.1000	high
F	15/09/2010	130	133	2010	9	15	2010	258	1	2009	12.8953	high
M	16/09/2010	225	220	2010	9	16	2010	259	5	2005	27.0000	high
M	16/09/2010	220	222	2010	9	16	2010	259	4	2006	29.0000	high
F	17/09/2010	184	176	2010	9	17	2010	260	10	2000	22.2500	high
F	19/09/2010	19	19	2010	9	19	2010	262	0	2010	9.2743	high
F	21/09/2010	199	195	2010	9	21	2010	264	10	2000	23.9000	high
F	21/09/2010	113	113	2010	9	21	2010	264	1	2009	14.2500	high
F	23/09/2010	203	194	2010	9	23	2010	266	12	1998	15.4000	high
M	23/09/2010	215	215	2010	9	23	2010	266	9	2001	26.0000	high
F	23/09/2010	198	189	2010	9	23	2010	266	8	2002	19.9500	high
M	23/09/2010	232	230	2010	9	23	2010	266	3	2007	29.2000	high
M	23/09/2010	150	150	2010	9	23	2010	266	1	2009	21.0319	high
M	24/09/2010	221	218	2010	9	24	2010	267	6	2004	32.5000	high
M	24/09/2010	156	154	2010	9	24	2010	267	1	2009	18.1500	high
M	26/09/2010	245	243	2010	9	26	2010	269	10	2000	33.1000	high
M	27/09/2010	206	202	2010	9	27	2010	270	7	2003	29.6000	high
M	28/09/2010	173	176	2010	9	28	2010	271	1	2009	19.5590	high
F	28/09/2010	125	127	2010	9	28	2010	271	1	2009	18.3500	high
F	29/09/2010	242	240	2010	9	29	2010	272	12	1998	24.5500	high
F	29/09/2010	192	192	2010	9	29	2010	272	7	2003	23.0000	high
F	29/09/2010	198	200	2010	9	29	2010	272	6	2004	22.6000	high
F	29/09/2010	197	194	2010	9	29	2010	272	5	2005	21.8000	high
F	30/09/2010	179	182	2010	9	30	2010	273	5	2005	21.0000	high
F	01/10/2010	183	179	2010	10	1	2010	274	8	2002	20.2954	high
F	02/10/2010	191	190	2010	10	2	2010	275	8	2002	25.0000	high
M	02/10/2010	227	225	2010	10	2	2010	275	7	2003	29.1000	high
M	02/10/2010	212	210	2010	10	2	2010	275	6	2004	28.2000	high
F	02/10/2010	107	107	2010	10	2	2010	275	1	2009	16.4000	high
F	02/10/2010	130	130	2010	10	2	2010	275	1	2009	19.1000	high
M	02/10/2010	130	130	2010	10	2	2010	275	1	2009	16.0000	high
F	03/10/2010	202	202	2010	10	3	2010	276	6	2004	24.1000	high
F	03/10/2010	207	200	2010	10	3	2010	276	6	2004	22.1000	high
M	03/10/2010	160	162	2010	10	3	2010	276	2	2008	16.8000	high
M	03/10/2010	151	151	2010	10	3	2010	276	1	2009	21.0000	high
F	04/10/2010	200	199	2010	10	4	2010	277	8	2002	21.6500	high
F	04/10/2010	132	137	2010	10	4	2010	277	1	2009	11.9000	high
M	05/10/2010	241	238	2010	10	5	2010	278	9	2001	29.6000	high
M	05/10/2010	228	229	2010	10	5	2010	278	4	2006	26.8000	high
F	06/10/2010	195	195	2010	10	6	2010	279	7	2003	22.4135	high
F	06/10/2010	122	120	2010	10	6	2010	279	1	2009	18.2000	high
M	06/10/2010	141	141	2010	10	6	2010	279	1	2009	18.7000	high
M	08/10/2010	236	239	2010	10	8	2010	281	4	2006	29.3000	high
M	08/10/2010	230	229	2010	10	8	2010	281	3	2007	26.6500	high
M	09/10/2010	220	216	2010	10	9	2010	282	8	2002	32.5000	high
M	09/10/2010	125	127	2010	10	9	2010	282	1	2009	18.4000	high
M	10/10/2010	210	230	2010	10	10	2010	283	6	2004	29.5000	high
F	12/10/2010	175	177	2010	10	12	2010	285	5	2005	20.0500	high
M	12/10/2010	170	171	2010	10	12	2010	285	2	2008	21.0000	high
F	12/10/2010	104	103	2010	10	12	2010	285	1	2009	10.7000	high
F	14/10/2010	168	168	2010	10	14	2010	287	8	2002	20.5500	high
F	14/10/2010	187	186	2010	10	14	2010	287	6	2004	23.9500	high
F	14/10/2010	132	130	2010	10	14	2010	287	1	2009	17.1000	high
F	19/10/2010	194	198	2010	10	19	2010	292	4	2006	23.5000	high
F	21/10/2010	153	155	2010	10	21	2010	294	2	2008	24.3000	high
F	22/10/2010	218	217	2010	10	22	2010	295	7	2003	21.0000	high
F	22/10/2010	200	198	2010	10	22	2010	295	6	2004	19.6000	high
M	22/10/2010	145	150	2010	10	22	2010	295	1	2009	14.5479	high
F	23/10/2010	223	229	2010	10	23	2010	296	12	1998	27.4000	high
M	23/10/2010	265	266	2010	10	23	2010	296	5	2005	29.0000	high
F	26/10/2010	205	200	2010	10	26	2010	299	5	2005	21.0000	high
M	26/10/2010	210	215	2010	10	26	2010	299	4	2006	30.8000	high
M	27/10/2010	180	183	2010	10	27	2010	300	2	2008	19.3542	high
M	27/10/2010	88	88	2010	10	27	2010	300	1	2009	17.9000	high
M	27/10/2010	139	139	2010	10	27	2010	300	1	2009	16.9000	high
M	27/10/2010	150	150	2010	10	27	2010	300	1	2009	17.8568	high
F	29/10/2010	140	135	2010	10	29	2010	302	2	2008	20.0000	high
M	29/10/2010	135	137	2010	10	29	2010	302	1	2009	15.2500	high
F	30/10/2010	182	181	2010	10	30	2010	303	7	2003	23.5000	high
F	30/10/2010	186	183	2010	10	30	2010	303	6	2004	19.6000	high
F	30/10/2010	170	171	2010	10	30	2010	303	5	2005	26.0000	high
M	30/10/2010	150	151	2010	10	30	2010	303	1	2009	16.2000	high
M	30/10/2010	157	158	2010	10	30	2010	303	1	2009	17.8108	high
M	31/10/2010	216	217	2010	10	31	2010	304	9	2001	22.8742	high
M	31/10/2010	205	200	2010	10	31	2010	304	3	2007	22.8742	high
F	31/10/2010	125	123	2010	10	31	2010	304	1	2009	15.5000	high
M	01/11/2010	240	242	2010	11	1	2010	305	8	2002	25.0000	high
M	01/11/2010	243	241	2010	11	1	2010	305	4	2006	26.2000	high
M	01/11/2010	230	231	2010	11	1	2010	305	4	2006	25.6394	high
M	03/11/2010	220	220	2010	11	3	2010	307	7	2003	26.5616	high
M	03/11/2010	240	237	2010	11	3	2010	307	3	2007	28.5500	high
M	04/11/2010	238	245	2010	11	4	2010	308	5	2005	26.9000	high
M	04/11/2010	218	216	2010	11	4	2010	308	3	2007	26.4500	high
F	05/11/2010	190	190	2010	11	5	2010	309	6	2004	21.1000	high
M	05/11/2010	161	163	2010	11	5	2010	309	1	2009	16.1500	high
M	05/11/2010	155	160	2010	11	5	2010	309	1	2009	17.9948	high
M	06/11/2010	230	230	2010	11	6	2010	310	8	2002	29.5000	high
M	06/11/2010	172	174	2010	11	6	2010	310	1	2009	17.1671	high
M	06/11/2010	145	145	2010	11	6	2010	310	1	2009	19.8000	high
M	07/11/2010	248	248	2010	11	7	2010	311	12	1998	25.1784	high
M	08/11/2010	250	246	2010	11	8	2010	312	7	2003	25.5000	high
F	09/11/2010	177	176	2010	11	9	2010	313	5	2005	19.6050	high
M	09/11/2010	220	227	2010	11	9	2010	313	4	2006	26.2500	high
M	10/11/2010	210	210	2010	11	10	2010	314	4	2006	22.8742	high
M	11/11/2010	234	245	2010	11	11	2010	315	8	2002	25.0000	high
F	11/11/2010	185	185	2010	11	11	2010	315	6	2004	21.0000	high
F	11/11/2010	165	162	2010	11	11	2010	315	5	2005	23.0000	high
M	08/12/2010	260	258	2010	12	8	2010	342	4	2006	32.0000	high
M	08/12/2010	215	215	2010	12	8	2010	342	3	2007	20.6000	high
M	09/12/2010	243	245	2010	12	9	2010	343	13	1997	28.4000	low
F	09/12/2010	191	182	2010	12	9	2010	343	7	2003	16.9000	high
F	09/12/2010	220	223	2010	12	9	2010	343	5	2005	26.0000	high
M	11/12/2010	244	245	2010	12	11	2010	345	12	1998	19.0988	high
M	11/12/2010	236	238	2010	12	11	2010	345	8	2002	27.5000	high
F	11/12/2010	195	195	2010	12	11	2010	345	8	2002	20.4000	high
M	11/12/2010	212	212	2010	12	11	2010	345	6	2004	21.9000	high
F	12/12/2010	203	205	2010	12	12	2010	346	7	2003	29.0000	high
M	12/12/2010	220	220	2010	12	12	2010	346	5	2005	26.0000	high
F	12/12/2010	158	158	2010	12	12	2010	346	1	2009	18.2000	high
M	12/12/2010	40	41	2010	12	12	2010	346	0	2010	12.0000	high
M	13/12/2010	267	272	2010	12	13	2010	347	11	1999	25.5500	high
F	13/12/2010	230	222	2010	12	13	2010	347	4	2006	23.3000	high
M	14/12/2010	212	217	2010	12	14	2010	348	6	2004	19.8000	high
M	14/12/2010	223	222	2010	12	14	2010	348	3	2007	18.2000	high
F	15/12/2010	111	110	2010	12	15	2010	349	1	2009	11.5000	high
M	16/12/2010	236	234	2010	12	16	2010	350	5	2005	25.0000	high
M	16/12/2010	210	213	2010	12	16	2010	350	3	2007	24.0000	high
F	16/12/2010	110	112	2010	12	16	2010	350	1	2009	15.6789	high
M	18/12/2010	232	230	2010	12	18	2010	352	5	2005	21.0000	high
F	19/12/2010	202	207	2010	12	19	2010	353	8	2002	20.7557	high
F	19/12/2010	193	190	2010	12	19	2010	353	6	2004	21.4000	high
M	22/12/2010	230	235	2010	12	22	2010	356	3	2007	27.5040	high
F	26/12/2010	190	186	2010	12	26	2010	360	6	2004	26.0000	high
F	28/12/2010	191	195	2010	12	28	2010	362	6	2004	21.9000	high
M	28/12/2010	210	209	2010	12	28	2010	362	4	2006	17.8000	high
M	29/12/2010	222	220	2010	12	29	2010	363	7	2003	22.0000	high
M	30/12/2010	206	204	2010	12	30	2010	364	6	2004	21.5845	high
M	30/12/2010	210	208	2010	12	30	2010	364	3	2007	22.8000	high
F	30/12/2010	131	134	2010	12	30	2010	364	1	2009	17.0000	high
M	30/12/2010	182	176	2010	12	30	2010	364	1	2009	17.5000	high
F	02/01/2011	111	111	2010	1	2	2011	367	1	2009	12.9412	high
F	05/01/2011	185	180	2010	1	5	2011	370	4	2006	16.6000	high
M	05/01/2011	150	150	2010	1	5	2011	370	1	2009	18.5000	high
F	06/01/2011	233	233	2010	1	6	2011	371	10	2000	21.0000	high
M	06/01/2011	232	230	2010	1	6	2011	371	10	2000	21.0000	high
M	06/01/2011	225	225	2010	1	6	2011	371	8	2002	20.0000	high
F	06/01/2011	150	150	2010	1	6	2011	371	1	2009	17.0000	high
F	08/01/2011	193	213	2010	1	8	2011	373	6	2004	20.4000	high
F	09/01/2011	181	179	2010	1	9	2011	374	4	2006	26.0165	high
M	09/01/2011	197	195	2010	1	9	2011	374	4	2006	19.5000	high
M	11/01/2011	104	105	2010	1	11	2011	376	1	2009	14.2000	high
F	12/01/2011	195	195	2010	1	12	2011	377	7	2003	20.0000	high
M	12/01/2011	209	212	2010	1	12	2011	377	5	2005	23.8000	high
F	12/01/2011	200	201	2010	1	12	2011	377	4	2006	21.6000	high
F	13/01/2011	187	188	2010	1	13	2011	378	6	2004	22.6000	high
F	13/01/2011	159	152	2010	1	13	2011	378	4	2006	17.4000	high
F	15/01/2011	210	209	2010	1	15	2011	380	13	1997	16.5000	low
M	15/01/2011	213	215	2010	1	15	2011	380	5	2005	30.2000	high
M	15/01/2011	218	214	2010	1	15	2011	380	4	2006	21.0000	high
F	15/01/2011	132	130	2010	1	15	2011	380	1	2009	14.0428	high
F	15/01/2011	141	141	2010	1	15	2011	380	1	2009	17.0000	high
M	16/01/2011	240	240	2010	1	16	2011	381	10	2000	25.0000	high
M	16/01/2011	222	232	2010	1	16	2011	381	4	2006	21.0000	high
F	16/01/2011	182	180	2010	1	16	2011	381	3	2007	18.7000	high
M	16/01/2011	72	72	2010	1	16	2011	381	1	2009	16.0000	high
F	07/02/2011	220	226	2010	2	7	2011	403	9	2001	20.8500	high
M	07/02/2011	173	173	2010	2	7	2011	403	1	2009	15.6000	high
M	08/02/2011	241	241	2010	2	8	2011	404	7	2003	23.4000	high
M	08/02/2011	247	244	2010	2	8	2011	404	5	2005	19.7000	high
F	08/02/2011	181	180	2010	2	8	2011	404	4	2006	19.8500	high
F	01/09/2011	99	99	2011	9	1	2011	244	1	2010	14.4500	high
F	02/09/2011	195	185	2011	9	2	2011	245	12	1999	25.0000	high
M	02/09/2011	190	200	2011	9	2	2011	245	3	2008	24.5500	high
M	05/09/2011	152	142	2011	9	5	2011	248	1	2010	17.2000	high
F	05/09/2011	110	113	2011	9	5	2011	248	1	2010	14.0428	high
M	05/09/2011	152	153	2011	9	5	2011	248	1	2010	15.2500	high
M	05/09/2011	134	134	2011	9	5	2011	248	1	2010	15.2500	high
F	06/09/2011	210	208	2011	9	6	2011	249	7	2004	22.9500	high
M	06/09/2011	234	233	2011	9	6	2011	249	6	2005	34.6500	high
M	06/09/2011	233	233	2011	9	6	2011	249	5	2006	26.7000	high
F	06/09/2011	94	94	2011	9	6	2011	249	1	2010	13.4919	high
F	09/09/2011	201	201	2011	9	9	2011	252	11	2000	26.7500	high
F	09/09/2011	228	222	2011	9	9	2011	252	10	2001	22.6000	high
F	09/09/2011	173	174	2011	9	9	2011	252	9	2002	23.7000	high
M	09/09/2011	163	161	2011	9	9	2011	252	1	2010	19.4000	high
F	09/09/2011	21	20	2011	9	9	2011	252	0	2011	10.0500	high
F	11/09/2011	11	10	2011	9	11	2011	254	0	2011	8.4000	high
M	13/09/2011	222	224	2011	9	13	2011	256	11	2000	33.6000	high
M	13/09/2011	232	218	2011	9	13	2011	256	8	2003	32.1000	high
M	13/09/2011	159	161	2011	9	13	2011	256	1	2010	15.9000	high
M	13/09/2011	142	146	2011	9	13	2011	256	1	2010	17.5000	high
M	14/09/2011	133	131	2011	9	14	2011	257	1	2010	13.5500	high
M	15/09/2011	205	205	2011	9	15	2011	258	4	2007	29.0000	high
M	15/09/2011	211	212	2011	9	15	2011	258	3	2008	26.7000	high
F	15/09/2011	121	121	2011	9	15	2011	258	1	2010	20.4000	high
F	16/09/2011	117	117	2011	9	16	2011	259	1	2010	13.3500	high
M	16/09/2011	148	145	2011	9	16	2011	259	1	2010	15.8000	high
F	16/09/2011	103	101	2011	9	16	2011	259	1	2010	13.9000	high
F	16/09/2011	105	104	2011	9	16	2011	259	1	2010	14.0000	high
M	16/09/2011	31	30	2011	9	16	2011	259	0	2011	11.3817	high
F	16/09/2011	14	13	2011	9	16	2011	259	0	2011	7.6000	high
F	17/09/2011	150	148	2011	9	17	2011	260	1	2010	18.5100	high
M	20/09/2011	222	223	2011	9	20	2011	263	8	2003	34.8000	high
F	20/09/2011	186	189	2011	9	20	2011	263	5	2006	21.3000	high
M	20/09/2011	162	163	2011	9	20	2011	263	1	2010	19.4000	high
M	21/09/2011	199	199	2011	9	21	2011	264	4	2007	28.6835	high
M	21/09/2011	197	194	2011	9	21	2011	264	3	2008	23.9800	high
F	22/09/2011	125	120	2011	9	22	2011	265	1	2010	12.2989	high
F	22/09/2011	120	118	2011	9	22	2011	265	1	2010	13.5000	high
F	23/09/2011	172	173	2011	9	23	2011	266	4	2007	18.3000	high
M	24/09/2011	220	220	2011	9	24	2011	267	7	2004	24.0000	high
M	28/09/2011	225	221	2011	9	28	2011	271	11	2000	29.1000	high
F	28/09/2011	220	220	2011	9	28	2011	271	10	2001	21.3000	high
M	28/09/2011	202	204	2011	9	28	2011	271	4	2007	30.7000	high
F	28/09/2011	127	128	2011	9	28	2011	271	1	2010	18.7000	high
F	29/09/2011	120	125	2011	9	29	2011	272	1	2010	12.4824	high
F	30/09/2011	190	190	2011	9	30	2011	273	11	2000	21.5000	high
F	30/09/2011	189	187	2011	9	30	2011	273	6	2005	19.4000	high
M	01/10/2011	205	210	2011	10	1	2011	274	5	2006	26.0000	high
M	02/10/2011	204	206	2011	10	2	2011	275	6	2005	31.0000	high
M	02/10/2011	195	190	2011	10	2	2011	275	3	2008	18.3000	high
M	03/10/2011	224	231	2011	10	3	2011	276	4	2007	31.8000	high
M	04/10/2011	244	245	2011	10	4	2011	277	9	2002	33.0000	high
F	04/10/2011	162	163	2011	10	4	2011	277	6	2005	20.7000	high
F	04/10/2011	174	170	2011	10	4	2011	277	5	2006	22.2000	high
M	04/10/2011	205	205	2011	10	4	2011	277	3	2008	26.1000	high
F	04/10/2011	126	122	2011	10	4	2011	277	1	2010	15.9000	high
M	05/10/2011	25	23	2011	10	5	2011	278	0	2011	13.6755	high
F	06/10/2011	205	210	2011	10	6	2011	279	8	2003	17.3510	high
F	06/10/2011	200	185	2011	10	6	2011	279	7	2004	22.0450	high
F	06/10/2011	215	218	2011	10	6	2011	279	7	2004	25.7000	high
M	06/10/2011	222	219	2011	10	6	2011	279	4	2007	30.5000	high
M	06/10/2011	210	210	2011	10	6	2011	279	3	2008	27.1000	high
F	06/10/2011	109	114	2011	10	6	2011	279	1	2010	16.0000	high
M	08/10/2011	230	230	2011	10	8	2011	281	8	2003	27.8900	high
M	08/10/2011	220	218	2011	10	8	2011	281	5	2006	36.0000	high
F	09/10/2011	213	205	2011	10	9	2011	282	8	2003	23.4000	high
M	12/10/2011	165	165	2011	10	12	2011	285	1	2010	17.8108	high
M	12/10/2011	48	48	2011	10	12	2011	285	0	2011	11.5000	high
M	13/10/2011	213	215	2011	10	13	2011	286	4	2007	31.2000	high
F	13/10/2011	128	128	2011	10	13	2011	286	1	2010	17.8000	high
M	13/10/2011	162	162	2011	10	13	2011	286	1	2010	16.8000	high
F	15/10/2011	185	180	2011	10	15	2011	288	6	2005	17.8108	high
M	15/10/2011	228	230	2011	10	15	2011	288	4	2007	25.4000	high
F	15/10/2011	165	160	2011	10	15	2011	288	1	2010	14.5938	high
M	16/10/2011	210	210	2011	10	16	2011	289	4	2007	30.3000	high
M	16/10/2011	146	149	2011	10	16	2011	289	1	2010	15.0000	high
F	17/10/2011	185	180	2011	10	17	2011	290	7	2004	21.8000	high
M	17/10/2011	154	153	2011	10	17	2011	290	1	2010	15.1000	high
M	17/10/2011	168	165	2011	10	17	2011	290	1	2010	19.0000	high
M	17/10/2011	166	164	2011	10	17	2011	290	1	2010	18.3500	high
F	18/10/2011	158	159	2011	10	18	2011	291	3	2008	20.8000	high
M	19/10/2011	211	212	2011	10	19	2011	292	4	2007	24.0000	high
F	20/10/2011	227	224	2011	10	20	2011	293	13	1998	22.3000	high
M	20/10/2011	251	255	2011	10	20	2011	293	12	1999	30.7000	high
M	20/10/2011	212	212	2011	10	20	2011	293	7	2004	31.0000	high
F	22/10/2011	160	165	2011	10	22	2011	295	1	2010	20.0000	high
M	22/10/2011	165	160	2011	10	22	2011	295	1	2010	15.5000	high
F	23/10/2011	180	180	2011	10	23	2011	296	6	2005	21.0000	high
F	23/10/2011	182	180	2011	10	23	2011	296	2	2009	22.2000	high
M	26/10/2011	150	150	2011	10	26	2011	299	1	2010	20.0000	high
M	27/10/2011	213	214	2011	10	27	2011	300	5	2006	32.0993	high
F	27/10/2011	120	119	2011	10	27	2011	300	1	2010	14.0000	high
F	27/10/2011	141	143	2011	10	27	2011	300	1	2010	21.8608	high
M	27/10/2011	155	155	2011	10	27	2011	300	1	2010	17.2000	high
F	27/10/2011	129	127	2011	10	27	2011	300	1	2010	16.7000	high
F	28/10/2011	126	125	2011	10	28	2011	301	1	2010	14.9000	high
M	28/10/2011	148	159	2011	10	28	2011	301	1	2010	16.4500	high
M	29/10/2011	212	212	2011	10	29	2011	302	6	2005	28.2000	high
M	29/10/2011	227	230	2011	10	29	2011	302	6	2005	31.0000	high
F	29/10/2011	132	132	2011	10	29	2011	302	1	2010	18.7000	high
F	30/10/2011	210	215	2011	10	30	2011	303	9	2002	23.2000	high
F	30/10/2011	194	194	2011	10	30	2011	303	8	2003	27.4840	high
M	01/11/2011	210	210	2011	11	1	2011	305	4	2007	28.0000	high
M	02/11/2011	236	236	2011	11	2	2011	306	6	2005	25.2000	high
M	03/11/2011	205	200	2011	11	3	2011	307	3	2008	20.6000	high
M	03/11/2011	195	195	2011	11	3	2011	307	2	2009	20.8299	high
M	03/11/2011	215	210	2011	11	3	2011	307	2	2009	23.4000	high
F	03/11/2011	130	135	2011	11	3	2011	307	1	2010	17.4000	high
F	04/11/2011	178	185	2011	11	4	2011	308	3	2008	19.4000	high
M	08/11/2011	232	234	2011	11	8	2011	312	8	2003	23.7000	high
M	08/11/2011	236	238	2011	11	8	2011	312	7	2004	30.5000	high
M	08/11/2011	220	220	2011	11	8	2011	312	6	2005	26.0000	high
F	08/11/2011	204	192	2011	11	8	2011	312	6	2005	18.3000	high
M	08/11/2011	203	201	2011	11	8	2011	312	5	2006	21.9000	high
M	08/11/2011	235	233	2011	11	8	2011	312	4	2007	27.0000	high
M	09/11/2011	215	216	2011	11	9	2011	313	9	2002	26.0000	high
M	10/11/2011	141	142	2011	11	10	2011	314	1	2010	18.9000	high
F	11/11/2011	203	202	2011	11	11	2011	315	6	2005	24.7000	high
F	11/11/2011	202	205	2011	11	11	2011	315	4	2007	21.5000	high
M	11/11/2011	210	215	2011	11	11	2011	315	4	2007	25.0000	high
F	03/12/2011	133	134	2011	12	3	2011	337	6	2005	23.0000	high
F	04/12/2011	203	202	2011	12	4	2011	338	9	2002	25.0000	high
M	06/12/2011	244	246	2011	12	6	2011	340	10	2001	25.6000	high
M	10/12/2011	240	235	2011	12	10	2011	344	7	2004	25.2000	high
F	10/12/2011	225	230	2011	12	10	2011	344	2	2009	20.5000	high
F	11/12/2011	145	150	2011	12	11	2011	345	1	2010	16.5000	high
F	17/12/2011	183	172	2011	12	17	2011	351	4	2007	21.0319	high
F	22/12/2011	180	180	2011	12	22	2011	356	12	1999	21.6000	high
M	24/12/2011	190	187	2011	12	24	2011	358	3	2008	20.0000	high
M	27/12/2011	225	230	2011	12	27	2011	361	8	2003	23.0000	high
F	27/12/2011	175	180	2011	12	27	2011	361	5	2006	20.0000	high
F	28/12/2011	189	189	2011	12	28	2011	362	6	2005	29.5000	high
M	28/12/2011	230	230	2011	12	28	2011	362	6	2005	25.1000	high
M	01/01/2012	235	240	2011	1	1	2012	366	6	2005	22.0000	high
M	01/01/2012	120	130	2011	1	1	2012	366	1	2010	17.0000	high
F	03/01/2012	140	145	2011	1	3	2012	368	1	2010	15.8000	high
M	10/01/2012	126	126	2012	1	10	2012	375	1	2011	13.3083	high
F	11/01/2012	40	40	2011	1	11	2012	376	0	2011	9.2000	high
F	14/01/2012	198	204	2011	1	14	2012	379	9	2002	21.8000	high
F	14/01/2012	203	205	2011	1	14	2012	379	8	2003	22.0000	high
F	15/01/2012	219	220	2011	1	15	2012	380	7	2004	23.5000	high
F	15/01/2012	213	208	2011	1	15	2012	380	6	2005	24.0000	high
M	15/01/2012	166	163	2011	1	15	2012	380	1	2010	15.6000	high
M	15/01/2012	62	62	2011	1	15	2012	380	0	2011	9.1000	high
M	01/09/2012	123	125	2012	9	1	2012	244	1	2011	11.5651	high
M	01/09/2012	141	141	2012	9	1	2012	244	1	2011	14.8694	high
M	03/09/2012	219	221	2012	9	3	2012	246	7	2005	25.3500	high
M	03/09/2012	196	201	2012	9	3	2012	246	3	2009	24.6000	high
M	04/09/2012	212	210	2012	9	4	2012	247	6	2006	32.6000	high
F	04/09/2012	187	189	2012	9	4	2012	247	5	2007	18.8000	high
M	04/09/2012	131	132	2012	9	4	2012	247	1	2011	15.0500	high
M	09/09/2012	232	228	2012	9	9	2012	252	5	2007	28.2000	high
M	09/09/2012	110	110	2012	9	9	2012	252	1	2011	18.2708	high
F	11/09/2012	182	191	2012	9	11	2012	254	11	2001	22.5000	high
M	11/09/2012	238	235	2012	9	11	2012	254	9	2003	30.6500	high
F	11/09/2012	178	179	2012	9	11	2012	254	4	2008	22.7000	high
M	11/09/2012	199	194	2012	9	11	2012	254	2	2010	20.2000	high
M	12/09/2012	211	212	2012	9	12	2012	255	4	2008	26.0000	high
F	14/09/2012	213	208	2012	9	14	2012	257	11	2001	15.7000	high
F	14/09/2012	213	214	2012	9	14	2012	257	11	2001	25.3000	high
F	14/09/2012	22	21	2012	9	14	2012	257	0	2012	9.7322	high
M	14/09/2012	14	15	2012	9	14	2012	257	0	2012	13.1000	high
F	14/09/2012	19	19	2012	9	14	2012	257	0	2012	9.6000	high
M	15/09/2012	218	215	2012	9	15	2012	258	5	2007	29.5142	high
M	15/09/2012	230	230	2012	9	15	2012	258	3	2009	25.0000	high
M	15/09/2012	200	202	2012	9	15	2012	258	2	2010	24.5000	high
M	15/09/2012	150	152	2012	9	15	2012	258	1	2011	13.5000	high
M	16/09/2012	184	183	2012	9	16	2012	259	3	2009	24.5330	high
F	16/09/2012	12	12	2012	9	16	2012	259	0	2012	8.7000	high
F	18/09/2012	175	166	2012	9	18	2012	261	2	2010	19.2829	high
M	18/09/2012	146	151	2012	9	18	2012	261	1	2011	14.6000	high
F	19/09/2012	196	193	2012	9	19	2012	262	2	2010	22.7000	high
F	20/09/2012	200	205	2012	9	20	2012	263	5	2007	25.0000	high
F	20/09/2012	169	172	2012	9	20	2012	263	2	2010	20.7000	high
M	20/09/2012	135	142	2012	9	20	2012	263	1	2011	16.6000	high
F	20/09/2012	132	131	2012	9	20	2012	263	1	2011	16.8000	high
F	20/09/2012	101	102	2012	9	20	2012	263	1	2011	12.0000	high
F	21/09/2012	209	202	2012	9	21	2012	264	5	2007	21.8000	high
M	22/09/2012	225	225	2012	9	22	2012	265	3	2009	25.1000	high
M	24/09/2012	220	221	2012	9	24	2012	267	4	2008	26.8000	high
M	24/09/2012	224	232	2012	9	24	2012	267	4	2008	27.8000	high
M	25/09/2012	220	220	2012	9	25	2012	268	8	2004	31.5000	high
F	25/09/2012	208	201	2012	9	25	2012	268	4	2008	21.8000	high
M	25/09/2012	235	236	2012	9	25	2012	268	3	2009	28.0500	high
F	25/09/2012	107	106	2012	9	25	2012	268	1	2011	15.4000	high
M	26/09/2012	220	220	2012	9	26	2012	269	4	2008	23.7957	high
M	26/09/2012	214	212	2012	9	26	2012	269	3	2009	27.2000	high
F	26/09/2012	124	121	2012	9	26	2012	269	1	2011	14.2000	high
F	26/09/2012	112	111	2012	9	26	2012	269	1	2011	13.2000	high
M	26/09/2012	127	130	2012	9	26	2012	269	1	2011	16.2000	high
F	28/09/2012	200	200	2012	9	28	2012	271	10	2002	19.1000	high
F	28/09/2012	205	208	2012	9	28	2012	271	7	2005	22.3500	high
F	28/09/2012	117	117	2012	9	28	2012	271	1	2011	15.0000	high
M	28/09/2012	97	93	2012	9	28	2012	271	1	2011	9.2743	high
M	30/09/2012	220	225	2012	9	30	2012	273	4	2008	19.0000	high
F	30/09/2012	150	152	2012	9	30	2012	273	1	2011	15.5125	high
M	03/10/2012	234	234	2012	10	3	2012	276	5	2007	27.1150	high
M	03/10/2012	220	219	2012	10	3	2012	276	4	2008	27.8000	high
F	04/10/2012	180	184	2012	10	4	2012	277	12	2000	20.0000	high
F	04/10/2012	219	230	2012	10	4	2012	277	10	2002	23.7000	high
F	04/10/2012	197	191	2012	10	4	2012	277	5	2007	24.3000	high
F	04/10/2012	179	181	2012	10	4	2012	277	4	2008	21.5000	high
M	05/10/2012	223	236	2012	10	5	2012	278	4	2008	28.5000	high
M	06/10/2012	229	229	2012	10	6	2012	279	7	2005	35.0000	high
F	11/10/2012	220	217	2012	10	11	2012	284	6	2006	30.0000	high
M	11/10/2012	45	45	2012	10	11	2012	284	0	2012	11.0000	high
F	11/10/2012	29	29	2012	10	11	2012	284	0	2012	11.8402	high
M	13/10/2012	245	240	2012	10	13	2012	286	15	1997	29.2000	low
F	13/10/2012	165	165	2012	10	13	2012	286	10	2002	23.5000	high
M	13/10/2012	215	210	2012	10	13	2012	286	5	2007	32.0000	high
M	13/10/2012	49	49	2012	10	13	2012	286	0	2012	12.0000	high
F	14/10/2012	200	198	2012	10	14	2012	287	8	2004	26.7000	high
M	14/10/2012	216	218	2012	10	14	2012	287	7	2005	38.1000	high
M	14/10/2012	224	232	2012	10	14	2012	287	4	2008	24.3000	high
M	14/10/2012	164	164	2012	10	14	2012	287	1	2011	16.5590	high
M	15/10/2012	241	239	2012	10	15	2012	288	9	2003	30.1000	high
M	15/10/2012	226	221	2012	10	15	2012	288	5	2007	30.0000	high
M	15/10/2012	198	199	2012	10	15	2012	288	4	2008	31.4000	high
M	15/10/2012	141	141	2012	10	15	2012	288	1	2011	16.3000	high
M	16/10/2012	210	208	2012	10	16	2012	289	3	2009	25.7000	high
M	17/10/2012	255	254	2012	10	17	2012	290	9	2003	26.8000	high
M	18/10/2012	205	204	2012	10	18	2012	291	4	2008	26.0000	high
M	20/10/2012	205	205	2012	10	20	2012	293	3	2009	21.8000	high
F	20/10/2012	162	160	2012	10	20	2012	293	1	2011	16.5000	high
F	20/10/2012	119	120	2012	10	20	2012	293	1	2011	15.5000	high
M	20/10/2012	48	48	2012	10	20	2012	293	0	2012	10.0000	high
F	21/10/2012	180	190	2012	10	21	2012	294	5	2007	23.2000	high
F	22/10/2012	172	174	2012	10	22	2012	295	4	2008	19.7000	high
M	23/10/2012	225	220	2012	10	23	2012	296	6	2006	28.0000	high
M	23/10/2012	212	217	2012	10	23	2012	296	4	2008	26.9000	high
M	23/10/2012	145	140	2012	10	23	2012	296	1	2011	18.0000	high
F	24/10/2012	165	160	2012	10	24	2012	297	5	2007	24.0000	high
F	25/10/2012	230	225	2012	10	25	2012	298	15	1997	24.0000	low
M	25/10/2012	199	201	2012	10	25	2012	298	3	2009	26.1000	high
M	25/10/2012	210	218	2012	10	25	2012	298	3	2009	30.6000	high
M	25/10/2012	208	206	2012	10	25	2012	298	2	2010	23.5000	high
M	26/10/2012	224	228	2012	10	26	2012	299	2	2010	25.4000	high
M	31/10/2012	132	133	2012	10	31	2012	304	1	2011	10.3000	high
F	01/11/2012	185	175	2012	11	1	2012	305	9	2003	25.0000	high
M	01/11/2012	248	250	2012	11	1	2012	305	6	2006	27.2995	high
M	01/11/2012	220	220	2012	11	1	2012	305	3	2009	27.5000	high
F	03/11/2012	60	60	2012	11	3	2012	307	0	2012	8.4067	high
F	04/11/2012	202	200	2012	11	4	2012	308	11	2001	22.0000	high
F	04/11/2012	196	197	2012	11	4	2012	308	5	2007	23.8878	high
F	04/11/2012	195	193	2012	11	4	2012	308	4	2008	27.1000	high
M	04/11/2012	21	21	2012	11	4	2012	308	0	2012	14.6857	high
F	06/11/2012	112	115	2012	11	6	2012	310	1	2011	9.0000	high
F	08/11/2012	218	217	2012	11	8	2012	312	14	1998	20.7000	high
F	08/11/2012	187	176	2012	11	8	2012	312	11	2001	19.3000	high
M	08/11/2012	222	226	2012	11	8	2012	312	5	2007	26.5616	high
M	08/11/2012	232	224	2012	11	8	2012	312	5	2007	24.1000	high
M	08/11/2012	216	224	2012	11	8	2012	312	4	2008	24.5000	high
F	09/11/2012	218	217	2012	11	9	2012	313	8	2004	25.6000	high
F	09/11/2012	176	180	2012	11	9	2012	313	7	2005	24.5000	high
F	05/12/2012	266	264	2012	12	5	2012	339	11	2001	23.6500	high
F	14/12/2012	193	195	2012	12	14	2012	348	6	2006	24.8000	high
M	27/12/2012	43	42	2012	12	27	2012	361	0	2012	11.9000	high
F	30/12/2012	210	220	2012	12	30	2012	364	10	2002	21.0000	high
M	30/12/2012	233	240	2012	12	30	2012	364	4	2008	24.0000	high
M	03/01/2013	240	235	2012	1	3	2013	368	5	2007	19.0000	high
F	03/01/2013	188	190	2012	1	3	2013	368	3	2009	21.0000	high
M	03/01/2013	195	187	2012	1	3	2013	368	2	2010	18.5000	high
M	05/01/2013	160	160	2012	1	5	2013	370	1	2011	16.2000	high
M	06/01/2013	250	250	2012	1	6	2013	371	6	2006	22.0000	high
F	08/01/2013	200	198	2012	1	8	2013	373	3	2009	16.6000	high
M	10/01/2013	210	211	2012	1	10	2013	375	3	2009	21.9529	high
F	12/01/2013	220	216	2013	1	12	2013	377	8	2005	21.8000	high
F	12/01/2013	195	190	2012	1	12	2013	377	4	2008	25.5000	high
M	12/01/2013	85	85	2012	1	12	2013	377	0	2012	12.2000	high
M	17/01/2013	208	203	2012	1	17	2013	382	9	2003	20.2000	high
F	17/01/2013	170	172	2012	1	17	2013	382	6	2006	17.7000	high
M	20/01/2013	211	212	2012	1	20	2013	385	5	2007	26.0000	high
F	20/01/2013	205	204	2012	1	20	2013	385	5	2007	18.2000	high
M	20/01/2013	224	225	2012	1	20	2013	385	4	2008	25.6000	high
M	20/01/2013	202	200	2012	1	20	2013	385	3	2009	24.8000	high
M	02/09/2013	215	219	2013	9	2	2013	245	10	2003	29.3000	high
F	02/09/2013	163	164	2013	9	2	2013	245	3	2010	18.0000	high
F	03/09/2013	219	219	2013	9	3	2013	246	7	2006	21.0000	high
M	03/09/2013	217	220	2013	9	3	2013	246	4	2009	24.2000	high
M	03/09/2013	221	224	2013	9	3	2013	246	3	2010	22.3000	high
M	06/09/2013	166	166	2013	9	6	2013	249	2	2011	19.7000	high
F	06/09/2013	95	93	2013	9	6	2013	249	1	2012	16.2000	high
F	06/09/2013	111	112	2013	9	6	2013	249	1	2012	13.5000	high
F	06/09/2013	98	99	2013	9	6	2013	249	1	2012	14.8000	high
F	06/09/2013	108	109	2013	9	6	2013	249	1	2012	16.4000	high
M	08/09/2013	155	156	2013	9	8	2013	251	1	2012	21.5689	high
M	08/09/2013	127	126	2013	9	8	2013	251	1	2012	13.7000	high
F	10/09/2013	111	110	2013	9	10	2013	253	1	2012	16.5000	high
F	11/09/2013	220	222	2013	9	11	2013	254	5	2008	26.2000	high
M	11/09/2013	180	182	2013	9	11	2013	254	3	2010	26.7461	high
F	15/09/2013	200	190	2013	9	15	2013	258	8	2005	21.0000	high
F	17/09/2013	180	182	2013	9	17	2013	260	6	2007	20.4000	high
F	18/09/2013	203	202	2013	9	18	2013	261	4	2009	19.7228	high
M	18/09/2013	213	214	2013	9	18	2013	261	3	2010	23.7000	high
F	19/09/2013	235	236	2013	9	19	2013	262	6	2007	28.0000	high
F	20/09/2013	111	113	2013	9	20	2013	263	1	2012	13.5000	high
F	21/09/2013	190	190	2013	9	21	2013	264	11	2002	21.4700	high
M	21/09/2013	30	31	2013	9	21	2013	264	0	2013	9.7500	high
F	23/09/2013	221	220	2013	9	23	2013	266	13	2000	22.5000	high
F	23/09/2013	176	174	2013	9	23	2013	266	5	2008	18.9000	high
M	23/09/2013	190	193	2013	9	23	2013	266	2	2011	17.7000	high
M	24/09/2013	236	238	2013	9	24	2013	267	11	2002	28.5000	high
M	24/09/2013	228	234	2013	9	24	2013	267	6	2007	30.9000	high
F	24/09/2013	115	116	2013	9	24	2013	267	1	2012	16.0000	high
F	25/09/2013	232	236	2013	9	25	2013	268	12	2001	21.6000	high
M	25/09/2013	247	245	2013	9	25	2013	268	8	2005	23.4500	high
M	25/09/2013	134	128	2013	9	25	2013	268	1	2012	17.0500	high
F	25/09/2013	91	96	2013	9	25	2013	268	1	2012	14.9612	high
M	26/09/2013	208	208	2013	9	26	2013	269	4	2009	24.0000	high
M	26/09/2013	236	239	2013	9	26	2013	269	4	2009	27.2000	high
M	26/09/2013	208	208	2013	9	26	2013	269	4	2009	26.6500	high
M	26/09/2013	225	227	2013	9	26	2013	269	4	2009	29.7500	high
M	26/09/2013	201	200	2013	9	26	2013	269	3	2010	23.5500	high
M	26/09/2013	176	176	2013	9	26	2013	269	2	2011	19.1000	high
M	26/09/2013	200	198	2013	9	26	2013	269	2	2011	23.1000	high
F	27/09/2013	213	210	2013	9	27	2013	270	7	2006	20.7000	high
F	28/09/2013	130	131	2013	9	28	2013	271	1	2012	17.9800	high
F	28/09/2013	22	22	2013	9	28	2013	271	0	2013	10.1444	high
F	29/09/2013	132	134	2013	9	29	2013	272	1	2012	18.1000	high
F	02/10/2013	196	189	2013	10	2	2013	275	8	2005	21.7687	high
F	02/10/2013	177	171	2013	10	2	2013	275	8	2005	21.9069	high
M	02/10/2013	220	220	2013	10	2	2013	275	4	2009	25.2000	high
M	02/10/2013	210	210	2013	10	2	2013	275	2	2011	26.1000	high
M	02/10/2013	36	34	2013	10	2	2013	275	0	2013	10.1040	high
M	02/10/2013	70	80	2013	10	2	2013	275	0	2013	5.0000	high
F	02/10/2013	40	30	2013	10	2	2013	275	0	2013	6.5000	high
F	03/10/2013	212	217	2013	10	3	2013	276	6	2007	21.8000	high
F	03/10/2013	120	118	2013	10	3	2013	276	1	2012	16.0000	high
F	03/10/2013	104	106	2013	10	3	2013	276	1	2012	16.2500	high
M	03/10/2013	50	50	2013	10	3	2013	276	0	2013	13.6755	high
M	05/10/2013	190	193	2013	10	5	2013	278	4	2009	31.1000	high
F	05/10/2013	170	181	2013	10	5	2013	278	4	2009	26.2000	high
F	08/10/2013	174	172	2013	10	8	2013	281	2	2011	22.2000	high
M	08/10/2013	23	22	2013	10	8	2013	281	0	2013	8.7000	high
M	10/10/2013	216	214	2013	10	10	2013	283	5	2008	30.9500	high
M	10/10/2013	242	245	2013	10	10	2013	283	5	2008	32.1000	high
M	10/10/2013	214	224	2013	10	10	2013	283	3	2010	33.4000	high
F	10/10/2013	137	142	2013	10	10	2013	283	1	2012	18.9608	high
F	10/10/2013	127	123	2013	10	10	2013	283	1	2012	21.0319	high
M	12/10/2013	221	219	2013	10	12	2013	285	4	2009	31.4600	high
M	12/10/2013	222	225	2013	10	12	2013	285	4	2009	26.2000	high
M	12/10/2013	185	190	2013	10	12	2013	285	2	2011	19.8000	high
F	12/10/2013	120	119	2013	10	12	2013	285	1	2012	15.6000	high
F	13/10/2013	192	197	2013	10	13	2013	286	10	2003	24.7174	high
F	15/10/2013	180	183	2013	10	15	2013	288	11	2002	19.4000	high
F	15/10/2013	188	192	2013	10	15	2013	288	7	2006	24.8500	high
F	15/10/2013	174	166	2013	10	15	2013	288	3	2010	21.2000	high
F	15/10/2013	115	116	2013	10	15	2013	288	1	2012	19.0500	high
F	20/10/2013	200	200	2013	10	20	2013	293	10	2003	24.0000	high
M	20/10/2013	250	210	2013	10	20	2013	293	4	2009	26.0000	high
M	20/10/2013	85	85	2013	10	20	2013	293	1	2012	17.6000	high
M	24/10/2013	242	246	2013	10	24	2013	297	10	2003	30.4000	high
F	24/10/2013	175	176	2013	10	24	2013	297	9	2004	25.0000	high
F	24/10/2013	214	212	2013	10	24	2013	297	4	2009	19.5000	high
F	24/10/2013	170	170	2013	10	24	2013	297	3	2010	22.0000	high
F	24/10/2013	158	161	2013	10	24	2013	297	2	2011	18.6000	high
M	24/10/2013	36	37	2013	10	24	2013	297	0	2013	10.2100	high
F	25/10/2013	198	203	2013	10	25	2013	298	4	2009	24.0000	high
M	25/10/2013	211	212	2013	10	25	2013	298	2	2011	23.8500	high
M	25/10/2013	199	197	2013	10	25	2013	298	2	2011	23.2500	high
M	25/10/2013	217	215	2013	10	25	2013	298	2	2011	22.0000	high
F	26/10/2013	168	168	2013	10	26	2013	299	8	2005	23.0000	high
M	26/10/2013	225	225	2013	10	26	2013	299	4	2009	29.0000	high
F	27/10/2013	195	198	2013	10	27	2013	300	9	2004	24.0000	high
M	27/10/2013	214	215	2013	10	27	2013	300	2	2011	22.8742	high
F	29/10/2013	176	180	2013	10	29	2013	302	3	2010	20.4000	high
F	29/10/2013	30	30	2013	10	29	2013	302	0	2013	11.8000	high
F	30/10/2013	126	129	2013	10	30	2013	303	1	2012	16.1000	high
M	30/10/2013	44	40	2013	10	30	2013	303	0	2013	8.7000	high
F	30/10/2013	40	40	2013	10	30	2013	303	0	2013	11.1000	high
M	30/10/2013	52	52	2013	10	30	2013	303	0	2013	10.5000	high
F	30/10/2013	34	36	2013	10	30	2013	303	0	2013	9.2000	high
M	31/10/2013	232	234	2013	10	31	2013	304	6	2007	27.0000	high
M	31/10/2013	210	216	2013	10	31	2013	304	5	2008	28.0000	high
F	01/11/2013	175	175	2013	11	1	2013	305	7	2006	24.5000	high
M	01/11/2013	215	215	2013	11	1	2013	305	6	2007	29.5000	high
F	07/11/2013	209	207	2013	11	7	2013	311	12	2001	18.1500	high
F	07/11/2013	161	160	2013	11	7	2013	311	2	2011	20.9500	high
F	07/11/2013	41	47	2013	11	7	2013	311	0	2013	12.5370	high
F	08/11/2013	181	177	2013	11	8	2013	312	5	2008	19.6000	high
M	08/11/2013	222	222	2013	11	8	2013	312	4	2009	26.4500	high
M	08/11/2013	220	222	2013	11	8	2013	312	3	2010	23.9000	high
F	08/11/2013	25	24	2013	11	8	2013	312	0	2013	10.4000	high
M	10/11/2013	226	227	2013	11	10	2013	314	7	2006	24.5000	high
M	11/11/2013	207	205	2013	11	11	2013	315	8	2005	25.2000	high
F	11/11/2013	210	220	2013	11	11	2013	315	8	2005	26.7600	high
M	11/11/2013	197	199	2013	11	11	2013	315	2	2011	22.6000	high
M	08/12/2013	222	219	2013	12	8	2013	342	2	2011	22.8742	high
M	12/12/2013	210	205	2013	12	12	2013	346	7	2006	21.0000	high
M	12/12/2013	200	200	2013	12	12	2013	346	3	2010	21.0000	high
M	12/12/2013	165	167	2013	12	12	2013	346	1	2012	20.0000	high
M	13/12/2013	202	203	2013	12	13	2013	347	3	2010	21.0000	high
F	14/12/2013	200	185	2013	12	14	2013	348	5	2008	19.5000	high
M	14/12/2013	200	200	2013	12	14	2013	348	4	2009	21.1000	high
M	15/12/2013	262	270	2013	12	15	2013	349	8	2005	27.5000	high
M	18/12/2013	225	222	2013	12	18	2013	352	8	2005	20.0000	high
M	18/12/2013	242	233	2013	12	18	2013	352	5	2008	20.7000	high
M	18/12/2013	240	238	2013	12	18	2013	352	3	2010	21.6000	high
M	18/12/2013	214	216	2013	12	18	2013	352	3	2010	20.7000	high
M	18/12/2013	219	215	2013	12	18	2013	352	3	2010	23.2000	high
M	19/12/2013	213	215	2013	12	19	2013	353	13	2000	21.0000	high
M	19/12/2013	240	240	2013	12	19	2013	353	11	2002	24.2000	high
M	19/12/2013	233	235	2013	12	19	2013	353	5	2008	22.1000	high
M	19/12/2013	217	216	2013	12	19	2013	353	4	2009	18.6000	high
F	19/12/2013	168	165	2013	12	19	2013	353	2	2011	21.7000	high
F	19/12/2013	48	44	2013	12	19	2013	353	0	2013	11.9000	high
M	22/12/2013	208	210	2013	12	22	2013	356	4	2009	22.0000	high
M	28/12/2013	235	233	2013	12	28	2013	362	8	2005	22.0000	high
M	01/01/2014	211	211	2013	1	1	2014	366	5	2008	19.3000	high
M	07/01/2014	260	270	2013	1	7	2014	372	8	2005	29.2000	high
M	08/01/2014	149	148	2013	1	8	2014	373	1	2012	18.9700	high
F	09/01/2014	173	175	2013	1	9	2014	374	10	2003	18.0000	high
M	09/01/2014	142	142	2013	1	9	2014	374	1	2012	15.9000	high
F	10/01/2014	204	202	2013	1	10	2014	375	3	2010	23.7957	high
M	11/01/2014	228	232	2013	1	11	2014	376	9	2004	22.2000	high
F	11/01/2014	215	216	2013	1	11	2014	376	8	2005	20.0000	high
F	11/01/2014	184	184	2013	1	11	2014	376	5	2008	20.0000	high
M	11/01/2014	235	230	2013	1	11	2014	376	4	2009	22.0000	high
F	18/01/2014	151	155	2013	1	18	2014	383	3	2010	16.2000	high
M	18/01/2014	177	170	2013	1	18	2014	383	1	2012	15.0000	high
F	08/09/2014	182	183	2014	9	8	2014	251	6	2008	20.4795	high
F	11/09/2014	224	229	2014	9	11	2014	254	8	2006	20.5000	high
F	11/09/2014	186	190	2014	9	11	2014	254	7	2007	24.4000	high
F	11/09/2014	192	188	2014	9	11	2014	254	5	2009	19.8000	high
M	11/09/2014	145	150	2014	9	11	2014	254	1	2013	17.3000	high
F	14/09/2014	185	183	2014	9	14	2014	257	3	2011	23.0000	high
M	15/09/2014	227	226	2014	9	15	2014	258	4	2010	29.6000	high
F	15/09/2014	189	189	2014	9	15	2014	258	4	2010	23.3000	high
M	16/09/2014	233	231	2014	9	16	2014	259	3	2011	29.3000	high
M	17/09/2014	198	198	2014	9	17	2014	260	4	2010	31.5000	high
M	17/09/2014	230	230	2014	9	17	2014	260	4	2010	28.0000	high
F	19/09/2014	200	203	2014	9	19	2014	262	11	2003	21.9000	high
F	20/09/2014	200	165	2014	9	20	2014	263	13	2001	29.3296	high
F	20/09/2014	161	165	2014	9	20	2014	263	2	2012	26.0000	high
M	22/09/2014	215	207	2014	9	22	2014	265	4	2010	28.3000	high
M	22/09/2014	223	217	2014	9	22	2014	265	3	2011	23.9500	high
F	22/09/2014	176	180	2014	9	22	2014	265	3	2011	19.4500	high
F	23/09/2014	188	190	2014	9	23	2014	266	7	2007	22.2500	high
F	23/09/2014	204	195	2014	9	23	2014	266	4	2010	22.8500	high
M	24/09/2014	240	240	2014	9	24	2014	267	9	2005	26.0000	high
M	25/09/2014	195	195	2014	9	25	2014	268	4	2010	30.0000	high
F	27/09/2014	210	210	2014	9	27	2014	270	10	2004	20.0000	high
F	27/09/2014	118	112	2014	9	27	2014	270	1	2013	9.8507	high
F	29/09/2014	180	208	2014	9	29	2014	272	14	2000	18.4000	high
F	29/09/2014	220	217	2014	9	29	2014	272	12	2002	21.6000	high
F	29/09/2014	170	168	2014	9	29	2014	272	3	2011	22.8000	high
F	30/09/2014	180	185	2014	9	30	2014	273	9	2005	23.0000	high
M	30/09/2014	200	205	2014	9	30	2014	273	5	2009	28.9000	high
M	30/09/2014	210	204	2014	9	30	2014	273	3	2011	18.8000	high
M	04/10/2014	222	221	2014	10	4	2014	277	5	2009	30.0000	high
M	05/10/2014	225	226	2014	10	5	2014	278	5	2009	33.2000	high
F	05/10/2014	105	106	2014	10	5	2014	278	1	2013	22.0000	high
F	07/10/2014	202	201	2014	10	7	2014	280	15	1999	25.1000	high
F	07/10/2014	182	185	2014	10	7	2014	280	12	2002	21.5000	high
M	09/10/2014	200	200	2014	10	9	2014	282	4	2010	36.4716	high
F	10/10/2014	210	220	2014	10	10	2014	283	11	2003	24.5000	high
F	11/10/2014	202	196	2014	10	11	2014	284	10	2004	23.0000	high
M	11/10/2014	230	215	2014	10	11	2014	284	5	2009	28.0000	high
M	11/10/2014	209	210	2014	10	11	2014	284	4	2010	31.7000	high
M	12/10/2014	210	210	2014	10	12	2014	285	10	2004	26.5000	high
F	12/10/2014	162	162	2014	10	12	2014	285	2	2012	21.2161	high
F	13/10/2014	218	220	2014	10	13	2014	286	14	2000	23.3000	high
F	13/10/2014	204	206	2014	10	13	2014	286	11	2003	23.8000	high
F	13/10/2014	104	103	2014	10	13	2014	286	1	2013	15.7882	high
F	15/10/2014	166	168	2014	10	15	2014	288	6	2008	22.2000	high
F	16/10/2014	215	220	2014	10	16	2014	289	6	2008	19.7000	high
M	16/10/2014	209	216	2014	10	16	2014	289	4	2010	25.3000	high
M	16/10/2014	210	210	2014	10	16	2014	289	4	2010	26.5000	high
M	16/10/2014	140	140	2014	10	16	2014	289	1	2013	14.7775	high
M	17/10/2014	222	222	2014	10	17	2014	290	7	2007	30.1000	high
M	17/10/2014	247	240	2014	10	17	2014	290	5	2009	31.3000	high
M	17/10/2014	188	185	2014	10	17	2014	290	3	2011	28.2000	high
M	18/10/2014	191	191	2014	10	18	2014	291	10	2004	28.4067	high
M	19/10/2014	204	205	2014	10	19	2014	292	4	2010	32.1000	high
F	21/10/2014	193	184	2014	10	21	2014	294	2	2012	16.0000	high
M	22/10/2014	215	216	2014	10	22	2014	295	6	2008	33.0000	high
F	23/10/2014	152	150	2014	10	23	2014	296	1	2013	23.1000	high
M	23/10/2014	146	149	2014	10	23	2014	296	1	2013	24.5000	high
F	24/10/2014	240	235	2014	10	24	2014	297	12	2002	22.0500	high
F	24/10/2014	119	114	2014	10	24	2014	297	1	2013	14.9153	high
M	25/10/2014	242	250	2014	10	25	2014	298	5	2009	28.0000	high
F	26/10/2014	210	208	2014	10	26	2014	299	9	2005	27.0000	high
M	26/10/2014	206	206	2014	10	26	2014	299	3	2011	23.6000	high
F	30/10/2014	235	238	2014	10	30	2014	303	11	2003	19.0000	high
M	01/11/2014	216	226	2014	11	1	2014	305	5	2009	25.6500	high
M	01/11/2014	185	182	2014	11	1	2014	305	2	2012	22.0000	high
M	01/11/2014	35	36	2014	11	1	2014	305	0	2014	10.2000	high
F	02/11/2014	216	216	2014	11	2	2014	306	6	2008	28.8000	high
F	02/11/2014	144	145	2014	11	2	2014	306	1	2013	16.9500	high
M	03/11/2014	231	231	2014	11	3	2014	307	3	2011	24.9000	high
M	03/11/2014	222	224	2014	11	3	2014	307	2	2012	26.3000	high
M	04/11/2014	221	229	2014	11	4	2014	308	4	2010	25.4000	high
F	04/11/2014	175	177	2014	11	4	2014	308	4	2010	17.1000	high
F	06/11/2014	202	200	2014	11	6	2014	310	9	2005	24.4000	high
M	07/11/2014	204	202	2014	11	7	2014	311	4	2010	23.4000	high
M	07/11/2014	222	224	2014	11	7	2014	311	3	2011	24.1000	high
F	09/11/2014	191	190	2014	11	9	2014	313	4	2010	22.0000	high
M	09/11/2014	132	132	2014	11	9	2014	313	1	2013	18.2000	high
M	11/11/2014	210	211	2013	11	11	2014	315	4	2009	20.0000	high
F	29/11/2014	126	126	2014	11	29	2014	333	1	2013	18.0000	high
F	30/11/2014	170	175	2014	11	30	2014	334	5	2009	16.5000	high
F	02/12/2014	210	212	2014	12	2	2014	336	6	2008	21.4000	high
F	11/12/2014	205	209	2014	12	11	2014	345	8	2006	18.8000	high
F	11/12/2014	186	182	2014	12	11	2014	345	7	2007	24.6000	high
F	11/12/2014	214	212	2014	12	11	2014	345	7	2007	27.1000	high
M	12/12/2014	215	218	2014	12	12	2014	346	5	2009	23.0000	high
F	13/12/2014	218	215	2014	12	13	2014	347	8	2006	22.4135	high
M	17/12/2014	224	226	2014	12	17	2014	351	5	2009	23.0000	high
M	18/12/2014	226	227	2014	12	18	2014	352	8	2006	23.2000	high
M	23/12/2014	243	234	2014	12	23	2014	357	4	2010	21.7000	high
F	23/12/2014	181	179	2014	12	23	2014	357	2	2012	16.8000	high
F	31/12/2014	223	221	2014	12	31	2014	365	7	2007	24.5315	high
M	04/01/2015	205	205	2014	1	4	2015	369	3	2011	17.2500	high
M	06/01/2015	201	209	2014	1	6	2015	371	5	2009	25.1000	high
F	06/01/2015	131	133	2014	1	6	2015	371	1	2013	16.8000	high
F	10/01/2015	260	255	2014	1	10	2015	375	16	1998	21.2000	high
M	10/01/2015	200	210	2014	1	10	2015	375	3	2011	21.0000	high
M	10/01/2015	155	155	2014	1	10	2015	375	1	2013	12.0000	high
M	11/01/2015	158	155	2014	1	11	2015	376	1	2013	13.0000	high
F	01/09/2015	198	195	2015	9	1	2015	244	12	2003	17.9028	high
F	01/09/2015	216	218	2015	9	1	2015	244	12	2003	17.8108	high
F	01/09/2015	196	194	2015	9	1	2015	244	11	2004	18.7000	high
M	03/09/2015	246	245	2015	9	3	2015	246	12	2003	23.1000	high
M	03/09/2015	201	201	2015	9	3	2015	246	4	2011	25.0000	high
M	08/09/2015	139	140	2015	9	8	2015	251	1	2014	16.0000	high
M	08/09/2015	165	160	2015	9	8	2015	251	1	2014	14.7000	high
F	08/09/2015	98	91	2015	9	8	2015	251	1	2014	10.6000	high
F	10/09/2015	102	101	2015	9	10	2015	253	1	2014	12.2000	high
M	11/09/2015	215	218	2015	9	11	2015	254	4	2011	27.4000	high
F	11/09/2015	126	128	2015	9	11	2015	254	1	2014	20.2000	high
M	11/09/2015	145	152	2015	9	11	2015	254	1	2014	15.3000	high
M	14/09/2015	209	213	2015	9	14	2015	257	4	2011	27.6000	high
F	14/09/2015	170	168	2015	9	14	2015	257	3	2012	17.0000	high
M	15/09/2015	219	218	2015	9	15	2015	258	4	2011	31.7000	high
M	15/09/2015	209	208	2015	9	15	2015	258	2	2013	22.1000	high
M	16/09/2015	215	210	2015	9	16	2015	259	5	2010	29.0000	high
F	17/09/2015	210	213	2015	9	17	2015	260	8	2007	25.0000	high
F	18/09/2015	195	199	2015	9	18	2015	261	17	1998	24.8000	high
F	18/09/2015	120	122	2015	9	18	2015	261	1	2014	17.0000	high
M	18/09/2015	142	142	2015	9	18	2015	261	1	2014	14.7775	high
F	18/09/2015	84	86	2015	9	18	2015	261	1	2014	8.8166	high
M	20/09/2015	210	210	2015	9	20	2015	263	5	2010	31.4000	high
M	21/09/2015	225	224	2015	9	21	2015	264	11	2004	29.9000	high
F	21/09/2015	198	196	2015	9	21	2015	264	4	2011	22.0000	high
M	21/09/2015	209	214	2015	9	21	2015	264	2	2013	23.2000	high
M	21/09/2015	203	206	2015	9	21	2015	264	2	2013	19.9000	high
M	24/09/2015	157	158	2015	9	24	2015	267	1	2014	19.1000	high
F	25/09/2015	214	212	2015	9	25	2015	268	15	2000	21.8000	high
F	25/09/2015	201	205	2015	9	25	2015	268	13	2002	23.8000	high
F	25/09/2015	201	207	2015	9	25	2015	268	5	2010	20.6000	high
F	25/09/2015	105	108	2015	9	25	2015	268	1	2014	14.4101	high
M	27/09/2015	220	220	2015	9	27	2015	270	9	2006	22.8742	high
F	27/09/2015	165	165	2015	9	27	2015	270	2	2013	20.0000	high
F	30/09/2015	146	146	2015	9	30	2015	273	1	2014	19.4000	high
F	01/10/2015	198	182	2015	10	1	2015	274	9	2006	23.6000	high
M	01/10/2015	192	192	2015	10	1	2015	274	7	2008	24.5000	high
F	01/10/2015	224	228	2015	10	1	2015	274	6	2009	22.1000	high
M	01/10/2015	224	225	2015	10	1	2015	274	5	2010	28.2000	high
M	03/10/2015	230	230	2015	10	3	2015	276	4	2011	30.3500	high
M	04/10/2015	220	220	2015	10	4	2015	277	4	2011	29.5000	high
M	04/10/2015	185	185	2015	10	4	2015	277	1	2014	19.8500	high
M	08/10/2015	205	200	2015	10	8	2015	281	3	2012	21.0000	high
F	09/10/2015	227	226	2015	10	9	2015	282	13	2002	19.0900	high
F	09/10/2015	203	203	2015	10	9	2015	282	12	2003	18.7000	high
F	09/10/2015	219	218	2015	10	9	2015	282	6	2009	24.0000	high
M	10/10/2015	225	225	2015	10	10	2015	283	3	2012	27.0000	high
F	10/10/2015	121	122	2015	10	10	2015	283	1	2014	19.5000	high
M	10/10/2015	168	169	2015	10	10	2015	283	1	2014	16.1000	high
F	11/10/2015	200	190	2015	10	11	2015	284	8	2007	19.0000	high
F	11/10/2015	184	185	2015	10	11	2015	284	7	2008	18.7000	high
M	11/10/2015	140	140	2015	10	11	2015	284	1	2014	16.1000	high
M	17/10/2015	118	118	2015	10	17	2015	290	1	2014	17.1000	high
M	18/10/2015	210	212	2015	10	18	2015	291	3	2012	30.0000	high
M	21/10/2015	144	145	2015	10	21	2015	294	4	2011	24.5000	high
M	22/10/2015	135	135	2015	10	22	2015	295	1	2014	20.0000	high
M	24/10/2015	186	183	2015	10	24	2015	297	5	2010	29.8834	high
M	24/10/2015	206	208	2015	10	24	2015	297	5	2010	38.1000	high
F	24/10/2015	189	191	2015	10	24	2015	297	5	2010	22.3214	high
F	24/10/2015	175	174	2015	10	24	2015	297	4	2011	26.8000	high
F	25/10/2015	185	190	2015	10	25	2015	298	5	2010	23.5000	high
M	25/10/2015	155	157	2015	10	25	2015	298	1	2014	19.1909	high
F	28/10/2015	187	189	2015	10	28	2015	301	12	2003	14.4000	high
M	28/10/2015	214	213	2015	10	28	2015	301	7	2008	29.1000	high
F	29/10/2015	195	200	2015	10	29	2015	302	6	2009	24.2000	high
M	31/10/2015	210	240	2015	10	31	2015	304	4	2011	17.0000	high
F	31/10/2015	220	220	2015	10	31	2015	304	4	2011	22.0000	high
F	31/10/2015	138	138	2015	10	31	2015	304	1	2014	17.8000	high
F	01/11/2015	216	214	2015	11	1	2015	305	7	2008	25.8500	high
M	02/11/2015	160	160	2015	11	2	2015	306	1	2014	16.9000	high
F	02/11/2015	126	132	2015	11	2	2015	306	1	2014	14.3000	high
M	03/11/2015	209	205	2015	11	3	2015	307	4	2011	28.4000	high
M	03/11/2015	208	209	2015	11	3	2015	307	3	2012	18.2000	high
M	03/11/2015	190	204	2015	11	3	2015	307	2	2013	19.6000	high
M	05/11/2015	161	161	2015	11	5	2015	309	1	2014	18.0000	high
F	06/11/2015	180	177	2015	11	6	2015	310	4	2011	21.3000	high
M	06/11/2015	194	197	2015	11	6	2015	310	2	2013	23.0000	high
M	06/11/2015	161	164	2015	11	6	2015	310	1	2014	18.2000	high
M	07/11/2015	190	190	2015	11	7	2015	311	4	2011	28.2000	high
M	07/11/2015	220	220	2015	11	7	2015	311	3	2012	24.7174	high
M	07/11/2015	160	165	2015	11	7	2015	311	2	2013	20.0000	high
F	08/11/2015	189	191	2015	11	8	2015	312	6	2009	23.0000	high
M	09/11/2015	236	232	2015	11	9	2015	313	6	2009	24.0000	high
F	09/11/2015	185	191	2015	11	9	2015	313	4	2011	22.8000	high
M	09/11/2015	206	208	2015	11	9	2015	313	4	2011	24.0000	high
F	10/11/2015	206	208	2015	11	10	2015	314	13	2002	22.3000	high
M	10/11/2015	212	212	2015	11	10	2015	314	4	2011	27.0000	high
F	10/11/2015	180	180	2015	11	10	2015	314	2	2013	19.6000	high
F	02/12/2015	200	195	2015	12	2	2015	336	3	2012	21.5000	high
F	02/12/2015	30	30	2015	12	2	2015	336	0	2015	11.0000	high
F	03/12/2015	280	274	2015	12	3	2015	337	14	2001	29.3296	high
M	03/12/2015	204	200	2015	12	3	2015	337	4	2011	23.2000	high
M	04/12/2015	211	211	2015	12	4	2015	338	3	2012	22.0000	high
F	05/12/2015	220	225	2015	12	5	2015	339	6	2009	20.0000	high
M	08/12/2015	227	240	2015	12	8	2015	342	7	2008	22.2000	high
M	08/12/2015	240	240	2015	12	8	2015	342	3	2012	22.0000	high
F	10/12/2015	225	215	2015	12	10	2015	344	13	2002	19.7000	high
F	10/12/2015	188	188	2015	12	10	2015	344	8	2007	21.9000	high
F	10/12/2015	189	188	2015	12	10	2015	344	7	2008	21.8000	high
F	10/12/2015	203	205	2015	12	10	2015	344	6	2009	24.4000	high
M	10/12/2015	222	230	2015	12	10	2015	344	5	2010	28.2000	high
M	10/12/2015	215	210	2015	12	10	2015	344	2	2013	18.0000	high
M	10/12/2015	205	204	2015	12	10	2015	344	2	2013	20.0000	high
F	12/12/2015	180	180	2015	12	12	2015	346	5	2010	19.0000	high
M	19/12/2015	205	205	2015	12	19	2015	353	6	2009	21.4000	high
F	22/12/2015	198	200	2015	12	22	2015	356	5	2010	24.8000	high
M	22/12/2015	220	218	2015	12	22	2015	356	4	2011	25.2000	high
F	24/12/2015	195	190	2015	12	24	2015	358	9	2006	20.4500	high
F	26/12/2015	205	204	2015	12	26	2015	360	12	2003	22.0000	high
M	26/12/2015	230	225	2015	12	26	2015	360	5	2010	29.0000	high
M	26/12/2015	35	34	2015	12	26	2015	360	0	2015	12.0000	high
M	27/12/2015	220	220	2015	12	27	2015	361	5	2010	32.0000	high
M	29/12/2015	75	75	2015	12	29	2015	363	0	2015	12.0000	high
M	31/12/2015	180	175	2015	12	31	2015	365	4	2011	26.0000	high
F	10/01/2016	218	210	2015	1	10	2016	375	8	2007	19.6510	high
M	12/01/2016	227	225	2015	1	12	2016	377	3	2012	29.0000	high
M	16/01/2016	223	224	2015	1	16	2016	381	9	2006	22.8000	high
M	02/09/2016	205	205	2016	9	2	2016	245	8	2008	24.5000	high
M	02/09/2016	149	143	2016	9	2	2016	245	1	2015	17.3000	high
M	02/09/2016	87	92	2016	9	2	2016	245	1	2015	12.6659	high
M	02/09/2016	123	126	2016	9	2	2016	245	1	2015	16.5000	high
M	02/09/2016	153	150	2016	9	2	2016	245	1	2015	16.3000	high
F	02/09/2016	110	95	2016	9	2	2016	245	1	2015	12.5000	high
F	06/09/2016	206	208	2016	9	6	2016	249	11	2005	19.9000	high
M	06/09/2016	149	146	2016	9	6	2016	249	1	2015	16.8000	high
F	08/09/2016	193	200	2016	9	8	2016	251	5	2011	18.5000	high
F	08/09/2016	118	117	2016	9	8	2016	251	1	2015	13.5000	high
F	09/09/2016	190	193	2016	9	9	2016	252	6	2010	18.6000	high
M	09/09/2016	144	144	2016	9	9	2016	252	1	2015	15.2000	high
F	13/09/2016	183	183	2016	9	13	2016	256	7	2009	21.2000	high
M	13/09/2016	207	206	2016	9	13	2016	256	7	2009	25.8000	high
M	13/09/2016	232	235	2016	9	13	2016	256	6	2010	30.0100	high
M	13/09/2016	250	250	2016	9	13	2016	256	6	2010	28.2000	high
F	13/09/2016	207	207	2016	9	13	2016	256	4	2012	18.2000	high
M	19/09/2016	220	221	2016	9	19	2016	262	4	2012	26.5000	high
F	20/09/2016	180	182	2016	9	20	2016	263	9	2007	19.6000	high
F	20/09/2016	175	178	2016	9	20	2016	263	2	2014	19.5000	high
M	20/09/2016	214	215	2016	9	20	2016	263	2	2014	24.1000	high
M	24/09/2016	145	142	2016	9	24	2016	267	1	2015	19.1000	high
M	25/09/2016	21	21	2016	9	25	2016	268	0	2016	10.1500	high
M	26/09/2016	244	245	2016	9	26	2016	269	8	2008	26.5000	high
M	26/09/2016	175	175	2016	9	26	2016	269	1	2015	19.5000	high
M	27/09/2016	179	180	2016	9	27	2016	270	2	2014	22.2000	high
F	28/09/2016	192	191	2016	9	28	2016	271	11	2005	24.4000	high
M	28/09/2016	33	34	2016	9	28	2016	271	0	2016	9.0000	high
M	30/09/2016	212	212	2016	9	30	2016	273	2	2014	27.5000	high
M	30/09/2016	218	215	2016	9	30	2016	273	2	2014	23.8000	high
M	03/10/2016	213	214	2016	10	3	2016	276	5	2011	29.5000	high
M	03/10/2016	225	225	2016	10	3	2016	276	3	2013	26.5000	high
M	04/10/2016	222	222	2016	10	4	2016	277	3	2013	28.7000	high
M	20/10/2016	190	190	2016	10	20	2016	293	5	2011	28.0000	high
M	20/10/2016	160	160	2016	10	20	2016	293	1	2015	16.5000	high
M	22/10/2016	237	242	2016	10	22	2016	295	10	2006	29.0000	high
F	23/10/2016	225	220	2016	10	23	2016	296	11	2005	22.0000	high
F	30/10/2016	190	180	2016	10	30	2016	303	4	2012	24.2000	high
M	30/10/2016	225	230	2016	10	30	2016	303	4	2012	26.4000	high
F	30/10/2016	148	144	2016	10	30	2016	303	1	2015	20.6000	high
M	27/11/2016	30	30	2016	11	27	2016	331	0	2016	11.0000	high
F	01/12/2016	200	197	2015	12	1	2016	335	5	2010	20.5000	high
F	01/12/2016	134	136	2016	12	1	2016	335	1	2015	16.4000	high
M	22/12/2016	214	209	2016	12	22	2016	356	3	2013	29.0000	high
M	27/12/2016	170	168	2016	12	27	2016	361	0	2016	16.5000	high
F	01/01/2017	235	230	2016	1	1	2017	366	7	2009	22.4500	high
